title,url,author,score,created,numComms,permalink,flair,body
Secret Network - SEFI is Live on Mainnet! #Ethereum #DeFi,https://www.reddit.com/r/Compound/comments/mhb8jj/secret_network_sefi_is_live_on_mainnet_ethereum/,dogslayer007,1,2021-04-01 01:32:43,4,/r/Compound/comments/mhb8jj/secret_network_sefi_is_live_on_mainnet_ethereum/,NaN," 

Hey all! I am a member of the Secret Network community, and I want to share some news related to the $SEFI governance token that launched today! $SEFI will focus on governance of [SecretSwap](https://scrt.network/blog/secretswap-is-live-on-mainnet), the first cross-chain, front-running resistant decentralized exchange, which launched on mainnet in February.

$SEFI is a Secret Finance governance token like $UNI for Uniswap and $SUSHI for Sushiswap that will unlock all kinds of yield farming opportunities within the Secret Network ecosystem. Full details can be found in the blog post I’d like to share here: ([SEFI is Live on Mainnet! - Secret Network](https://scrt.network/blog/sefi-is-live-on-mainnet))

The following groups are eligible to claim their $SEFI today: SCRT Stakers, LP’s to SecretSwap pre-genesis, SecretBridgde Users (selected groups).  Learn more about $SEFI distribution here([LINK](https://scrt.network/blog/sefi-governance-token-for-secret-defi))"
Unable to Connect Ledger S to Compound,https://www.reddit.com/r/Compound/comments/mhdthf/unable_to_connect_ledger_s_to_compound/,vinlo,1,2021-04-01 03:34:20,3,/r/Compound/comments/mhdthf/unable_to_connect_ledger_s_to_compound/,NaN,"I staked some tokens on Compound about a year ago using my Nano S. When I try to connect my Ledger to Compound again today, I keep getting the ""Ledger Connection Failed"" dialog. I have the latest firmware and app updates, Contract Data is on, and there is no option to enable Browser Support (because apparently that's enabled by default now on the Ledger, so that message is out of date.)

What is going on??"
What is the point of Compound anyway?,https://www.reddit.com/r/Compound/comments/mhdvdk/what_is_the_point_of_compound_anyway/,Draqqonfly,1,2021-04-01 03:36:55,7,/r/Compound/comments/mhdvdk/what_is_the_point_of_compound_anyway/,NaN,"First of all - I'm newbie in this topic so please be forgiving ;p 

Could someone explain to me what is the point of Compound protocol? It's supposed to work as a lending/borrowing platform for cryptos. Alright. AFAIK, in order to borrow some crypto, you have to place into the system some other crypto that has at least the same value, as collateral. That's to prevent the situation when someone borrows crypto and doesn't return it. Ok, but then what is the point of borrowing anyway? Borrowing in ""real life"" occurs when person A doesn't have money, needs the money, so he borrows it from person B and promises him to return it at a later date with some additional interest. Person B (the banks usually) has the power and right to punish Person A if he doesn't fulfill his promise. In Defi, this system cannot work because there are no promises. You have to put in collateral first, in order to borrow. But then. why borrow if you already have the equivalent amount of value in other crypto? Why not to just swpa the cryptos on some exchange?"
Collateral,https://www.reddit.com/r/Compound/comments/mhu759/collateral/,Habben101,1,2021-04-01 20:27:24,7,/r/Compound/comments/mhu759/collateral/,NaN,"Does Compound accept Graph, Filecoin, Reef, UTrust, or/and Sandbox as collateral?"
three websites to earn some free crypto,https://www.reddit.com/r/Compound/comments/miomt7/three_websites_to_earn_some_free_crypto/,gio9619,1,2021-04-03 01:06:54,2,/r/Compound/comments/miomt7/three_websites_to_earn_some_free_crypto/,NaN,"Hi everyone I'm new here and would like to suggest 3 website to earn some free crypto by watching shortlinks or ptc ads, they both allow to withdraw to expresscrypto, [faucetpay](https://faucetpay.io/?r=1219077) coinbase or directly to wallet.

1: the first is [faucetcrypto](https://faucetcrypto.com/ref/781142) it allows to earn some coin through shortlinks and ptc ads, the minimum amount to withdraw is very low and can be reached daily plus it has a level program that gives you more coins by leveling up

2: the second is dutchy corps [dutchy corps](https://autofaucet.dutchycorp.space/?r=france999) that is an autofaucet, it allows to earn by watching shortlinks, ptc ads and surfing ads. It also has a level program that increase the claming amount plus i recommend to run the autofaucet with balance mode to earn an additional 10% and on weekends to earn an additional 20% claim bonus

3: the third is [autoclaim](https://autoclaim.in/r/france999) that allows to earn coin by doing shortlinks very easily, it also has a bonus program and there is no minimum amount to withdraw

I think is a good way to start earn some crypto without spend money, if someone did register and want some tip I use to do the shortlinks and ptc ads quickly feel free to message me."
What happens to the protocol if asset prices fall very fast?,https://www.reddit.com/r/Compound/comments/mitmnf/what_happens_to_the_protocol_if_asset_prices_fall/,alsonotjohnmalkovich,1,2021-04-03 05:05:04,9,/r/Compound/comments/mitmnf/what_happens_to_the_protocol_if_asset_prices_fall/,Question,"Here's a scenario:

1. Some bad news, bug, or whatever (humor me) causes a panic sale of a large chunk of the crypto market, and lots of buyers cancel their orders
2. The market price of the collateral falls and triggers the sale of the collateral at an 8% discount. At this point the value of the collateral is still above the value of assets lent.
3. The price is still falling very fast, only a few arbitrageurs grab the discount because the arbitrage is uncertain, or the protocol isn't moving fast enough
4. The market value of the collateral is now under the value of assets lent. The protocol is still offering a discount. At some point when prices stabilize arbitrageurs will return a portion of the lent assets to the protocol, and that portion will be smaller than the deposits.

Questions:

1. Did I get this right? Am I missing something? Theoretically, is there in fact an asset price decline speed fast enough that could trigger this scenario?
2. Is that plausible in the least? Are we talking Black Swan territory or ""you're more likely to get hit by an asteroid"" territory?
3. How does Compound determine the price of an asset? E.g. how does it know how much USDC an ETH is worth?

I've been looking for an in-depth explanation of the protocol but couldn't find one that goes into that level of detail. If you have something to recommend please do!

Thank you :)"
Approaching 10b locked!,https://i.redd.it/ns9rcc06a4r61.jpg,LivingFlow,1,2021-04-04 16:26:42,5,/r/Compound/comments/mjs8of/approaching_10b_locked/,NaN,
Why is there a borrow cap for COMP tokens,https://www.reddit.com/r/Compound/comments/mjuuvr/why_is_there_a_borrow_cap_for_comp_tokens/,throwaway-is-real,1,2021-04-04 19:55:52,1,/r/Compound/comments/mjuuvr/why_is_there_a_borrow_cap_for_comp_tokens/,NaN,"The title says it all - For some reason, I can't borrow COMP using the web gui as the button states the borrow cap for COMP has been reached. Any clues why? I've not borrows any comp btw."
Yield doesn't reflect interest rate,https://www.reddit.com/r/Compound/comments/mjx6ll/yield_doesnt_reflect_interest_rate/,breview,1,2021-04-04 22:24:15,2,/r/Compound/comments/mjx6ll/yield_doesnt_reflect_interest_rate/,NaN,"I just started lending USDC using Compound on Coinbase Wallet, and noticed that after a couple days, the amount of interest earned is a lot lower than what would be expected based on the APR.  Anyone know what's going on?"
Can i partially repay loan? Or it has to be full amount?,https://www.reddit.com/r/Compound/comments/mk6vjx/can_i_partially_repay_loan_or_it_has_to_be_full/,Adept-Design-5778,2,2021-04-05 06:51:07,2,/r/Compound/comments/mk6vjx/can_i_partially_repay_loan_or_it_has_to_be_full/,NaN,"Hi,

Can i partially repay compound dai loan? Or it has to be full amount?

Those gas fees are to expensive to test it out

thanks in advance"
"Compound is on fire this month, why do you think that is?",https://i.redd.it/pc5qzrd9p9r61.jpg,Cmill810,2,2021-04-05 10:40:07,13,/r/Compound/comments/mkav1f/compound_is_on_fire_this_month_why_do_you_think/,NaN,
three websites to earn some free crypto,https://www.reddit.com/r/Compound/comments/mkmv0f/three_websites_to_earn_some_free_crypto/,gio9619,1,2021-04-05 23:08:13,0,/r/Compound/comments/mkmv0f/three_websites_to_earn_some_free_crypto/,NaN,"Hi everyone, I would like to suggest 3 website to earn some free crypto by watching shortlinks or ptc ads, they both allow to withdraw to expresscrypto, [faucetpay](https://faucetpay.io/?r=1219077) coinbase or directly to wallet.

1: the first is [faucetcrypto](https://faucetcrypto.com/ref/781142) it allows to earn some coin through shortlink,s ptc ads or offerwall, the minimum amount to withdraw is very low and can be reached daily plus it has a level program that gives you more coins by leveling up

2: the second is dutchy corps [dutchy corps](https://autofaucet.dutchycorp.space/?r=france999) that is an autofaucet, it allows to earn by watching shortlinks, ptc ads and surfing ads. It also has a level program that increase the claming amount plus i recommend to run the autofaucet with balance mode to earn an additional 10% and on weekends to earn an additional 20% claim bonus

3: the third is [autoclaim](https://autoclaim.in/r/france999) that allows to earn coin by doing shortlinks very easily, it also has a bonus program and there is no minimum amount to withdraw

I think is a good way to start earn some crypto without spend money, if someone did register and want some tip I use to do the shortlinks and ptc ads quickly feel free to message me."
Historical Compound USDC rates (lending/borrowing) and supply,https://www.reddit.com/r/Compound/comments/mktdoe/historical_compound_usdc_rates_lendingborrowing/,clardalan,1,2021-04-06 03:57:25,2,/r/Compound/comments/mktdoe/historical_compound_usdc_rates_lendingborrowing/,NaN,"hi guys and gals. I want to do some analysis on historical data on defi pricing (borrow/lend). for this, I am looking for csv format (or any other format other than pictures) pricing information for [compound.finance](https://compound.finance) rates, prefer longer than few months. if possible last 12 months would be great.

Is this information available somewhere? i can not find it on compound website or google. thanks!"
Lending on Compound,https://www.reddit.com/r/Compound/comments/mktir8/lending_on_compound/,xenodata,1,2021-04-06 04:03:33,6,/r/Compound/comments/mktir8/lending_on_compound/,NaN,"I was interested in lending USDC on Compound.  Do I need to lend both USDC and another coin to lend, like Uniswap?  If I want to lend say $1,000, should I account for like 2x $100 in fees when transferring in and out?"
Neobux - click ads and earn. The oldest PTC site,/r/clicksforbeermoney/comments/mk1eti/neobux_click_ads_and_earn_the_oldest_ptc_site/,SrDelBTC,1,2021-04-06 12:19:49,0,/r/Compound/comments/ml3d0m/neobux_click_ads_and_earn_the_oldest_ptc_site/,NaN,
How to claim COMP without additional ETH gas fees?,https://www.reddit.com/r/Compound/comments/mlazw0/how_to_claim_comp_without_additional_eth_gas_fees/,silvester2ish,1,2021-04-06 20:55:27,5,/r/Compound/comments/mlazw0/how_to_claim_comp_without_additional_eth_gas_fees/,NaN,"I am currently supplying USDC. Therefore I receive interest &amp; COMP

If I stop supplying USDC and withdraw I have to pay ETH gas fees. COMP is still in my account and I would pay additional ETH gas fees for withdrawing COMP.

Is this scenario correct?-&gt; In case I stop supplying 100% of USDC and withdraw, COMP will be automatically withdrawn also without additional ETH gas fees?!"
Can someone explain me why Compound fees are much greater than a regular ETH transaction?,https://www.reddit.com/r/Compound/comments/mlbu3s/can_someone_explain_me_why_compound_fees_are_much/,Layne55,1,2021-04-06 21:37:18,10,/r/Compound/comments/mlbu3s/can_someone_explain_me_why_compound_fees_are_much/,NaN,"If I want to send ETH to someone, the average fee now is around $7.

If I want to do anything on compound, I.e. claim comps, lend, borrow, Metamask and Ledger both suggest fees of +$70.

Can someone ELI5 this? I know smart contracts operations have some additional processing than just sending a payment but isn’t this just too much?"
Please help! Sent cZRX to my Coinbase Pro ZRX wallet by mistake,https://www.reddit.com/r/Compound/comments/mlmutv/please_help_sent_czrx_to_my_coinbase_pro_zrx/,RothOptions,1,2021-04-07 05:52:17,3,/r/Compound/comments/mlmutv/please_help_sent_czrx_to_my_coinbase_pro_zrx/,NaN,"I was going through some crypto transactions last year and had one issue that still remains unresolved, given the recent price increases I figured I'd give it another shot to recover these.

In a transaction back in May 2020 seen here: 0x3d03c88ec2a1e91d96a13f4e8bb464ffe5f8650ba7e1ce9ba7c80b0de8379437 I accidentally used my Coinbase Wallet to interact with compound and send \~19k cZRX tokens to my Coinbase Pro ZRX wallet. The coins did not show up in Coinbase Pro (I'm guessing because they are just two different coin types...) but I can see them just sitting there under that address still on the blockchain explorer. Any idea on how I can recover these?"
"Hideout TV - Watch videos like in youtube, but get paid for the ads. Use code ""TUESYAY35"" after registration for 25 free points (ends fast!)",/r/Refdrops/comments/mlgtz1/hideout_tv_watch_videos_like_in_youtube_but_get/,SrDelBTC,1,2021-04-07 07:00:18,0,/r/Compound/comments/mloais/hideout_tv_watch_videos_like_in_youtube_but_get/,NaN,
ETH Borrow,https://www.reddit.com/r/Compound/comments/mlsc7o/eth_borrow/,abc_reddit_xyz,1,2021-04-07 10:38:50,6,/r/Compound/comments/mlsc7o/eth_borrow/,NaN,Why are blockfi and celsius paying a high yield on eth and btc deposits? They must be lending these btc and eth but who would pay such a high rate to borrow BTC and ETH when they can borrow ETH from compound at a NEGATIVE rate when the compound distribution is counted?!
Taxes,https://www.reddit.com/r/Compound/comments/mlsku5/taxes/,abc_reddit_xyz,1,2021-04-07 10:52:05,2,/r/Compound/comments/mlsku5/taxes/,NaN,Is borrowing on compound a taxable event? I believe you receive some coin cETH for ETH but I'm not sure. Of course it should not be taxable since this is just a receipt for your ETH but does anyone have any experience doing taxes with this?
Top 5 sites to earn some crypto.,/r/Refdrops/comments/mlop81/top_5_sites_to_earn_some_crypto/,Jotandorsos,1,2021-04-08 03:05:51,0,/r/Compound/comments/mm9e3q/top_5_sites_to_earn_some_crypto/,NaN,
Sneak Peak of STC Terminal functions for Student Coin - This Can be Huge (Create your token Feature) 🔥🔥🔥,https://www.reddit.com/r/Compound/comments/mmhd6o/sneak_peak_of_stc_terminal_functions_for_student/,Own-Big-4000,1,2021-04-08 09:52:45,1,/r/Compound/comments/mmhd6o/sneak_peak_of_stc_terminal_functions_for_student/,NaN,"I know there is a lot of people announcing STC here in reddit, but navigating on the web found some screenshot of STC Terminal that will be an system to create tokens inside Student Coin. It looks very cool for me and i'm sharing the screenshots bellow.

I think this project can really fly with they implement all this functions! [🚀](https://emojipedia.org/rocket/) 🌙

If you want join, please use my affiliate link bellow to get 5% off bonus and help earn some bonus if you like review! Remember always do your own research! Also upvote if you like!

https://studentcoin.us/?ref=Sx1smylhz1

Check the screens!! 🔥🔥🔥

&amp;#x200B;

https://preview.redd.it/3xny8cajvur61.jpg?width=1276&amp;format=pjpg&amp;auto=webp&amp;s=2ba22b9adce90e79404dd9a500c07fd91760c930

https://preview.redd.it/2jqnwsbjvur61.png?width=2000&amp;format=png&amp;auto=webp&amp;s=72ed22297b1416166644956ede2a52559bae1d96

*Processing img hnvzjsbjvur61...*

https://preview.redd.it/lzdpnhajvur61.png?width=2000&amp;format=png&amp;auto=webp&amp;s=712d354d3d2b2970ebe301e294de3b403c09477c"
Merchant Token ICO - DEFI PROJECT 🚀🌕 - Phase 31 of 100,https://www.reddit.com/r/Compound/comments/mmj11r/merchant_token_ico_defi_project_phase_31_of_100/,Greatekel,1,2021-04-08 11:28:55,0,/r/Compound/comments/mmj11r/merchant_token_ico_defi_project_phase_31_of_100/,NaN,"**Current Price:** U$ 0,50  
**Phase:** 31 of 100  
**End of ICO:** 30 June 2021  
**Launchpad Website:** [https://merchanttoken.org?ref=T4JQJ9Y49](https://merchanttoken.org/?ref=T4JQJ9Y49)

I found this project few days ago in an sub here on reddit phase 12 and it’s already on phase 31!

The price is going up U$ 0,01 for each new phase complete until got priced at U$ 1,20 price for listing on Uniswap at 12th july 2021.

Here is a link with my affiliate code, if you like the project please use it to help me gain some affiliate bonus. This will not affect your price.  


[https://merchanttoken.org?ref=T4JQJ9Y49](https://merchanttoken.org/?ref=T4JQJ9Y49)

**Tip:**

If you want to avoid ETH fees, I suggest creating a CoinbaseWallet and make payment using LITECOIN, it was the lowest fees i found out. You can also buy on credit card or bank transfer."
CoinPayU - Easiest site to earn. Just register and watch some ads (or just let them open in another tab) and then claim your rewards! Many cryptos avaible.,/r/Refdrops/comments/mlrtay/coinpayu_easiest_site_to_earn_just_register_and/,SrDelBTC,1,2021-04-08 14:30:40,0,/r/Compound/comments/mmlpsp/coinpayu_easiest_site_to_earn_just_register_and/,NaN,
Get 5% Free Student Coin (STC) via ICO with Promo Referral Code Sxhmvinm6x,https://www.reddit.com/r/Compound/comments/mmrwd5/get_5_free_student_coin_stc_via_ico_with_promo/,welikebeef,1,2021-04-08 21:33:56,2,/r/Compound/comments/mmrwd5/get_5_free_student_coin_stc_via_ico_with_promo/,NaN,"  

&amp;#x200B;

**Use the link to get 5% FREE Student Coin when you deposit!**

[https://studentcoin.cash/?ref=Sxhmvinm6x](https://studentcoin.cash/?ref=Sxhmvinm6x)

You can also use the Bonus code **Sxhmvinm6x** when you sign up

The Student Coin ICO ends soon so sign up while you soon!

[https://studentcoin.cash/?ref=Sxhmvinm6x](https://studentcoin.cash/?ref=Sxhmvinm6x)

The vision of the Student Coin is to work as the world’s biggest ecosystem to perform the wide-scale tokenization, and allow everyone to build, manage and develop the personal, organizational, startup, and DeFi tokens.

[https://studentcoin.cash/?ref=Sxhmvinm6x](https://studentcoin.cash/?ref=Sxhmvinm6x)"
Merchant Token (MTO) DeFi ICO Referral Bonus Promo Link,https://www.reddit.com/r/Compound/comments/mmrwwr/merchant_token_mto_defi_ico_referral_bonus_promo/,HerculesMother,1,2021-04-08 21:34:44,0,/r/Compound/comments/mmrwwr/merchant_token_mto_defi_ico_referral_bonus_promo/,NaN," 

# 

**Join the Merchant Token ICO with the Bonus link below!**

[**https://merchanttoken.org?ref=N9YDPKHX9**](https://merchanttoken.org/?ref=N9YDPKHX9)

**What is Merchant Token?**

Merchant  Token (MTO) is Hips Merchant Protocol's (HMP) native protocol token,  currently issued on Ethereum following ERC-20 standard. HMP will escrow  ERC20 tokens in Ethereum's blockchain as a start, but the protocol will  work similarly on other supported blockchains such as Cardano among  others.

[**https://merchanttoken.org?ref=N9YDPKHX9**](https://merchanttoken.org/?ref=N9YDPKHX9)

The ICO ends June the 30th so sign up while you can!"
three websites to earn some free crypto,https://www.reddit.com/r/Compound/comments/mmsijn/three_websites_to_earn_some_free_crypto/,gio9619,1,2021-04-08 22:04:36,0,/r/Compound/comments/mmsijn/three_websites_to_earn_some_free_crypto/,NaN," Hi everyone, I would like to suggest 3 website to earn some free crypto by watching shortlinks or ptc ads, they both allow to withdraw to expresscrypto, [faucetpay](https://faucetpay.io/?r=1219077) coinbase or directly to wallet.

1: the first is [faucetcrypto](https://faucetcrypto.com/ref/781142) it allows to earn some coin through shortlink,s ptc ads or offerwall, the minimum amount to withdraw is very low and can be reached daily plus it has a level program that gives you more coins by leveling up

2: the second is [dutchy corps](https://autofaucet.dutchycorp.space/?r=france999) that is an autofaucet, it allows to earn by watching shortlinks, ptc ads and surfing ads. It also has a level program that increase the claming amount plus i recommend to run the autofaucet with balance mode to earn an additional 10% and on weekends to earn an additional 20% claim bonus

3: the third is [autoclaim](https://autoclaim.in/r/france999) that allows to earn coin by doing shortlinks very easily, it also has a bonus program and there is no minimum amount to withdraw

I think is a good way to start earn some crypto without spend money, if someone did register and want some tip I use to do the shortlinks and ptc ads quickly feel free to message me."
Professor's call: join the decentralized short video team together-Birdchain,https://www.reddit.com/r/pancakeswap/comments/mmsqcm/professors_call_join_the_decentralized_short/?utm_source=share&amp;utm_medium=web2x&amp;context=3,Traditional_Day9063,1,2021-04-08 22:20:31,0,/r/Compound/comments/mmsucn/professors_call_join_the_decentralized_short/,NaN,
"No Free Lunch, but here's free crypto!",https://www.reddit.com/r/Compound/comments/mmx1ey/no_free_lunch_but_heres_free_crypto/,Codecisnotsmall,1,2021-04-09 01:37:47,0,/r/Compound/comments/mmx1ey/no_free_lunch_but_heres_free_crypto/,NaN,[removed]
Faucet Crypto - Earn crypto by performing easy task. Level up and earn even more. Free coins every 40 minutes.,https://www.reddit.com/r/Compound/comments/mmze38/faucet_crypto_earn_crypto_by_performing_easy_task/,Jackintosh1,1,2021-04-09 03:25:30,0,/r/Compound/comments/mmze38/faucet_crypto_earn_crypto_by_performing_easy_task/,NaN,"In [FaucetCrypto](https://faucetcrypto.com/ref/459308) you perform easy tasks like PTC, Shortlinks and Surveys to get coins, wich you can exchange for Cryptos directly to your wallets ([Faucetpay](https://faucetpay.io/?r=649221), [ExpressCrypto](https://expresscrypto.io/signup?referral=279880), Coinbase, etc.)

Whenever you perform a task you will also get EXP. When you get enough EXP you will level up and you will get a boost in the rewards of the tasks FOREVER. That means that the best strategy is to always try to level up. It´s really not that difficult, you could reach level 100 in less than a week (even faster if you get some experiencie ring, wich could drop randomly after each task). If you get an item you can also sell it at the market for as much as 5000 coins depending on the item!

If you level up enough you will be able to reach the minimum coins to cashout multiply times a day without problems."
Compound (COMP) Distribution APY Question,https://www.reddit.com/r/Compound/comments/mn0ikx/compound_comp_distribution_apy_question/,c1murtagh,1,2021-04-09 04:17:53,2,/r/Compound/comments/mn0ikx/compound_comp_distribution_apy_question/,NaN,"Can someone dumb this down for me? I'm just curious how the Distribution APY works on borrowing.

So I took a screenshot below and let me know if I'm thinking about this correctly.

If I am to borrow COMP then I will pay 5.81% interest on the amount I borrowed. 

I will also receive 14.11% COMP on the amount I borrowed as a distribution.

&amp;#x200B;

https://preview.redd.it/3m9mptmub0s61.png?width=919&amp;format=png&amp;auto=webp&amp;s=fc173b13148c7f0b16e4bcbb07d0431e0c0aa221

&amp;#x200B;

So now that bring me to this, can I exchange the COMP I borrowed into USDC coin where I can earn:

1. 8.66% on USDC coin
2. 2.47% COMP on distribution apy
3. and also continue to earn 14.11% above from borrow distribution

&amp;#x200B;

https://preview.redd.it/p3vssw4pc0s61.png?width=910&amp;format=png&amp;auto=webp&amp;s=b9be71ffab740a41e8838576e8c4d4be1080b040"
🏆Faucet Crypto🏆 Claim every 40min 💰 Daily Payouts 💎20 Coins to choose from and additional Tasks to earn as much as you desire!,https://www.reddit.com/r/Compound/comments/mn157t/faucet_crypto_claim_every_40min_daily_payouts_20/,Leather-Fill-571,1,2021-04-09 04:47:58,0,/r/Compound/comments/mn157t/faucet_crypto_claim_every_40min_daily_payouts_20/,NaN," 

I have been signing up for Airdrops off and on for a few years, and a majority of them take months of waiting, many tasks, giving out your Info to many platforms, sharing, tweeting, networking, more waiting, prices far, coins end up to be fake or scams, just a lot of paying with fingers crossed.

I use to be apart of the faucethub community and had fun with their platform. Over time the site got watered down, claims were difficult to navigate, more hoops to jump through, eventually it was just not worth the time, so that chapter ended. That was a few years ago

Recently I got back into airdrop hunting and came across [FaucetCrypto](https://faucetcrypto.com/ref/1074770) and checked it out since SFMoney seems to be a scam and I'm upset cause I had much time invested in the project and it seems it was for nothing. Discovering [FaucetCrypto](https://faucetcrypto.com/ref/1074770) I learned that the Claims on there are very simple, not click baiting, no redirecting, instant credit, and daily withdrawals with your pick of 20 coins!

Just say its alot faster then these Airdrops.."
