title,url,author,score,created,numComms,permalink,flair,body
cETH Gained 18.05% today and is leading the Charts!,https://i.redd.it/tld7xw2ca9u71.png,AttackBody,1,2021-10-19 02:57:41,51,/r/Compound/comments/qatd7d/ceth_gained_1805_today_and_is_leading_the_charts/,NaN,
Claiming Rewards,https://www.reddit.com/r/Compound/comments/qb2vd9/claiming_rewards/,sleatygregory,1,2021-10-19 11:24:17,27,/r/Compound/comments/qb2vd9/claiming_rewards/,NaN,"Dude I have been trying to claim 1 comp in rewards and everytime the transaction confirms I still have 0 comp in my wallet I have wasted over $100 in gas fees for rewards I couldn’t claim. What is wrong with Comp, I have never experienced this issue before."
How to claim COMP?,https://www.reddit.com/r/Compound/comments/qdzf3c/how_to_claim_comp/,blockchainified,1,2021-10-23 14:28:41,7,/r/Compound/comments/qdzf3c/how_to_claim_comp/,NaN,I've been trying to claim COMP using my Metamask for a few days in a row and nothing happens. Does anybody know how to claim the reward nowadays?
What happens to the difference between borrow APY and Supply APY?,https://www.reddit.com/r/Compound/comments/qe8p6v/what_happens_to_the_difference_between_borrow_apy/,Printer-Pam,1,2021-10-24 00:57:41,2,/r/Compound/comments/qe8p6v/what_happens_to_the_difference_between_borrow_apy/,NaN,"It is probably higher than $100 million per year, where do this money go?"
When will comp recover,https://www.reddit.com/r/Compound/comments/qeor1x/when_will_comp_recover/,Pastylover88,1,2021-10-24 17:25:40,9,/r/Compound/comments/qeor1x/when_will_comp_recover/,NaN,Whed do we expect comp to average out say 400 buck and start to gain steadilly
Liquadations and how to detect them,https://www.reddit.com/r/Compound/comments/qeovb2/liquadations_and_how_to_detect_them/,ijonaski,1,2021-10-24 17:35:40,16,/r/Compound/comments/qeovb2/liquadations_and_how_to_detect_them/,NaN,"Hi folks,

I'm trying to perform some analytics on Compound and determine how many loans are paid off successfully and how many are liquidated.  


My idea was to do some digging in Etherscan, but I'm not sure what contract activity to look for.  


Does anyone have any ideas or pointers to successful-paid-of transactions and/or liquidation transactions ?  


Many thanks and much appreciated,

Ijonas."
Coindix makes it easy to find the best DeFi opportunities (including Compound!),https://coindix.com/?ref=reddit,zywx1909,1,2021-10-25 16:23:29,2,/r/Compound/comments/qfc37b/coindix_makes_it_easy_to_find_the_best_defi/,NaN,
What will happen in june 2024 for Compound token holders?,/r/DemosVentures/comments/qfm7c1/what_will_happen_in_june_2024_for_compound_token/,gabinmarignier,1,2021-10-26 01:47:06,8,/r/Compound/comments/qfm7qp/what_will_happen_in_june_2024_for_compound_token/,NaN,
Holon Hackathon 2021,https://www.reddit.com/r/Compound/comments/qfz993/holon_hackathon_2021/,ivtonic,1,2021-10-26 13:12:33,0,/r/Compound/comments/qfz993/holon_hackathon_2021/,NaN,"Hey all!

Wanted to extend to you a Hackathon I'm organising at the moment, sponsored by Filecoin and IPFS

Up to 55k in FIL to be won!

Check out this link for all the details [https://taikai.network/en/holon/challenges/holon-innovate/](https://taikai.network/en/holon/challenges/holon-innovate/) overview"
"The Top DeFi Lending Platforms, Assets, DEXs &amp; More In 2021",https://d-core.net/defi-lending-platforms/,carloscancab,1,2021-10-26 20:40:41,4,/r/Compound/comments/qg5j7e/the_top_defi_lending_platforms_assets_dexs_more/,Newsletter,
COMP stays on the bull market,https://everycoinprice.com/?symbol=COMP&amp;interval=1day&amp;exchange=10,investold,1,2021-10-27 02:09:40,2,/r/Compound/comments/qgcesv/comp_stays_on_the_bull_market/,NaN,
USDT fees transaction soooo big,https://www.reddit.com/r/Compound/comments/qgj0nc/usdt_fees_transaction_soooo_big/,pierre7474,1,2021-10-27 07:21:31,6,/r/Compound/comments/qgj0nc/usdt_fees_transaction_soooo_big/,NaN,"Hey, how to lower fees to send USDT? 

 It asks 40€ for a 15€ amount of USDT to send..!"
Supplying USDC question,https://www.reddit.com/r/Compound/comments/qgji24/supplying_usdc_question/,huntingatherers,1,2021-10-27 07:47:29,3,/r/Compound/comments/qgji24/supplying_usdc_question/,Question,"Hey guys, me and the wife are thinking about putting some of our savings into Compound by supplying USDC. I understand the yield rate changes often, but when how does that affect your supplying rate? Do you lock in the rate it shows once you supply, or does it just change daily? Thanks!"
New Options to Buy COMP: Huobi Adds COMP to Crypto Conversion and RUB/UAH/KZT/BRL Balance,https://www.reddit.com/r/Compound/comments/qgrsgd/new_options_to_buy_comp_huobi_adds_comp_to_crypto/,Huobi_Global_UK,1,2021-10-27 16:20:29,5,/r/Compound/comments/qgrsgd/new_options_to_buy_comp_huobi_adds_comp_to_crypto/,NaN,"&amp;#x200B;

https://preview.redd.it/6sgflduqcyv71.png?width=800&amp;format=png&amp;auto=webp&amp;s=3fad6bbaab907b4ccc2614f33d46e4c4b2d9632b

COMP now available for Crypto Conversion and Purchase Via RUB / UAH / KZT / BRL Balance!🚀

🔥Get 5% Extra Tokens Free When Converting from USDT!

👉[https://www.huobi.com/support/en-us/detail/34889225425509](https://www.huobi.com/support/en-us/detail/34889225425509)"
CCOMP &gt; COMP scam on Uniswap,https://www.reddit.com/r/Compound/comments/qgyd6z/ccomp_comp_scam_on_uniswap/,mannequin922,1,2021-10-27 22:47:03,1,/r/Compound/comments/qgyd6z/ccomp_comp_scam_on_uniswap/,NaN,"Well darn.  I tried to convert my CCOMP back to COMP so I could deploy the funds somewhere else, and it appears I was scammed.  I'm not sure how it happened.   Does anyone have any recommendations of an [Etherscan.io](https://Etherscan.io) expert who can help me unravel the transaction history?  I'm pretty confident the coins are gone.   Mostly interested in understanding how to prevent it from happening to me or anyone else again."
"Happening today, Oct 27 at 2 pm ET: Crowdcast ""Compound Q3 Analyst Call"" with Robert Leshner and Messari's Ryan Selkis/Ryan Watkins",https://www.crowdcast.io/e/q3compoundmessari?utm_campaign=compound_quarterlyQ3&amp;utm_source=reddit&amp;utm_medium=r_compound,messaricrypto,1,2021-10-28 01:05:26,2,/r/Compound/comments/qh1db7/happening_today_oct_27_at_2_pm_et_crowdcast/,NaN,
Realistic long term price predictions???,https://www.reddit.com/r/Compound/comments/qhi2tj/realistic_long_term_price_predictions/,Pastylover88,1,2021-10-28 16:08:37,13,/r/Compound/comments/qhi2tj/realistic_long_term_price_predictions/,Question,So will compound ever reach 5000 $ in the next 10 years?
CFY.Finance Allows ALMs for NFT-Collateralised lending - Partnership potential with compound?,/r/CFYFinance/comments/qhjog0/cfyfinance_beta_is_officially_launched_for_public/,Mountain_Cancel6704,1,2021-10-28 18:31:43,2,/r/Compound/comments/qhk0ve/cfyfinance_allows_alms_for_nftcollateralised/,NaN,
"What does this [""Claim""] function provide? I have CETH that I want to cash in and get my funds back.. is this how to do it, no strings attached?",https://i.redd.it/qfb40jdge7w71.png,ryjobe36,1,2021-10-28 22:49:12,20,/r/Compound/comments/qhopxg/what_does_this_claim_function_provide_i_have_ceth/,Question,
cETH Gained 36.56% today and is leading the Charts!,https://i.redd.it/22q2dm2oj8w71.png,AttackBody,1,2021-10-29 02:36:30,7,/r/Compound/comments/qhti3x/ceth_gained_3656_today_and_is_leading_the_charts/,NaN,
Transferring ctokens when you have debt,https://www.reddit.com/r/Compound/comments/qi0isl/transferring_ctokens_when_you_have_debt/,Suspicious-Chip-4349,1,2021-10-29 08:30:36,7,/r/Compound/comments/qi0isl/transferring_ctokens_when_you_have_debt/,NaN,"What happens if you have debt in compound, but try to transfer ctoken to another wallet.

For example, let’s say you have:
 (1) deposited 10 ETH and now have the ctokens for eth
(2) you borrow 3 ETH
(3) you try to transfer the ctokens to another wallet address

What will happen? Will debt transfer along with ctokens?"
When you accidentally leave a borrow balance of 2.50 worth of Link..,https://www.reddit.com/r/Compound/comments/qih7kr/when_you_accidentally_leave_a_borrow_balance_of/,RouxHefner,1,2021-10-30 00:54:42,10,/r/Compound/comments/qih7kr/when_you_accidentally_leave_a_borrow_balance_of/,NaN,and its going to cost over 100.00 in gas to pay it off... comical!
Is it possible to pay off borrowed assets with existing collateral?,https://www.reddit.com/r/Compound/comments/qioy96/is_it_possible_to_pay_off_borrowed_assets_with/,InfiniteTooth,1,2021-10-30 07:21:52,10,/r/Compound/comments/qioy96/is_it_possible_to_pay_off_borrowed_assets_with/,NaN,I have ETH as collateral and was wondering if I can pay off the USDC I borrowed with it?
Compound - COMP surge,https://everycoinprice.com/?symbol=COMP&amp;interval=1day&amp;exchange=19,Serious_Finish2042,1,2021-10-30 17:03:32,11,/r/Compound/comments/qixm0v/compound_comp_surge/,Launch,
