author,body,created
ghfsigiwaa,Can someone educate me: Why do people trade and swap stablecoins? What's the point of that and of curve finance? Aren't there a lot of defi platforms that support a lot of different stablecoins?,2021-12-01 03:38:11
Always_Question,"To start, I would sign up for [crypto.com](https://crypto.com) and then transfer directly to Polygon or Arbitrum.  On polygon, check out beefy finance.  On Arbitrum, you can LP on Curve or Uniswap.  High returns everywhere.",2021-12-01 09:13:43
RouletteQueen,"Since you can’t comprehend how something can’t possibly be a Ponzi scheme:  

Breaking down 'too good to be true' Defi rates – where's the money from, is it sustainable, and what's the catch?

Money doesn't just grow on ~~trees~~ blockchains, not even *magic internet money*. And yet some defi applications are offering astronomical rates. For this post, I'll break down three common types of protocols and answer the following questions: *where's the money from? Is it sustainable? And what's the catch?*

# Lending and Borrowing

Examples; Aave, Anchor, Geist, Solend

Typical rates: Less than 10% net

**Where's the money from?** Similar to a bank, users deposit money into the protocol, which is then used by borrowers. To borrow money, users have to pay an interest rate and also deposit collateral into the protocol. The main source of revenue is sourced from the interest borrowers have to pay. Some protocols also stake the collateral that users deposit and earn extra income from that.

**Is it sustainable?** Most lending rates aren't actually that high (2% to 20%) since they are usually balanced out by the borrowing rates at an equivalent rate. So the main question here is, *why are people lending/borrowing?*

Beyond earning deposit fees, people lend because the majority of defi requires users to hold assets that they would otherwise not want to hold.  If a user wanted to use defi while holding the assets that they prefer to hold like BTC and ETH, they would deposit their assets as collateral and borrow against it.

People borrow because they can earn a yield higher than the rate they're paying to borrow. You could for example, borrow a stablecoin at a 10% borrow rate and then deposit the borrowed funds into a stablecoin liquidity pool that earns you 20%. You keep the extra 10%.

**What's the catch?** If you're not borrowing, the rates are oftentimes very low and you're likely better off staking an asset than lending or even using Cefi. For example, the largest lending/borrowing dapps are Aave, Compound, or Cream and they only offer **&lt;3%** for ETH whereas ETH Cefi rates are **\~6%**.

If you are borrowing, there's no bank to hold your hand and no bailouts. If your collateral falls below a certain amount, the protocols deems you ineligible to pay off your loan and you get liquidated. This can happen if the market falls and you're not watching your funds. However, there are protocols that now allow for liquidity-free lending/borrow.

# Liquidity Pools (LPs)

Examples: Uniswap, Curve, Serum, Raydium, TraderJoe, SpookySwap, Quickswap

Typical rates: 20% to 40% net (for stablecoins, BTC, and ETH)

**Where's the money from?** When you use decentralize exchanges (dexes), there are liquidity provider fees that typically charge 0.25% of trades. The trading fee is the main source of income for LPs.

**Is it sustainable?** At its current state, most LPs are not sustainable. While the demand for LPs like ETH-DAI is pretty straightforward, demand for LPs with, sometimes obscure, protocol or farm tokens are not as clear. Oftentimes, they rely on circular dependencies, ie *finance for the sake of finance.*

As an example, let's take a look at how degen yield farming typically happens:

1. Protocols offer a 1,000% rate for FARM-DAI LP providers
2. Higher rates mean higher inflation, which means the value of the FARM token tend to decrease
3. But the high rate creates demand for the FARM token as users have to buy FARM to join the LP
4. The high demand pumps the price of the FARM token and offsets the high inflation
5. But as the LP participants grow, the rates decrease
6. Lower rates cause lower demand, which means prices are no longer getting pumped
7. At some point, the farm reaches a stage where both prices and rates are going down
8. And when that happens, degens who are merely looking for quick money, tend to leave
9. More and more people leaving and selling the token causes the price to drop

For most farms, specifically ""degen farms"", prices spike early making the LP seem more profitable than it actually is and then high inflation does its thing to prices slowly but surely fall. Most users enter and leave farms within 3 days to capture the parabolic price action and high rewards.

Protocols can avoid this by providing a legitimate use case for the FARM token beyond just earning a high yield. For pure LP protocols, the use cases are typically governance, which is not very appealing for retail who couldn't care any less about how some protocols are governed.

**What's the catch?** Even if the LP rates are very high, a drastic enough drop in price can offset the gains earned from the reward rate. This is especially true for users who were late and were not able to accumulate the rewards. This is why it's often recommended to look into the price action and avoid making decisions based off of rates alone.

LPs, specifically low liquidity ones, are also especially vulnerable to whales who can often cause spikes–both in the upside, when buying, and the downside, when selling. And large spikes can cause a domino effect of mass selling and whoever is left holding the bag gets rekt.

Beyond this, impermanent loss (IP) is the most obvious catch. Participating in LPs typically requires you to split your assets meaning you may be exposed to undesired price action. But there are several ways to avoid or mitigate IP such as participating in stablecoin LPs or LPs with relatively low volatility, ie BTC or ETH. In addition, there's a lot of work going into new protocols to limit the impact of impermanent loss.

# Reserve Currencies

Examples: Olympus DAO, Wonderland, KlimaDAO

Typical rates: 6,000% to 8,000% (current)

**Where's the money from?** Reserve currencies are brought at a premium that's worth several magnitudes (8-10x) more than the intrinsic value of the token. New tokens are minted at an extremely high rate and then distributed as a reward to stakers. A combination of selling at a high premium and minting at a high rate leads to the high APYs.

But, similar to how LPs work, high distribution –&gt; high inflation –&gt; lower prices. At the same time, high rates –&gt; high participation –&gt; lower rates. The expectation is for both rewards to slowly decrease to a target rate of 1,000%. The goal is to accumulate long-term participants because long time horizons would ensure that staking rewards eventually offsets price action.

**Is it sustainable?** Under the hood, the economics are designed similar to LPs. But LPs are often subject to the notion of *finance for the sake of finance* because the only product is often the high yields offered. Reserve currencies have a secondary revenue generating product: bonds, which are means for protocols to accumulate their own liquidity. So the question to be asked here is *why is there a demand for bonds?*

Bonds allow for protocol-owned liquidity, seeking to address the aforementioned issues that often make LPs unsustainable. Instead of protocols renting liquidity to mercenary users who come and go looking for the highest yields, bonding allows protocols to own their own liquidity and provide a sense of stability. This reduces the need for protocols to constantly offer unsustainably high rates in order to incentivize users to participate in their LP. In addition, it allows protocols to earn their own LP fees, which can give them another source of revenue.

**What's the catch?** LP protocols actually incur some costs in exchange for partnering with the bonding program of a reserve currency protocol. And while reserve protocols offer users with more incentives to become long-term participants, they can still always exit and sell the LPs. This may the case during volatile swings.

On the user end, buying bonds usually isn't worth it primarily because reserve protocols typically requires users to wait a certain interval (3-7 days, etc.) while holding the LPs. This presents some risks because the LPs can drop in value and, thus, offset the discounts. Additionally, if users buy the reserve currency token directly, they can immediately maximize the staking yields, which are also often higher than the discounts.

Overall, the long-term utility of the reserve protocol hinges on the demand for bonds. Most reserve currencies are still very new so only time will tell moving forward. Beyond questioning the bonds, reserve currencies are still vulnerable to bank runs, however these risks are designed to be mitigated with how the protocol works.

&amp;#x200B;

I know this was a long post so kudos to anyone who managed to read all throughout. These are not the only types of protocols available in defi, there are tons more that are either stark variations or completely unique. I hope you all learned something!",2021-12-01 09:50:15
moon-worshiper,"Discovery was a Cable channel. WarnerMedia was movie theater productions, with HBO for Cable Subscription productions. Discovery depends on cable advertisements for their productions. HBO depends on number of continuous subscribers to finance more productions. WarnerMedia was depending on movie theater box office.  
  
Discovery is having a difficult time trying to set up another streaming content channel, especially for a subscription fee, still with commercials, and premium to not have commercials. Most of their lineup has become Fake/Reality drek. Right now there is Apple+, Disney+, AMC+, Starz+,HBO+, Showtime+, Epic+,HistoryChannel+, and so on, every cable channel now having a streaming on-demand channel for a subscription.    
  
WarnerMedia is depending on HBO and Discovery to provide the direction and method to transition from Cable to Streaming On-Demand subscription. Look at DISCA over the past year and somebody with a huge number of DISCA shares rode the 4chan-ANON Reddit, Inc. 'Meme Stonks' hypercrazy pumping all the way up to when the news was known in corporate that DISCA was going away, merger value converted over to whatever symbol Warner Media Discovery is (WMD?), and they dumped tens of millions of shares over a few days. The Classic Pump-and-Dump curve, almost exponential upward, pumping, then sudden short span drop, the dump. That was the Chairman of the Board of Discovery.",2021-12-01 12:42:59
daksh60500,"I can sort of answer this since I’m doing CFA and CS. I’d say these are v different obviously but your motivation matters more in tech, which makes it harder. For example, if money is your primary motivator, then understanding financial statements are hell of a lot easier than doing computer systems or DS&amp;A, simply because the former relates directly to money, and gives a more fundamental understanding of it.

The fields also evolve very differently. In finance, the field is very slow to evolve, but tech is extremely fast (comparing on a macro scale). This means the learning curve in finance is a less steep with age as compared to tech.

In the end though, I’d say your experience in CS is highly dependent on the quality of your teacher, especially since there’s quite a bit to learn.
Tldr - it’s not easy, but can be hard.",2021-12-01 15:08:24
BANGAR4NG,"The slippery slope theory just says that we assume social movements happen at a linear rate when actually they happen Logarithmically. The graph is a dramatic parabolic curve and not a straight line. 

It deals with network effects of information diffusion. https://en.m.wikipedia.org/wiki/Network_effect

Human brains are pattern recognition machines. They are pretty good at linear functions but pretty bad at exponential functions.

Slippery slope says if you start down one path, it gains traction at an exponential rate.

Read one marketing, finance, sociology, or communications text book.",2021-12-01 16:15:33
Martok420,"hmm although I think the swap back to eth would cost me a lot less.. Thanks, actually think it could be a good idea! Thanks again for the post. I'm not sure what I'm going to do with the eth, was looking at curve finance. Have you got any suggestions?",2021-12-01 17:41:42
coinfeeds-bot,"tldr; LUNA, the native token of the Terra blockchain, saw its price increase by over 50% in the past week. This comes after the Terra community passed a proposal to burn 88.7 million LUNA tokens, worth roughly $4.5 billion at the time. The community is also set to increase UST liquidity on Curve Finance, the premier AMM for stablecoin swaps.

*This summary is auto generated by a bot and not meant to replace reading the original article. As always, DYOR.*",2021-12-01 19:15:20
coinfeeds-bot,"tldr; LUNA, the native token of the Terra blockchain, saw its price increase by over 50% in the past week. This comes after the Terra community passed a proposal to burn 88.7 million LUNA tokens, worth roughly $4.5 billion at the time. The community is also set to increase UST liquidity on Curve Finance, the premier AMM for stablecoin swaps.

*This summary is auto generated by a bot and not meant to replace reading the original article. As always, DYOR.*",2021-12-01 19:45:13
coinfeeds-bot,"tldr; LUNA, the native token of the Terra blockchain, saw its price increase by over 50% in the past week. This comes after the Terra community passed a proposal to burn 88.7 million LUNA tokens, worth roughly $4.5 billion at the time. The community is also set to increase UST liquidity on Curve Finance, the premier AMM for stablecoin swaps.

*This summary is auto generated by a bot and not meant to replace reading the original article. As always, DYOR.*",2021-12-01 21:45:12
TrumpC-137,"I did too. Fortunately, I have a degree in finance so there wasn’t much of a learning curve for me.",2021-12-02 02:13:35
MajorasButtplug,"I actually believe stablecoin staking is one of the best advantages of DeFi for FIRE people, and use it a good bit. The reason I was interested in this sub actually was because of how many times the main FI sub shit on me just for trying to explain how these work to people. I do think the ridiculously high returns are temporary, but in the sense of there's a limited number of years (so still quite a bit of time) before rates come in line with other options

Compound Finance is a decent example of this. It started out averaging ~10% on USDC/Dai for the first 2ish years for me. Now the protocol has grown, expanded borrowing options and proved itself, and you hardly ever see rates above ~5%. If you were to snoop long enough in my post history you'd find me claiming I believe eventually stablecoin lending will likely end up somewhere around mortgage rates in the long run.

&amp;nbsp;

There are still great options now though, depending on what you're comfortable with. 

* Aave/CF are still decent interest and pretty well proven at this point. 

* Anchor should have a nice rate for a good while since being subsidized by TFL. 

* If you're willing to take a relatively small liquidation risk, you can get ~56% on UST through Abracadabra where you're only liquidated if UST drops to $0.80... During the May dip it de-pegged temporarily to ~$0.93, so $0.80 is pretty safe imo. 

* Curve pools can get you ~15%, at the cost of exposure to USDT

&amp;nbsp;

Personally I keep a good bit of my assets in stablecoin lending protocols. So if you have any questions, I *might* be able to answer them.",2021-12-02 04:53:25
Best-Campaign8130,"Convex Finance is a platform for CRV token holders and Curve liquidity providers to earn additional interest rewards and Curve trading fees on their tokens. Put another way, Convex Finance offers boosted Curve staking.

The live Convex Finance price today is $27.71 USD with a 24-hour trading volume of $18,948,081 USD. We update our CVX to USD price in real-time.

Telegram: https://t.me/convexEthChat0

Do not miss that chance!!!🚀🚀🚀",2021-12-02 07:29:17
Best-Campaign8130,"Convex Finance is a platform for CRV token holders and Curve liquidity providers to earn additional interest rewards and Curve trading fees on their tokens. Put another way, Convex Finance offers boosted Curve staking.

The live Convex Finance price today is $27.71 USD with a 24-hour trading volume of $18,948,081 USD. We update our CVX to USD price in real-time.

Telegram: https://t.me/convexEthChat0

Do not miss that chance!!!🚀🚀🚀",2021-12-02 07:42:06
Local-Seat-4730,"You didn't say that so how would anyone know lol? What have been my vehicles over last 10 years? Applying your logic if you don't know then that makes you ""slow"".

Hinting that I am ""slow"" when you are trading in Rams after 3 years is pretty bold considering average depreciation for Rams are about 43% per 5 years which isn't the worst ever but I'd say that depreciation curve is probably a lot steeper at 3 years than at 5. So you are trading in each truck for a tremendous loss, especially if you are selling back to the dealer. I've noticed that people who trade in like this never actually own a vehicle, it's always financed so the bank owns it. People that buy cars with funds in hand never trade in to dealerships because you get robbed and it's really clear when you are talking dollars and not monthly payments which all dealerships hate.

No dealer will give you as much as privately selling your vehicles. I'm sure you don't consider this at the time because they roll it up into a big finance ""package"" and typically only talk about monthly payments ""hey we can keep your payment in the ballpark just give us that old one and look at this shiny plastic wow it's so badass"" and unfortunately most Americans are fooled that easily.

However in a way It's a good thing you trade in after 3 years because those vehicles fall apart at about 5 years and that's when they make a lot of money on the replacement parts.",2021-12-02 07:46:19
Best-Campaign8130,"Convex Finance is a platform for CRV token holders and Curve liquidity providers to earn additional interest rewards and Curve trading fees on their tokens. Put another way, Convex Finance offers boosted Curve staking.

The live Convex Finance price today is $27.71 USD with a 24-hour trading volume of $18,948,081 USD. We update our CVX to USD price in real-time.

Telegram: https://t.me/convexEthChat0

Do not miss that chance!!!🚀🚀🚀",2021-12-02 07:54:17
Best-Campaign8130,"Convex Finance is a platform for CRV token holders and Curve liquidity providers to earn additional interest rewards and Curve trading fees on their tokens. Put another way, Convex Finance offers boosted Curve staking.

The live Convex Finance price today is $27.71 USD with a 24-hour trading volume of $18,948,081 USD. We update our CVX to USD price in real-time.

Telegram: https://t.me/convexEthChat0

Do not miss that chance!!!🚀🚀🚀",2021-12-02 08:08:14
ragnarkar,"I completed a Masters in Finance and a CFA (not to mention now a data scientist) and I'm still figuring this stuff out from square one..  though my learning curve might be different after a few months.

Some might say I've taken too much risk but I took nearly $30,000 in (nearly) zero-interest loans from those balance transfer checks from my credit cards that offer 0% interest for about a year and a one time fee of 3%.  It was too tempting when I saw the triple digit yields on *Stablecoin pairs* offered by the Toad network (though the yields have calmed a bit.)",2021-12-02 09:49:38
macetheface,[You're already ahead of the curve.](https://www.nerdwallet.com/article/finance/average-net-worth-by-age),2021-12-02 09:56:24
drsikes,"I can’t speak to the public health side of the degree but usually the biggest learning curve I’ve seen with MBAs without a business background is the quantitative side of the MBA, specifically in accounting, economics, and finance. 

At my previous university, if a student didn’t have a business undergrad degree, we would actually require them to take a few undergrad courses in economics and accounting. Not saying this is a universal requirement, but it goes to show the heavy dependence of any business degree, undergrad or masters, on these 2 subject areas. 

If you’re curious about the heavy dependence of accounting and economics, I’ll try to illustrate why. 

Accounting is the absolute language of business which I hate to admit but it’s true. We communicate info about a business through numbers, and accounting gives us a way to standardize that information. 

Economics is not even taught as a business course at some universities but instead as a social science course (which is honestly what it is). It’s a study of how individuals make decisions as either an individual (micro) or an entity (macro). It’s focus on decision making I think is what truly makes it more of a social science than necessarily a business course.

Finance (my specialty) relies on both accounting data and economic ideas to do one thing…make money ;) Of course not all of healthcare is about making money, but projects still need to be evaluated, capital still needs to be raised, and day-to-day operations still needs to be managed so finance is still relevant even for non-profits.

If you want to private message me for any questions or info, feel free.",2021-12-02 11:52:59
throwawayExpress24,most he's done is mention how there will be a curve. Apparently Business Finance is known for having huge curves,2021-12-03 05:47:22
blurrytree,"These people crack me up. I aced every college econ course I every took. Like, I was that ""curve destroying asshole"" kind of aced. It was my experiences/observations working in the finance dept at the HQ of a fortune 500 that pushed me from SocDem onto Marxism. But sure, ""commies don't understand economics."" Let it roll of your back comrade.",2021-12-03 08:12:57
Consistent-Ad-5885,"Yes, the potential yield and low gas fees makes it well worth it. 

Like one of the other comments says, it’s smart to use exchange with polygon native withdrawals. Swap the BTC &amp; ETH to MATIC, and withdraw from the exchange directly to your MetaMask address (selecting MATIC network). Once the Matic is on MetaMask, you can use quickswap to convert the MATIC back to the respective amounts of wBTC and wETH. 

Assuming you want to just hold the coins for a while, you have some options on more ways to earn interest just for holding on the Matic network. You can store the BTC and ETH on Aave, where you’ll earn roughly 2% APY in Matic tokens. This also gives you access to lending and borrowing. 

To earn more APY, you can borrow USDC using the BTC and ETH as collateral, and use this USDC to become a liquidity provider on sites like curve, quickswap, or Mai Finance. Rates on Mai Finance are around 30%, paid out in Qi tokens that can be claimed at any time and used to slowly accumulate more BTC or ETH; whenever you want to exit, just withdraw your initial liquidity deposit and payoff the loan. Just be sure to maintain a good LTV on aave to avoid liquidation — I usually keep my borrow value around 45% my collateral value just to be safe.",2021-12-03 09:46:38
warm_heart,"1. Bridge all your eth to avalanche.
2. Buy 0.5 AVAX on Trader Joe just for gas fees
3. Deposit all your 32 eth on Aave
4. Borrow stables. Keep a health rate of 3 or more. It's a free loan since your eth's deposit apy + rewards will be higher than stables apy
5. Go to Curve Finance. Deposit stables on the 3Crypto pool.
6. Enjoy around 40% apy for free

All these protocols are bluechip defi. Do whatever u want w this info. Nfa",2021-12-03 14:00:43
