author,body,created
RossLedehrman,"Hi, 

Not sure if you are from a US or UK background but ESG financing (or anything around it, risk, modelling) is in its baby steps. And jobs (all areas) are widely acceptable and hiring. 

My first two thoughts are the following;

1) regulators will impose ESG related risk on banks who impose systemic risk to the economy. This is a fact, i'm not pulling this out of my ass. 

You can already fully read up on all this information regulators are thinking/imposing on banks such as the following;

[https://www.bankofengland.co.uk/climate-change](https://www.bankofengland.co.uk/climate-change)

2) in the meantime - banks are aware that 'new environmental metrics' will be imposed - and they are currently modelling potential metrics that could assist the regulator for a more homogenous approach when they compare ESG like-for-like comparing. For example - I am working on a machine learning algorithm that predicts c02 emissions per country on a daily basis - to ensure that liquidity management (funding/financing) remains 'as green' as possible - as long term structured finance (the government bonds) from X country are nothing else but a 'loan' to a country who perhaps might not be so good with the environment than country Y. If so - a metric can be imposed and as bank you can switch your bond from X to Y. This to ensure that you as firm/bank/whatever 'remain as green' as possible - while ensuring that 'risk' is not impaired. 

A lot of this information is already anticipated in #2022, especially for ICAAP related roles. 

So tl;dr

1) regulators

2) banks

have plenty of ESG related roles (from risk, modelling, financing, etc) 

there is plenty of neutral, unbiased information on these websites (ignore the wide internet, go to the source, the bank or the regulators) and read about this

and start applying. You'll be ahead of the curve.

I've been in banking (on and off0 for over 20 years, and ESG is literally in its infancy. 

Good luck!!!",2021-12-06 23:56:28
chuck_portis,"Bro, they're not ""giving"" anyone anything.  The only way to participate is to invest in EGLD and/or MEX.  If they didn't provide the boosted rewards for liquidity, they would have nobody using the Maiar DEX.  It's not a useful product on its own.  There's tons of DEX'es out there with hundreds of coins, working Bridges, high APR's, on more proven and established networks.

They aren't providing the Boost out of charity.  They are trying to remain competitive with other similar products which are superior in functionality and longevity.  They are showing up with an incomplete product (with bugs to boot) and they managed to attract $2B in TVL.  That's entirely from the Boost.  

It's not like anyone is getting in on the ground floor of $MEX.  It's valued at $2B market cap, which is more than Curve Finance / 1Inch / Compound.  These are all extremely established projects with huge TVL and longevity.  No sane person would invest in the MEX token at these prices.  That's why people were selling so heavily, because the team was inflating the value of MEX to make the rewards appear higher.

Now you have LKMEX and it's showing you 1000% APR, 3% a day, whatever.  Truth is, these APR's are nonsense if you can't sell the token.",2021-12-07 04:36:48
AZComrade420,"I can't find a job because I have no references from the past 5 years.  I was fired from my last two jobs during the pandemic and before that I broke contract as an educator by leaving mid-school-year due to my health after having been in the profession about 3 and a half years.

I left public education because I couldn't handle the pressure of being evaluated as an effective teacher when my classroom was dangerously underfunded (no fire extinguisher in the science lab with students with school records of starting fires!). My students were facing poverty at best and homelessness at worst and I was making less money as a certified teacher than I did as a long term substitute in another school district. My health declined and I left the profession.  I found work as a math instructor and eventually became the center director of the tutoring center.  I was in the job for roughly a year and a half. Then COVID-19 hit.

I started wearing a mask and gloves and implemented sanitization procedures without previous direction and anxiously awaited the shutdown and the ""13 Days to Flatten the Curve.""  As someone who taught children the importance of the ability to read a graph I was sincerely hoping we were going to take this seriously.

Somehow we were deemed ""essential workers"" despite all other educational facilities being closed at the time. We tried transitioning to online tutoring but the internet was too unstable at my location (even though I had been complaining about spotty internet since I had accepted the promotion the year before).  I was asked to integrate with another tutoring center on the other side of town so I was no longer able to walk to work. The tutoring center was crowded with more employees than the CDC was allowing at a time and my boss and the other center directors were not only not wearing masks but were telling our tutors not to wear masks ""as it makes it difficult to hear and the children can't see you smiling."" The panic attacks came back.

On my day off they told me to go wait for the Cox guy who was going to fix the internet at my center.  They showed up and fired me for my job performance.  A year and a half of work experience gone because the uneducated small business tyrant who owned the math center didn't want to follow CDC guidelines.  
I left education during the pandemic and headed for the ""green rush"" at new shop was opening and was biking distance from my home.  As we were an alternative health facility serving immunocompromised patients I felt comfortable with the procedures and precautions and we were reassured that the COVID-19 protections would be implemented ""until the end of the pandemic."" These company policies lasted through the end of the year.  They also stated they would notify employees if someone on your shift was exposed to COVID-19 for the purposes of contact tracing and testing.  This wasn't the only thing they lied about.

We were promised performance pay and evaluations by the CEO during orientation for our $1M/90day goal which we never received despite earning roughly $1.6M in the first three months. When we were acquired by a new company for roughly $85M and we started receiving company emails from our new corporate offices located on the 27th floor of the IBM building on Madison Avenue in Manhattan, I made a remark to my coworkers about I felt like a worthless idiot working for a bunch of MadMen who all think they're so smart and successful because they get away with lying about sales goals and paying their workers minimum wage (despite the majority of us having college degrees!!).  Despite gaining roughly a year of experience in customer service, cash handling, sales, inventory management, as well as state compliance at a job that requires you to be ""highly proficient"" in math (pun intended), my $500,000 in sales in 10 months counts for nothing.

I figured with my customer service, cash handling, and compliance experience I could start working in banking or finance (I know, I know, I'm philosophically dead, please don't hurt me) but because of my employment record I cannot find a work that will cover my house payment.

I was thinking of going back to graduate school for yet another worthless degree that I will once again fail to monetize and will provide me absolutely zero return on investment, but jokes on me because I don't even have three professional references at this point.",2021-12-07 06:06:23
slumberpartysis1,"Pros:
Mental health
Freedom to work a lot or not at all
No shitty co-workers or bosses
Making your own schedule
Everyday is technically different so it's not repetitive per se
You can spend time learning things while driving and in between orders.


Cons
Sitting for long periods of time
More likely to get in to an accident and die
Pay fluctuates even if you work a lot
?wear and tear?


Tips for anyone looking at this for full time work. 

Treat it like it's a company. Not like a job. You have no job security. If your company stops getting orders or you are a bad business. You will go out of business. 

Test out your area for at least two weeks to make sure it's worth it before quitting your job. I suggest a month

You need to save constantly. Just because you can have your pay any day you want doesn't mean you need to spend it. 

DO NOT. Finance or do this seriously in a financed vehicle. If you don't have a junk car and only have a financed vehicle save until you can afford a junker. There is 0 reason to have a nice car for delivering food.better gas mileage is a perk but people don't understand it plateaus at a certain point. If you finance a great car. your gas savings WILL NOT out perform the amount of money depreciation is going to make you lose. I put ? Around wear and tear because it does matter as a con but not nearly as much when you can fix a junker with YouTube and the car is at the end of its depreciation curve.

Learn how to make simple repairs. Brakes and rotors. Spark plugs. Coils. Valve cover gasket. Just simple things. 

If you struggle in normal work environments like I do. Delivering food might be a good alternative. It's helped immensely with my mental health. 

Sign up for all the apps (ue GH DD). Never just rely on one. If something happens to your DD account you always have a back up GH or something 

That's really it.",2021-12-07 08:58:06
RLutz,"There's already so many replies here that I think I'm probably wasting my time, but I did want to give my two cents as someone who has an extensive background in traditional software engineering but has recently moved into the Blockchain space. Some background on me, professionally, I've spent the last decade or so working for a bunch of different Fortune top 50 companies, I started my own consulting business, primarily solving interesting problems with what is now considered more traditional distributed microservices. Not to brag, but most of the times I would go join a new team, or consult at a new company, it was immediately clear that I was one of, if not the strongest engineer on the team. Granted, these weren't FAANG companies, but I did work for multiple top 50 companies in the US.

Today, I work for a Blockchain company filled with former FAANG engineers. For the first time in my career of 13+ years, I feel maybe slightly above average at best. I went into this place thinking crypto was an interesting novelty; one that I've dabbled in over the past 6 years or so doing a bit of mining, bit of investing, but mostly I thought it was just that, an interesting novelty. My thoughts on the currency aspect of Blockchain are actually largely unchanged. A deflationary currency is a bad currency, though it is possible that it makes a decent store of wealth for folks in places where it's difficult to accrue wealth.

That said, it is now my opinion, and the opinion of a lot of the former Google/Amazon engineers I work with, that although the currency aspect is what is currently keeping the lights on, that Blockchain itself is about to change the world. The folks who *really* understand Blockchain don't care that much about the currency aspect of the game but are entirely convinced that things like DeFi are about to completely change the world, and after two months or so working here, I am convinced as well--and I'm not some insufferable crypto bro, I'm a dude that just wrote business software.

Imagine a world where you don't need banks to give loans. A world where you don't need Wall St to engage in stock trade. A world where the traditional mortgage industry is made largely irrelevant. [This is the world that DeFi promises.](https://defieducation.substack.com/p/decentralized-finance-the-high-level)

If I had to summarize my Blockchain journey so far it would be like this. Originally, I thought cryptocurrency was a novel pseudo-Ponzi scheme and that Blockchain had a few very niche applications where it might actually be useful. Today, my view is that the currency aspect of Blockchain is largely a ""who cares?"" sort of thing. I liken Blockchain to the creation of ARPANET. Bitcoin was just the first step, essentially laying the foundation, similar to ARPANET, and now the things being built on top of it are akin to Amazon.com--you couldn't have hoped to build something like Amazon without the invention of the foundational Internet technology, and similarly, you couldn't have built up DeFi platforms that allow for loans without banks, stock trades without Wall St, and easy IPO's for everyone without Blockchain. There is a real power in being able to run code on a decentralized Blockchain where no one can alter your code and everyone agrees on what has happened and what the outcome should be (smart contracts).

I guess I'll leave you with this. There were folks when I was a kid saying the Internet was a stupid novelty. Those people, in retrospect, should have invested, or at the least, should have learned more about the Internet, because **eventually they had no choice but to utilize it.** I now fully believe Web 3 is the same. You might as well learn about it and get ahead of the curve because at some point in the near to distant future you will have no choice but to interact with it. NFT's are a meme, cryptocurrency is currently at best a way to store wealth, but DeFi and smart contracts will fundamentally change the world.",2021-12-07 22:05:08
xDenimBoilerx,"Gotcha, not disappointed at all. I'm not sure I want to keep messing with swing trading, was just experimenting with small amounts :)

Matic has been my best performer (bought about 5200 @.30 avg), followed very closely by One.

I was very risky and stupid with my Matic and Iron Finance got me for about half of it, so lately I've been much more conservative and just keep it on AAVE and borrow USDT against it to stake on Curve. 

I definitely need to start DCAing crypto again. I've just been giving money away on stocks instead.",2021-12-08 00:36:28
hakapes,"Encouraging, thanks for the info and the time. I am happy to follow up with the linked guides, good homework for the rest of the week.

I staked coins both in the CDC App for the card (180 days), Earn (90 days), in the DeFi Wallet (28 days unbonding) and in the Exchange to optimise a bit the fees (180 days).

In all fairness, for a newcomer like me, the journey is quite a steep learning curve.

I started with the CDC Visa Card.

Learning the app was a stretch. I remember when I googled Fiat, and started to understand what is going on and how.

Then I learned the CDC Exchange, look into fees, convert to USDC first in the app and then buy CRO in the exchange. Now I make limit orders to optimise the cost.

After 3-4 months, finally I started to use the CDC Defi Wallet. 

Then in the Defi Wallet, using dApps was again a stretch. I got as far as the VVS vaults.

Because Beefy is there, after a week or two, I decided to look into Beefy.

Now, Crystl Finance is another hop.

My message is that ease of use and user accessibility is quite a journey for anything here.

If you could be at least on the list of dApps of CDC Defi, that would make it much easier to onboard people.",2021-12-08 00:51:30
no-nonsense-crypto,"This isn't the first time a project has tried basically this method, and I'm not convinced it actually is all that great. There are a few problems with it:

1. People holding $PNG are just hangers-on providing no value to this system. I guess that's great if you're a $PNG holder, but if you're a user of the Pangolin trading platform, you've gotta ask yourself, why am I paying a fee to these random people who aren't giving me anything? As a trader, paying a fee to the liquidity provider makes sense, but paying a fee to the $PNG stakers? Why?
2. Okay, so let's say I decide to be a $PNG holder. Why should I have to stake to receive benefits? Does anyone actually benefit if I stake, rather than just holding $PNG? What's the purpose? You can argue that staking makes the implementation of the distribution easier, but there's an even easier way: just burn the coins you bought back. It works like this: Let's say there are 1million of a coin (let's call it CCC) with a market cap of $1 million, so each coin is worth one dollar, and you have 100,000 of that coin you want to distribute to holders. A holder with 200,000CCC will receive 22,222CCC from the 100,000CCC you're distributing, so their total value is now 222,222CCC, which is worth $222,222. If, instead, you just burn the 100,000CCC, the market cap stays the same, so the value of the coin goes up: the person with 200,000CCC now has 200,000/900,000 of the market cap insteead of 200,000/1million of the market cap, so their coins are now worth $1.1111111 each, so their total value is now $222,222. The point is, burning is a much simpler mechanism, that distributes to all holders. Of course, if you want to incentivize staking, distributing the coins to stakers and excluding holders who don't stake is different from burning. But... why do we want to do that? Stakers aren't contributing anything more than other holders, so why do they deserve more?
3. Buying back and distributing profits creates buy pressure, but there's a good chance that it just creates just as much sell pressure. If I have 100 $PNG staked, and I get 10 $PNG in staking rewards each month, what's stopping me from just treating those rewards as income and selling them immediately? Some percentage of users will always do this. Of course, if you burn instead of distributing buybacks, users can effectively do the same thing by calculating out a dollar-cost-average sell each month, but that's harder to calculate and fewer users will do it, in theory.

This isn't hypothetical at this point: [Sushi](https://www.coingecko.com/en/coins/sushi) and [QuickSwap](https://www.coingecko.com/en/coins/quickswap) has exactly the same mechanism for staking SUSHI as xSUSHI and QUICK as dQUICK, and if you calculate it out, both coins' price have deteriorated enough that you've lost money since the ATH, even if you include staking rewards. [Beefy](https://www.coingecko.com/en/coins/beefy-finance) has a similar mechanism, with the same result. I think at this point we can conclusively say that this mechanism doesn't work.

More fundamentally for exchanges like Sushi, QuickSwap and Pangolin, there's a basic catch-22 that needs to be solved:

1. On the one hand, if you don't give competitive rewards for providing liquidity to important pairs, liquidity providers will go elsewhere, and traders will follow since they need the liquidity.
2. On the other hand, if the only means you have of giving competitive rewards for providing liquidity is continuously minting a coin and giving it out to farmers, your coin will be diluted, and lose value. Ultimately this will result in you not being able to give competitive rewards.

Ultimately, this is a sustainability issue: none of the major AMMs have figured out a way to break this cycle. Curve might seem like an exception because the 4-year lock on CRV as veCRV is demonstrably causing people to lock up CRV, but this is only really a delay tactic. Without giving away too much information, I think that DFYN does have a solution which they haven't shared publicly yet (and I'm not going to share it either).",2021-12-08 01:12:31
deong,"Here's the thing you're missing. At a large company, jobs don't get posted by having the hiring manager write up a description and post in on the web site.

When I want to hire someone, my first step is to fill out a requisition form for our Talent Acquisition group. That form has several standard canned text options that could basically describe anything between ""janitor"" and ""chief marketing officer"". Think of how many jobs you've seen that say you might need to occasionally lift up to 10 pounds.

That form also contains a set of titles and corresponding pay grades that I can choose from. Am I hiring a Data Engineer or a Software Engineer? Is it a Senior Data Engineer or a Lead Data Engineer? Each of those titles has a document that describes the typical skills and experience needed as well as what the responsibilities of the job are. Those descriptions have been written by 40 people over the course of a year in meeting after meeting after meeting with the goal that HR can look across other companies of similar sizes, in similar industries, in your geographical area, etc., to calibrate salary ranges so that they know they're paying competitive wages in accordance with their hiring goals. 

I, as a director, care very little about any of that. I have a team that is down a person, and I want to find the best person I can to make my team as strong as possible. I do have a P&amp;L to manage, so I don't want to pay twice the going rate, but otherwise, I simply don't care if the candidate has 4 years experience in Python or 6. I care that they look like they're a good Python programmer that I can hire within my budget. But I'm just operating within that system. I have $X of dollars I can spend, and that lets me hire a Senior Software Engineer, so that's what I aim for. If I get a great candidate who is way off the experience requirements, I might hire them anyway at a junior level and save some of the money. If I find an amazing candidate who wants more than I can pay, I might go back to my finance team and see if I can find enough extra money to convert my open position to a Lead and offer them that instead.

That's the way everyone should treat job postings. They're a standardized form that is supposed to cover the fat part of the curve. I've never known anyone who used them as a completely prescriptive filter, as in, ""this candidate looks great, but they only have 3 years experience and we want 4"".",2021-12-08 01:58:45
WhatnotSoforth,"I'm currently working on a trading platform for RobinHood using R. Still stuck on the data wrangling stuff, handling tapes has so far been the biggest struggle. I'm writing the method to preferentially pull from a SQLite database, and if the tape does not exist there it will pull from RobinHood and/or from Yahoo with quantmod. This way I can use a generic function with a local cache as speedup, with the added benefit of seamless data pull for things that have not hit the cache yet. Once I finish that I can start on analysis tools, which will help me trade manually. Backtesting comes next, then orders. That pretty much wraps it up, and then I get to write a shiny app for it!

I chose R because it feels much more robust than python, imo. Very much a *""what you expect to happen usually happens the way you think it should""* in such a way that is great for rapid prototyping and first-shot success. Python isn't bad for QF, I just personally don't like it. A skilled python programmer would be miles ahead of me by now.

The learning curve for R is somewhat steep, but it's an insanely powerful language, and it's worth learning how to code in it well because it writes out so generic that you just become a better programmer in general as a side benefit. The best part is that boilerplate code tends to be minimal and the resulting code is therefore very readable and concise. Statements tend to be very ""meaningful.""

*Reproducable Finance* is a good book, I want a hard copy!",2021-12-08 06:02:13
