author,body,created
KGrahnn,"This is only true if you are a potato. For example I have no trouble gaining credits up to tier 10 while playing with no boosters and no premium time. If you are a good enough player, you can choose what to play, you dont need premium accout necessarily. You need it only if you are a potato.

 Normal curve is somewhat like that a potato can still play upto tier 8 and not go bankrupt, but higher tiers will most often drain the credits. Thus it forces most players to play lower tiers. It has an effect which spreads players wider across the tiers. This way everyone are not playing only the tier 10. It also has an effect that some players pay real money for premium time, which allows then to play more higher tiers, than without premium time. And real money allows WG to finance this game for people who are playing it for free.

The balance is quite intricate. Its quite possible to play all tiers, but its intentionally designed as such, that its more easier and enjoyable, as well less stressful to play, if you have premium time. I have premium time for example just because it makes my life easier. Most often I got no time to play try hard, and I want to casually enjoy some of my non meta tanks. Those tanks have certain weaknesses which can be overcome or make less weak by for example shooting premium ammo and using premium consumables. 

This doesnt mean I would have full load of gold, but if I empty one clip of amx 13 57 gold rounds into is3 side in one gmame, it wont bankrupt me. With premium account I can do this more often, and I dont have to even think about it. And it allows me to not think about it, I can just casually throw it, if I see an opportunity in a game. Without premium time I would probably think the cost of using the premium rounds, and the opportunity would go past and most often cost the game as well. One decisive flanking fight might affect the match so, that you win it in that moment for your team. You kill that tank which was crucial for enemy flank, and the potato teammates of yours finally have courage to advance, when that evil is3 is dead.

Thus few premium rounds  can make a difference and win more games for you.

But wot being unplayable? This is not true. Even if you are a potato, it only forces you to play lower tiers more often, to finance few higher tier games, until you again need to grind credits again at lower tiers. And if you climb up from the pile of shit and shine like a star, instead being just turd, you can choose to play what ever tier you want to.",2021-12-22 11:06:16
Adam_The_Millennial,"A majority of welfare programs don’t allow people to get on unless they work. Minus programs for people with kids because it isn’t about taking care of the parents in that case. The only reason why a lot of those single mothers don’t work is because we have very garbage child care programs. 

Politicians set it up to where most of these single mothers have to choose between not working and focusing on their kids or to work a job and not have money or time for their kids. 

A majority of the people on welfare are not fraudsters. Data shows maybe 1/10 applications are fraudulent. 
- www.lexingtonlaw.com/blog/finance/welfare-statistics.html/amp

If you are against those who defraud the system, I implore you to campaign against them rather than our welfare as a whole. We are the richest country in the world we should have no one starving. 

Even if we had every single person housed and fed on tax dollars, it’s not like these people are guaranteed to have enough money for everything they want. Honestly? That system would show even more who is willing to work because then people will be free to work for the things they want. They will be able to work for the economic positions they want. 

Everyone is too busy drowning and trying to survive instead of focusing on improving themselves or society. This won’t be something that can be fixed in one presidential term. This is going to take a generation or several to improve even if we start it right now full throttle. 

You’re right that not every single person in poverty will be able to be the next einstein. But some of them will. I was born into poverty. My family never had welfare growing up. I joined the military because being a physicist and mathematician isn’t economically viable.  

I served honorably and meritoriously for my entire adult life up until I was injured in service and was medically separated right before the pandemic. 

Now I have been studying computer science, AI, and how to improve our educational systems with game engines and VR. I don’t have to stress to survive because my disability payments are enough to have my basic necessities. 

Now I am free to put my brain to advancing our country. I always scored in the top percentile of the ASVAB and any other training program I went into during service. I got multiple meritorious promotions and trained hundreds of marines. But all that was stuff I was not passionate about. I still did it because I was capable and liked teaching others. 

But now? Thanks to VA disability, I am doing stuff I am passionate about. I can’t run or bend down anymore, but I can work at a computer. I know I am not the typical case, but these social safety nets turned a disabled body who can’t work anymore into someone who can help thousands in the future. If one in ten are fraudsters, maybe one in ten are like me as well. And I am sure I will be able to add more value to the US with my efforts than the few thousand dollars that fraudster drains. 

Yes. There are lazy people who have no aspirations, but a majority of people aren’t like that. 

Yes. There are a lot of unintelligent people in poverty, but literally half of them are above average. There are just as many intelligent people per capita in every single population. The bell curve will show up in every population for every metric. 

If we throw out the programs that help the disadvantaged just because 1/10th of the people are fraudulent, that means that all the people who legitimately benefit get left in the dust too. 

We should be empowering the population and then going after the fraudsters instead of generalizing the fraudsters to the majority because it is objectively not true that a majority of them are fraudulent or unintelligent. 



—- one more caveat. I used intelligence, not education in this entire argument. Poor people will almost always be less educated due to lack of opportunity. But there will be just as many intelligent people in that group as any other group. Intelligence is your ability to learn, not how much you know. 

What happens when we ensure a majority of our intelligent people can focus on advancing society?",2021-12-22 11:53:53
a_stonk_a_day,"Compreendo que sejas conservador como tal esta sugestão é focada nisso mesmo e não uma sugestão aleatória: cripto, nomeadamente stablecoins, moedas que seguem o valor do dólar e que removem o factor volatilidade que é habitualmente o maior entrave à utilização de crypto para quem não se move nesse mundo.

Juros de 5-10% ao ano em soluções de centralized finance (CeFi) como Nexo ou Celsius, para depósitos de stables como USDC e BUSD, ambas moedas emitidas por organizações centralizadas e com histórico de cooperação com os reguladores.

Juros de 10-20% ao ano em soluções de finanças descentralizadas (DeFi) como Curve, MakerDAO e Anchor Protocol, para depósitos de stablecoins completamente descentralizadas (Ex.: UST, DAI)  que também não são emitidas por entidades centrais como as mencionadas anteriormente. O nível de conhecimento para esta estratégia é um pouco mais elevado mas os retornos e a segurança também o são.  


E parabéns pelo percurso que fizeste até aqui. Boa sorte para a próxima etapa da vida que é fazer com que esse dinheiro não só não encolha, mas que cresça.

Fico à espera dos downvotes.",2021-12-22 20:33:39
teut_69420,"I'm a fresher and have an extremely weird take. Obviously learn your basics but most importantly learn how to learn. 

The learning curve for me has been extremely steep and it's hard. I'm an SDE in an IB but work as a big data engineer so I had to learn Java, many tools of CI/CD, spring, spring boot, Hadoop, hive, hbase, spark, Kafka, flume, AKS and docker. All of these in 5 months and more, i will be having to go through elastic search and cloud in the next few weeks. There were finance topics and basic stuff like jira which everyone has to learn so not counting here and many others which I definitely have forgotten.

So the best advice I can give is learn how to learn, I have felt the step up and to even have meaningful conversations about problems you are facing you need to know the tech stack completely, everything is linked. The thing I have understood is no one expects me to know these beforehand but I'm expected to learn them.

And enjoy.",2021-12-22 22:44:45
According-Object-502,"&gt;You’re getting downvoted and maybe it’s because of how you said it, but I think you are bang on.

I'm suprised I'm not getting down voted more. The truth hurts and people don't like hearing it. A tube driver in London earns £100k a year. That's just a tube driver and people are talking about £50k as if that makes them a highly qualifed high earner. 

If you take a random person earning 50k a year, say a recruitment consultant, they'll talk about the world as if they're Alan Sugar.  They think YOU should listen to them because they're sucessful and know things. The only thing they know is how to talk shit on the telephone and how to live pay cheque to cheque.

People are downvoting what I've said because it's them who I'm describing. Deep down inside they know they don't earn loads of money. They know they're no one important, they know no one gives a fuck about their instagram photos. No one cares when they see a photo of the one time you ate a starter in The Ivy. People rather just ignore their own reality because ignorance is bliss.

I live in a central London borough in a 2 bedroom flat. I know how much I earn and how much I've paid to live in a FLAT.  I don't regard myself as ""rich"". The house for sale on the next road is £25 million, and people are still pretending £50k a year makes them a high earner?! The year isn't 1982. 

If you think £50k a year is a lot a money, that just shows how far behind the information curve you really are. You're no where near the category of ""high earner"". That's why it seems like I'm talking about silly numbers. Being a high earner is not your reality. It's something you can't comprehend because that's not YOU. Get over over yourself and realise there's more to the world than your own little bubble where £50k a year is lot. 

Even somewhere in the north like Manchester, £500k isn't buying you a mansion. It's buying a NORMAL 3/4 bedroom detached house out the very outskirtks of the city. £250k is going to buy a studio flat/bedsit in the city center. All of this assumes the average person has a spare £50k in cash laying out to put down a deposit/cover other costs. Yet people think their £50k a year makes them an important high earner? They can't even buy a normal sized home on their own. They've got to get shacked up with someone they don't really love just so they can get a mortgage. That's not a ""high earner""

On top of this, the Government is artifically propping up the property market. The cut in stamp duty didn't benefited the average person. The guy on £50k a year didn't just buy a second home in Cornwall to work remotely from. He bought a trampoline or a hot tub on finance to put in his rented garden. That's the best it's going to get for them.

It might be blunt to say this stuff, but it doesn't mean I'm wrong. The average person is so full of their own bullshit, opinions and shit they've read on the internet. They're completely blind to the reality that they're not earning ""loads of money"". 

Everyday, the future standard of living for the average person is slipping further down the toliet. They're blissfully ignorant to the fact while sleep walking from pay cheque to cheque. They only pause for a moment so they can talk to someone like shit, post a staged photo on instagram, or to act outraged that their ""expert opinion"" isn't being taken seriously. 

I'm sorry to say, the average person in 2021 is an absolute fucking mug.",2021-12-22 22:57:21
sweenyG,"Not sure it holds true but finance at my company are on a lower pay curve than risk, something to be aware of",2021-12-23 00:42:22
Fantastik-Voyage,"Exactly,  it's as if this is designed for an experienced crypto investor...If my happenstance in January  5th the US shut down US dollars and saud ok your have to use loopring L2 for the rest of your life and you have 24 hours to get all your dollars switched there would be a nightmare...

So now there  Jake Chervinsky the head of blockchain fighting the war in Washington for decentralized finance 

But anyway , back to this...the learning curve for anyone curious is out of reach.....thats my opinion  but I'm learning as I go",2021-12-23 02:37:57
snakysour,"&gt;I am not really happy with this path, but I hope this is the shortest path and the misery will get over soon and I can retire in 2 more years, touch wood.

Amen to that!

Thing is there are plenty of such jobs only in IT / finance. To start up with those skillsets now is a big challenge for a non techie... besides being late in the curve...aur ye kimat ab de pana toh bahut he asambhav jaisa hai.",2021-12-23 10:09:02
marcuscontagius,"You seem to be implying that the treasury’s sole purpose is to sustain a high APY for the entirety of the runway? The minting/binding is what determines/sustains the APY, not the treasury…it’s why when minting rates are diminished so are rebase rates..

Glad you mentioned utility because that is the purpose of the treasury in the cases I mentioned.

If you’re at all familiar with the dynamics of the curve protocol and the role that the dao voting token plays in guiding pool reward rates, and by extension, pool liquidity then you would understand why the convex token (each of which controls ~6-7 crv voting tokens at the moment) is super important to terms of utility (google the curve wars). Add in the fact that convex has a capped supply and it’s pinwheel dynamics dictate it’s relative crv voting power per CVX token can only increase with time, and you have a pretty strong case for utility. Seems like a pretty smart capital allocation doesn’t it?

Pair this power to control, in effect, where people will put liquidity in curve (the largest protocol in defi) and you have a way to enhance whatever project you’ve invested in/seeded. You have a really effective way to provide lots of liquidity for your protocol. (Abracadabra/MIM was a classic example of this, and not surprisingly they are the same team behind wonderland finance). 

So now you’ve got the treasury full of cash to seed ideas and protocols or investments that you like and you control a mechanism to help protocols lock value and drive adoption to improve the odds of success and therefore a high ROI. 

The other example of deploying capital to drive revenue for stakers I mentioned was a position that returns 54 million/year on a 100 million stable coin investment. I’m not sure who you are but that isn’t really something many folks would sneeze at the way you did. Maybe you’re some investment whiz kid or something idk..if you do the math that’s a return of $7 on every $100 worth of TIME per year that someone holds and that’s only utilizing ~15% of the treasury for reference, Intel’s dividend is a return of $2.74 on every $100 held per year on 100% of the capital Intel deploys. 

Hopefully this helps you understand the actual purpose and *one* possible use case of the ohm fundraising model protocol.",2021-12-23 15:05:23
SethMooner,"Was it your first card or were you upgrading from Midnight Blue? For people getting the first card straight forward it is faster I understand. But yeah not worried because I use Curve so pretty much I'm getting cash back and rewards. Already staking DOT, VET, ONE, MATIC in the app. Actually I would like CRO to drop to 10-20 cents per coin so I can get 50,000 units. My target now is on 30,000 units before it reach $1. I stopped looking at the price on crypto. I'm here for the long run. I do DCA and I focus on units.

It is going to go up. They are becoming a huge platform. 3rd place on finance apps in the Apple Store. Already surpassed Coinbase on daily volume, sitting on 2nd place behind Binance. They are doing many things, every month,  new tokens are added, the staking rewards, the visa card, the nft plaform, DeFi wallet and the marketing they are doing? F1, UFC, Italian League, PSG, LA Lakers, LA Kings, Crypto  com Arena, yesterday I read that they are going to do advertising on the SuperBowl, imagine when the Grammys happens in the old staples center and all the things that are about to come that we don't know. I think we are still on early. There are many people that are not interested in crypto, or do not understand a thing about this world. 

So yeah, I need to pack as many CRO coins I can before we move to the 2-3 dollar barrier next year. I'm not touching my CRO.",2021-12-23 16:20:09
Different_Pea9894,"HEC on FTM is a big challenger as well! Of course lot of forks were made by amateurs and nothing professional was in the roadmap. I seriously invite you to check HEC medium Telegram or Discord.

A bank is on the way and so many partnerships are already done and many to come.

20$ millions invested in majority in Curve finance.
Many investissement to come. Treasury is put into work when the project is 2 months old only 

Most active on tweeter, most traded 600 millions last month.

DYOR as maybe I'm biased here!!",2021-12-23 22:25:01
coinfeeds-bot,"tldr; Convex Finance (CVX) is a decentralized finance (DeFi) protocol built on top of stablecoin exchange Curve Finance (CRV). Its native token is used for staking, liquidity mining, and voting. Both Binance and Huobi Global have added CVX to their roster.

*This summary is auto generated by a bot and not meant to replace reading the original article. As always, DYOR.*",2021-12-24 06:15:18
aNinjaWithAIDS,"&gt; I'd say what keeps it alive is global exploitation.

Capitalism is inherently exploitative and nothing else. As for a deeper look into the mechanisms that maintain capitalism and all other unjust economic models, I'll say it's these three things: corruption, propaganda, and warfare.

* Corruption to keep the tyrants' whims above the masses' needs.

* Propaganda to manufacture consent and acceptance from the oppressed.

* Warfare to expand its brand of exploitation and plunder on the tyrants' behalves.

&gt; How much would clothes cost if the people making them unionized and demanded fair wages, benefits and safe working conditions?

You may have intended this question to be rhetorical, but I think it's a fun one to discuss for two reasons particularly because of the example you used: clothes.

1. They have an [inelastic](https://www.investopedia.com/terms/e/inelastic.asp) demand curve. The profit motive of capitalism *easily* abuses this as Eccentric Rants describes in [this video.](https://www.youtube.com/watch?v=hI_qDCguCXM)

2. Clothes in of themselves tend to have a very small [marginal utility](https://www.investopedia.com/terms/m/marginalutility.asp) rate. This means that people don't need that many of them to be truly satisfied for long periods of time. 

Granted, all sectors of our economy should be unionized; but clothing and textiles should definitely be among the first 10 industries to be a public good sometime after food, water, healthcare, shelter, and banking/finance.",2021-12-24 09:14:15
ChottoTheFuck,"Not your keys not your coins.

When you lend your stables on Cefi options like hodlnaught, they are being used for more yields in defi applications such as those below.

Here are the defi alternatives if you wanna DIY and own everything.

1. Anchor protocol 19.5% on UST

2. AAVE on Polygon, deposit USDC, Borrow USDT, convert to USDC, redeposit that, rinse and repeat. Around 10-12% apy plus additional matic rewards, while hedging against USDT collapse.

3. Curve finance on Polygon. Liquidity mine USDC, DAI, USDT pair. 5% apy on fees, plus additional 2% in CRV and 3% in Matic.

4. Lending stables on Alpha Homora on Avalanche. Lend USDC, 9% APY on USDC, additional 4% in AVAX and 3% in Alpha.

5. Balancer on Polygon, liquidity provide on USDC/DAI/USDT/TUSD. 17% APR

6. Degenbox UST, this is absoulutely degenerate what else can I say. 100%+ apy on stables",2021-12-24 15:41:57
ChottoTheFuck,"I am currently ""risk on"" at the moment, so I don't do any stablecoin strategies right now but I am well aware of what I could do with stables as well and I am ready to switch to them if markets look choppy. So right now I run variations of the above strategies using crypto tokens instead of stables.

I currently use 2 of the above strategies and I am also using others that I have not described in the above.

Let me give you an example of what I am doing on AAVE right now, I deposit my Ethereum into AAVE, borrow USDT which has the most favorable borrow rates, convert that into DAI which has the most favorable deposit rates, redeposit that, and repeat once more to further increase yields while keeping a safe leverage ratio.

I would say the easiest if you want stablecoins yield is Anchor Protocol, just deposit it, easy 19.5% APY, no management, no farm tokens, no strategies whatsoever needed. However, Anchor is on the Terra blockchain so you would either have to use UST, or you would have to use a third party Ethereum aggregate like Orion Money if you still wish to stick with USDC. However, you will have to give them a cut and have it reduced to 16% APY. I have written a guide on how to use Anchor, but if thats not your thing you can use Alpha Homora as well, thats pretty nice and easy.

If you are just dealing with stablecoins, your risk is considerably less however you still have to watch out for depegging, and smart contract risk. For instance, 4 days ago, the auto compounder Grim Finance had a bug in it's code and someone exploited it to drain the protocol of all of its funds. $30 Million worth of Fantom tokens were stolen, all who used Grim Finance lost it all. Grim finance was apparently also an audited protocol so this was a shock to many.

Smart contract risk is unavoidable but it can be mitigated by using battle tested protocols.

Reputable protocols who have multi chain adoption like AAVE &amp; Curve is way safer than newer protocols such as Alpha Homora (although this one is pretty safe too). You want to use protocols which have higher TVLs as it would have more financial backing and be able to have a more robust development team and audit companies.

Feel free to pm me to ask further, I can direct you to the right resources if you are interested.",2021-12-24 23:01:06
New-Rich-5917,"It’s not like finance majors graduate after taking the low level English classes. You’re then put into rigorous upper-level classes. And let’s not act like with engineering that the insane curve doesn’t exist, that on top of the fact that you can graduate with a 2.0 and still. get a good job. Not the case for business students.",2021-12-25 03:45:48
geophurry,"Came here to say this. The *spirit* of this applies - and it’s true that someone with a 4K car is probably not in a position to replace it, but I’d wager that there’s probably a bell curve in terms of car price and and actual ability to afford replacement. 

Anecdotal reference: family in middle America is expecting 50k as their portion of the sale of a home they inherited. Sale hadn’t closed yet and they’re already looking to use that as the cash to finance a 100k vehicle.",2021-12-25 06:37:41
