author,body,created
frank__costello,"Imagine you want to sell your BTC for USD, but all the exchanges are banned in your country.

On Ethereum, you can always trade WBTC for Dai on Uniswap.

That's the most basic use case, but you can also lend WBTC and earn interest, or use WBTC as collateral to take out a loan.

I know someone who wanted to buy a car, but didn't want to sell his BTC. So he moved it into WBTC and used MakerDAO to take out a loan to buy the car.",2021-04-01 01:17:08
Isabela_Grace,"HODL it and potentially lose all of it in an unfair liquidation the Maker Foundation won’t make right then claim that it’s not their fault and it’s “decentralized.”

https://www.coindesk.com/28m-makerdao-class-action-lawsuit-arbitration

Edit: oh this isn’t even about Maker you’re like a legit scammer.",2021-04-01 05:28:42
DiamondHandsPiper,Who triggers the liquidation event are there liquidators like makerdao who ensures accounts are overcollateralized,2021-04-01 06:53:50
StatSticks,"liquidation events are automated within the protocol (similar to that of makerDao) and make use of chainlink oracles for the asset prices.  


EDIT: 

&gt;  who ensures accounts are overcollateralized 

For stakers to receive rewards they need to be 600% collateralized, so I believe it is a self-sustaining system.",2021-04-01 06:55:01
Palmboom333,"They have some users that publicly stated they use Request already. Some of the users are MakerDAO, Gnosis Safe, OCEAN, AAVE (not sure if confirmed) NEAR, The Graph, ...",2021-04-01 19:53:26
cryptoeyeJk1,"Thanks for your questions. My team is made of crypto coaches/traders,   blockchain promoters, event strategies and volunteers. Find below a list of the key members in this team: 

*Fuseini Alhassan  (aka cryptoeye); NavCoin ambassador to Africa (Ghana) I am a long term community activist who organized the first official NavCoin meetup in 2019. I have also partnered with crypto travelers in spreading the message of crypto currencies across Ghana and Africa at large. Twitter: https://twitter.com/Alhassanshila?s=08

*Sahabia Yakubu; a Ghanaian-born and based cryptocurrency promoter, writer and speaker. He is currently the ambassador for MakerDAO, founder of DeFi Africa &amp; Pundix XPOS Distributor.
Sahabia is an active crypto enthusiast. He regularly organizes events to educate Ghanaians about blockchain, cryptocurrency and DeFi related products. Twitter: https://twitter.com/RealSahabia?s=08

*Maltiba Adam (aka Cryptoshot); is a cryptocurrency and blockchain advocate having helped build several blockchain communities for different international blockchain projects such as Goldcoin, smartcash and bitcoin rhodium in Africa. He’s currently the marketing &amp; relation officer for DeFi Africa. Maltiba is an expert in binance and p2p trading. Twitter:https://twitter.com/MaltibaGH?s=08

*Baako Shei (aka Baako); he's a blockchain and cryptocurrency advocate for Africa as well as trader. Twitter: https://twitter.com/jk19923?s=08",2021-04-01 22:12:15
kwadrax,"AFAIK, opening a MakerDAO CDP is one of those nearing $400.
It's hard planning for that though as it's pretty much impossible to know which contracts are so complex/will cost so much until you initiate the transaction.

https://www.gasnow.org/ has an interesting list but it doesn't not contain Maker, AAVE, SNX, ...",2021-04-01 22:17:08
Pasttuesday,"I can't put any KYC info into uniswap, makerdao, yearn.finance, cream.finance, reflexer/rai minting, etc etc. 

what are YOU talking about?",2021-04-01 22:59:20
Common-Papaya-1238," ""Launched a [MakerDAO airdrop](https://medium.com/sportx-bet/how-makerdao-mkr-and-dai-holders-can-claim-their-sx-airdrop-c948445574ce) to the r/MakerDAO reddit community. We also launched a twitter poll and there seems to be a ton of interest in future airdrops to the $MATIC and $QUICK communities as well "" very interesting!!!!",2021-04-02 02:16:05
KingBTC,"I've taken all my BTC, transferred to ETH chain to get WBTC, put WBTC into a MakerDAO cdp and use that collateral to generate DAI allowing me to spend USD. My coins are stable at $1, which merchants appreciate.",2021-04-02 03:00:02
brokemac,"Man, I don't visit this subreddit much but just bought a bunch of MKR. I read this and thought ""Reserve team"" meant something like ""core team members"" or employees adjacent to the core team of MakerDao. And by ""copy MakerDao"" I thought this meant create a fork of MakerDao or increase the supply to pay themselves. I was having a small panic attack. Was trying to confirm if it was an April Fools joke or something. I understand now though. Whew!",2021-04-02 03:03:42
brokemac,Opinions on MakerDao? I was extremely bullish but I see there is a lot of heated discussion about how the protocol and Maker team handled liquidations caused by Black Thursday last year.,2021-04-02 04:02:56
upscaleHipster,Sounds like an use-case for MakerDAO Real-World Assets.,2021-04-02 04:08:47
upscaleHipster,"Liquidations means that the ETH collateral is sold to bots that auction for it. During Ethereum network congestion, most of the bids were won by a bot placing 0 DAI bids because it was paying the highest gas while other bids from the rest of the bots didn't went through.

&amp;#x200B;

Maybe this helps: [https://medium.com/@whiterabbit\_hq/black-thursday-for-makerdao-8-32-million-was-liquidated-for-0-dai-36b83cac56b6](https://medium.com/@whiterabbit_hq/black-thursday-for-makerdao-8-32-million-was-liquidated-for-0-dai-36b83cac56b6)",2021-04-02 04:13:18
Ant-n,"&gt;	I can’t put any KYC info into uniswap, makerdao, yearn.finance, cream.finance, reflexer/rai minting, etc etc.

Where did I talk about those services? I am talking about PayPal.

Just declare you gain or loss to the tax office and you are legal. It is not particularly difficult, without third party there is no KYC by definition.. there is no « customers »",2021-04-02 14:20:59
BakedEnt,"Example (thanks to u/Liberosist)

March 2021: The Scalability Race heats up. Utterly bananas how rapidly this space is evolving. Just shows innovation can go into overdrive faster than anyone can imagine when the need is dire.

1st March: Optimism is coming this month! They have won this race!

A week later: Uh, oh, rumblings of a delay. But generalized ZK Rollups are years away, so no worries, Optimism will still win.

9th March: Matter Labs says generalized zkSync will become said generalized ZK Rollup ""faster than many think"".

10th March: MakerDAO announces Optimism Dai bridge with fast withdrawals.

16th March: Aztec launches, bringing scalability and privacy to ZK rollups.

22nd March: StarkWare announces ImmutableX now does ~9,600 TPS and public launch is imminent. Likewise with dYdX.

23rd March: Uniswap announces they will be on Optimism.

24th March: StarkWare raises a cool $75 million, three times more than Optimism, presumably to accelerate development of StarkNet, their generalized ZK rollup. Looks like generalized ZK Rollups might just land in 2021, after all.

25th March: Arbitrum announces they have a release candidate with BLS signature aggregation, commits to a fully public launch. Incidentally, Vitalik was in Optimism discord pushing them to support BLS just a day earlier.

A few hours later: Optimism confirms the delay, public launch delayed tentatively to July, though whitelisted projects like Uniswap and Synthetix come earlier.

27th March: Matter Labs drops the mic, generalized rollup zkSync 2.0 is done, public testnet in May 2021, public mainnet July 2021 if all goes well. Might I remind you until recently everyone (including Vitalik) thought a generalized ZK Rollup was years away.",2021-04-02 17:11:33
roboczar,"a few different ways, you can post it on MakerDAO as collateral, or you can do it on one of the DEXs like AAVE",2021-04-02 21:17:02
textrapperr,"It is playing out real-time atm.  Ethereum has Makerdao and Tezos has Kolibri.  Ethereum has Uniswap and Tezos has Quipu.

I note the differences if these two go head to head in this article: [https://textrapper.medium.com/the-difference-between-pow-defi-and-pos-defi-and-why-this-will-give-tezos-a-continuing-edge-over-5fb1de769163](https://textrapper.medium.com/the-difference-between-pow-defi-and-pos-defi-and-why-this-will-give-tezos-a-continuing-edge-over-5fb1de769163)

""You can deposit your TEZ in Kolibri and get **baking** rewards plus take a leveraged TEZ position, and you could now take that leveraged TEZ and add it to Quipuswap and earn trading fees plus **baking** rewards.

You could do the same on Makerdao and Uniswap but in both places you would be missing out on baking rewards.

If we compare the same Defi legos on Tezos and Ethereum:

Tezos POS Defi = money borrowed from Kolibri + baking rewards on collateral + LP fees on Quipu + Baking rewards on Quipu all done with almost no transaction and smart contract fees. ETH POW Defi = money borrowed from Makerdao + 0 POW rewards + LP fees on Uniswap + 0 POW rewards all done with big transaction and smart contract fees.""",2021-04-02 23:50:33
roboczar,"post collateral at MakerDAO or AAVE, borrow the lowest interest rate stablecoin, cash out. Keep enough ETH to cover you in market downturns so you don't get liquidated, as well as enough to cover interest.",2021-04-02 23:54:02
heavyweight0,"Makerdao, aave",2021-04-02 23:54:32
AusIV,"It's a little complicated.

When you send ETH, you can send ETH and invoke a contract at the same time. That makes it easy to send ETH between contracts and have the contract do something with the ETH that you sent it.

ERC20 tokens don't have that luxury. If you just send an ERC20 token, it gets sent to the contract you're sending it to, but the contract doesn't get to see that you sent it those tokens. If I just call `transfer()` on a token contract, the target receives the tokens, but it doesn't know it received the tokens, and there's not an easy way to establish that they came from me.

So ERC20 tokens came up with a different solution: Allowances. When you ""unlock"" a token, you're giving the target contract permission to withdraw that token from your account. Subsequently, when you make a call to the contract, it can use the allowance you set up to withdraw tokens from your account in the middle of its action (it can verify that you're allowed to do whatever it is you're sending tokens for, pull the tokens, then record that you've paid whatever you were paying for).

Now, there are a number of solutions to this poor UX. Some newer token types have an option to send tokens to a contract and have the token contract call a function on the target on your behalf. The target contract can verify that you permitted the action, and that it received the tokens. But the ERC20 was the first established standard, and there are several competing standards that solve this problem, so approvals are still the most reliable way to achieve this.

Interestingly, DAI has a feature where you can cryptographically sign a message to set approvals *without* having to send it as a message. I've used some sites where you sign a message then make a contract call, the signed message gets included with the contract call, and the allowances get set up in the same transaction as the contract call, which improves the UX a bit and saves on gas. I'm a bit confused why MakerDAO doesn't use that approach in their own applications when I've seen other places that use that model.",2021-04-03 00:49:41
BullToTheMoon,"Kinda. Uniswap and Sushiswap are exchanges. You add money to them and then you collect fees from people like me who would never use Binance or Coinswap as my exchange.  I can convert ETH to DAI, and you get a tiny fee. But when many people use it those fees add up and you get a reasonable return on your investment.

MakerDao, Compound and Aave are lending platforms. People borrow money and if you provide tokens then you collect interest. I've done this too.  I may want to borrow 1,000 DAI then use that to buy more Ethereum. But eventually, I gotta pay back that debt with interest.

I've only personally used MakerDao,Compound, and Uniswap.

MakerDao has the highest fees last I checked so I stopped using it. But they are the ones who create new  DAI, so it's really only worth using them if you have deep pockets.

&amp;#x200B;

This is a huge rabbit hole and I'm not very smart about it.  I'd seriously youtube things like ""Ethereum DEX""  ""Ethereum DAO"", and the other top things I mentioned to learn how they work.",2021-04-03 02:19:32
shiftli,"Hmm, sucks for MakerDAO to be so far behind. I guess that's the catch when arrive early and pave the way for others...",2021-04-03 03:56:19
omerag,"Not certain I understand the question but I'll give it a shot.

**Buying DAI through an exchange**  
DAI is a stable coin that is minted by MakerDAO. It's pegged (floating) to the US Dollar and its price should always be around $1 US dollar. In this scenario, barring any black swan events, you're pretty safe (as safe as can be in crypto) in knowing this will stay around $1.  
TLDR: No need to worry here  


**Borrowing DAI from Oasis**

You can also borrow DAI. How does this work? You head over to a lending protocol / website like Oasis, AAVE, Compound etc. and can borrow DAI when placing another token as collateral. For example, you can borrow DAI against ETH. Most protocols require an over collateralization of 150%. In this scenario, you need to be watching the price of ETH. If ETHs price is volatile and dips, you can lose your collaterilzation ratio of 150% and get liquidated.  
TLDR: Make sure you maintain the required collateral ratio  


Helpful vid: [https://www.youtube.com/watch?v=bJPdEfENAOA](https://www.youtube.com/watch?v=bJPdEfENAOA)",2021-04-03 07:00:22
wikidemic,Just need the right perspective on [MakerDAO](https://makerburn.com),2021-04-03 09:24:06
beansmedines,Is there anything that needs to be done if you have ETH in an Oasis Vault (MakerDAO) before the Berlin upgrade on April 14th?,2021-04-03 09:27:47
Stobie,The biggest platforms for what you want are makerdao which let's you mint dai using eth as collateral with the lowest cratio of 130%. The risk is that the price drops and your ether collateral becomes worth less than 130% of your dai and you get liquidated. Check defi saver.,2021-04-03 13:33:51
AutoModerator,"Hello /u/tinasalamander! I regret to inform you that your comment has been automatically removed because your account is too new. This is to help us prevent spam from proliferating this subreddit. But don't fret! Our threshold for commenting is very low. Try commenting again here in a couple of days.

In the meantime, please familiarize yourself with the [reddiquette](https://www.reddit.com/wiki/reddiquette), as well as /r/MakerDAO's rules, located in the sidebar [or by following this link](https://www.reddit.com/r/MakerDAO/about/rules).

*I am a bot, and this action was performed automatically. Please [contact the moderators of this subreddit](/message/compose/?to=/r/MakerDAO) if you have any questions or concerns.*",2021-04-03 18:48:07
MrNebbiolo,"You're describing the functionality of MakerDAO. You'll want to borrow Dai, not USDC. It will be cheaper and more efficient.",2021-04-04 00:04:27
vantuan1,"MakerDao

I do this with dai.

You need to manage your vault and keep it over 200% to be moderate safe our over 300% to be safe.",2021-04-04 06:00:46
Aquinasinsight,"I see, to begin Cardano doesn't have smart contracts and just released it's native tokens. ETH has obviously get those for years already with different variations of naive tokens (erc20, erc223, erc 721).  The ecosystem of ETH, I don't know how many working projects are on there but it's well over one or two hundred. The biggest ones are in the NFT area like open sea and then there is DeFi with things like Uniswap, aave, synthetix, MakerDAO, etc.

Of course, ETH is moving to PoS like ADA started with, but then EIP 1559 is the next change to the monetary policy which will bring deflationary fee burning. Past that there are later two solutions such as Loopring, optimistic roll-ups and MATIC.

On the Enterprise level you have the Ethereum Enterprise Alliance (EEA) which is corporate partnerships with ETH. A lot of huge corporations there. Then the recent news of the Office of the comptroller said you can settle payments with banks using stablecoins on the ETH blockchain and visa using ETH and USDC later this year.

This is what people are referencing when they say first mover advantage and it is a very real thing because, ethereum has just had more time to develop these partnerships and relationships.

You can see that already starting to take place with cardano and it's Ethiopia partnership that should be coming out soon.

I think cardano has very good technology and is an aspiring project with a lot of smart minds working on it but it is going to take time for these things and these partnerships to develop, no matter how amazing the technology is this stuff doesn't happen overnight.

That's why earlier I was referring that cardano's real competition is the other smart contract platforms that have been around for a year or two not six years like eth.

Hope that helps answer your question, obviously it would be nice if both succeeded and I think that is very possible that each smart contract platform will capture a different segment of the world.",2021-04-04 07:51:47
brokemac,"The fundamentals of a lot of coins are way stronger now relative to their price than they were at the start of the run. Especially for the lending/borrowing platforms. For example, there is double the amount of collateral locked in Makerdao (used for loans) as there was in January. If it were a stock, it would have a P/E ratio of about 27, which is extremely reasonable for a ""growth"" asset.",2021-04-04 10:13:39
Lastwordsbyslick,"I agree in principle, for sure. But practically, ETH was a DAO, got hacked, forked - survived! - but still. MakerDAO took the covid opportunity to steal millions in ETH from its users and blamed a failure in their liquidation mechanism. The DAO ate it up. And now FWB is a dao that also managed to get itself hacked. I don't think FWB are as nefarious as Maker but still, a pretty consistent set of outcomes, it seems. If and when someone gets the mechanism correct it'll be great but until then I will continue hoarding evidence that affirms my initial prejudice",2021-04-04 22:25:28
kraken6310,"Babel fees are discussed @ 36:30:  
[https://www.youtube.com/watch?v=YXaK0cvgoFQ&amp;ab\_channel=IOHK](https://www.youtube.com/watch?v=YXaK0cvgoFQ&amp;ab_channel=IOHK)

Article on the first stablecoin to be issued on Cardano:  
[https://decrypt.co/40264/cardanos-stablecoin-will-be-better-than-makerdao-says-hoskinson](https://decrypt.co/40264/cardanos-stablecoin-will-be-better-than-makerdao-says-hoskinson)

If you have any questions, feel free to ask!",2021-04-05 01:13:43
TheProdigalBootycall,"The same thing happened to me about two years ago.  I got in on MakerDAO very early and lost a bit in December of 18.  Great things about crypto, give it some time and you’ll forget all about those losses.",2021-04-05 01:24:51
AutoModerator,"Hello /u/AutoAdmin001! I regret to inform you that your submission has been automatically removed because your account is too new. This is to help us prevent spam from proliferating on this subreddit. But do not fear! A message has been sent to the moderators, and if this submission is a genuine contribution, then it will be manually approved by the moderators. 

In the meantime, please familiarize yourself with the [reddiquette](https://www.reddit.com/wiki/reddiquette), as well as /r/MakerDAO's rules, located in the sidebar [or by following this link](https://www.reddit.com/r/MakerDAO/about/rules).

*I am a bot, and this action was performed automatically. Please [contact the moderators of this subreddit](/message/compose/?to=/r/MakerDAO) if you have any questions or concerns.*",2021-04-05 02:24:49
hugo4000,https://medium.com/@whiterabbit_hq/black-thursday-for-makerdao-8-32-million-was-liquidated-for-0-dai-36b83cac56b6,2021-04-05 02:40:30
Berlout,"Plenty of ways to avoid transfers to wrong accounts, ENS, picture match etc. and plenty more will be developed. Scams happen to people within the current banking system without recourse. Even just having verifiable collateralised loans is good - check out makerdao for example. If it makes you feel better to believe blockchain tech is garbage I'm not going to try convince you otherwise though.",2021-04-05 08:48:31
GrilledCheezzy,"I’ve been excited about DeFi since 2018 so I’ve mostly been chasing apy as an LP for the last six months and trying to earn gov tokens. I was one of those people that got screwed in the 0% liquidation with MakerDAO in March of last year. Right now I’m mostly in ADA, ETH and BTC and then this new project, Visor Finance as my larger play with the big boys. Holding all my recent defi airdrops too after the way UNI has played out.",2021-04-05 09:21:10
vantuan1,You can do the same on MakerDao or on compound. You need to warp your btc to Wbtc on ethereum chain. I you have any questions I will help you,2021-04-05 11:37:16
ATShields934,"Both

Price go up.

But also, Bitcoin pioneered the whole idea of crypto currency, and most of the time, it directly affects the rest of the market. With that kind of influence in such a highly economical structure, and forks of that is simply neutered by comparison, and are relying more on the Bitcoin name for marketing purposes than any real value.

If you're looking for something other than Bitcoin to invest in, invest in Ethereum or MakerDAO for similar reasons.",2021-04-05 15:29:39
Bbfnn,"Hmmm BTC, ETH and MakerDAO... One of these is not like the other!",2021-04-05 18:06:47
r-2-eth-2,"**Decentralized lending protocol Liquity launches on the Ethereum mainnet**

&gt; Decentralized borrowing protocol Liquity is now live on the Ethereum mainnet. Founded in January 2020, the Ethereum-based lending protocol allows users to draw loans against ETH with a minimum collateralization ratio of 110% - lower than the 150% ratio required for MakerDAO - and does not charge a recurring ""Stability fee"" the way Maker does. ""We believe Liquity will unlock a whole suite of new capabilities for DeFi users, and is pushing the space forward with their unique 'governance-light' protocol approach,"" said Polychain co-founder and CEO Olaf Carlson-Wee in a statement.


**Market Conditions**

    ETH:	$2,102.09
    BTC:	$58,870.51
    Ratio:	0.0357
    Date:	Apr 05 2021",2021-04-05 22:08:12
fatmambo,"ETHC moving like crazy this morning, company still valued under $80 million even though they hold over $110 million worth of ethereum (they also hold some makerDAO and a stake in a crypto exchange/ fiat-crypto onramp. I see big upside potential from these guys :)",2021-04-05 22:54:45
Lazy_Physicist,"Risks regarding makerdao:

1. Smart contract risk - this is present for all defi contracts

2. Price risk, if eth crashes youll have one hour to pull your dai out of whatever and repay your loan or add more eth to provide enough collateral. If this happens during a period of high congestion you can expect to pay out the nose for the transaction costs. 

3. The stability rate can and probably will change in the future. It's based off of governance votes and if it changes that will change your overall returns and debt accrual. In the 3 months ive been doing this the eth-A stability rate went from 2.5% to 5.5%

4. There are minimum debt floors (minimum debt for a cdp) depending on the type of cdp you create. If this floor changes due to a governance vote be sure you understand how that affects your ability to mint more dai or payback your debt.

All of that said yes it seems like you've got a good handle on your risk. Fyi youll need to make sure you understand the collateralization ratio and when it will cause you to get liquidated. Personally i maintain a 500% collat ratio just because I'm very risk averse. I figure if the price of eth drops to 500 my plan is to just buy more and add it as collateral rather than pay off my debt.",2021-04-06 00:41:52
JizenM,"&gt; even if they only execute Phase1 that's massive in the crypto space

Exactly!

**MakerDAO is $2.2 BILLION market cap and $OPEN is $8 million, and $OPEN has an even bigger potential than MakerDAO!**

That's why I think $700 - $800 million market cap is inevitable if they manage to pull off even phase 1.🙂",2021-04-06 01:06:51
Neophyte-,"- providing liquditiy e.g. uniswap 

- mint dai at 5% stability fee, loan out dai on defi (compound, curve etc). 

- eth2 staking, can be done with eth1 tokens via custodial and decentralised protocols . 

each have their own risk, smart contract bugs resulting in hacks. but also high gas costs, the cost to create a cdp or vault in makerdao is crazy expensive right now. its not really worth it unless you are minting 10k usd of dai minimum",2021-04-06 04:34:04
JizenM,"&gt; Do they sell your collateral?

If the value of your collateral keeps falling then eventually yes.

It will be similar to how MakerDAO works in that you can only borrow a certain percentage of the value of your collateral.

So depending on how volatile your underlying collateral is you may only be able to borrow say 50% - 60% of the value.

**This is still *amazing* in my view because you can use so many things that the banks won't accept as collateral for a loan, including the many different tokens that we love but aren't (yet! 😅) one of the top-3!** 😀",2021-04-06 05:00:38
