author,body,created
SLimJy6,"Egypt is one of the companies. here's a quick spoon-feed I made before:

1.	Unknown on social media, people think it's a dead ICO even though they have been developing and gaining partnerships all this time. Marketing has started yet.

2.	The first public blockchain company to solve the Bill of lading paper problem (what is bill of lading: [https://www.youtube.com/watch?v=klwYBylAcCk](https://www.youtube.com/watch?v=klwYBylAcCk))

3.	Has signed an agreement with Egypt for ALL imports to use the CargoX BoL solution from July 1(proof: [https://www.nafeza.gov.eg/en/site/aci-details](https://www.nafeza.gov.eg/en/site/aci-details) )

4.	Will be used by ALL of India in the future (proof: [https://metroshipping.co.uk/news/india-approve-use-of-blockchain-bills-of-lading/](https://metroshipping.co.uk/news/india-approve-use-of-blockchain-bills-of-lading/))

5.	Every digitized BoL will make use of CXO (tokenomics can be found with ctrl + f “CXO” here: CargoX-Business-Overview-Technology-Bluepaper.pdf)

6.	The Egypt partnership alone will pump the market cap by at least x8 (the math done here: [https://medium.com/@DeFi\_Waifu/cxo-tokenomics-dc3535adde40](https://medium.com/@DeFi_Waifu/cxo-tokenomics-dc3535adde40))

7.	Will be used by [Contour.network](https://Contour.network), which is a collaboration of major banks to solve the letter of credit problem (proof: [https://www.contour.network/network](https://www.contour.network/network)) and ( [https://smartmaritimenetwork.com/2020/10/28/fintech-firm-contour-to-integrate-cargox-electronic-bills-of-lading/](https://smartmaritimenetwork.com/2020/10/28/fintech-firm-contour-to-integrate-cargox-electronic-bills-of-lading/) )

8.	Has a partnership with Maker ( [https://medium.com/cargoxio/makerdao-and-cargox-partner-to-revolutionise-logistics-supply-chains-and-shipping-9fc1f4747205](https://medium.com/cargoxio/makerdao-and-cargox-partner-to-revolutionise-logistics-supply-chains-and-shipping-9fc1f4747205))",2021-05-05 03:29:21
bandana_bread,"I can see your point, but it's not only backed by crypto, in addition you will get liquidated if your crypto assets fall below the treshold, and the treshold is far below 100%. I think the system that MakerDao has in place should be able to handle a big crash quite well. I personally have 50/50 USDC/DAI. Diversifying is never a bad idea imo.",2021-05-05 04:35:39
rawtxapp,"I had the same hesitation, the answer: makerdao!

It's not like a ""normal"" financial loan, there's no pay back schedule, you only pay it back whenever you want, as long as Bitcoin doesn't fall by like 50% to get your position liquidated, you can wait years and years and when the price goes up, you can cover the loan with a portion of the collateral (or just keep borrowing against the same collateral).",2021-05-05 09:14:08
Hopai79,"Non-Google amp link:   
[https://decrypt.co/resources/makerdao-guide-learn-explained-decrypt-3-minutes](https://decrypt.co/resources/makerdao-guide-learn-explained-decrypt-3-minutes)",2021-05-05 09:52:18
AutoModerator,"Hello /u/senhnator147! I regret to inform you that your submission has been automatically removed because your account is too new. This is to help us prevent spam from proliferating on this subreddit. But do not fear! A message has been sent to the moderators, and if this submission is a genuine contribution, then it will be manually approved by the moderators. 

In the meantime, please familiarize yourself with the [reddiquette](https://www.reddit.com/wiki/reddiquette), as well as /r/MakerDAO's rules, located in the sidebar [or by following this link](https://www.reddit.com/r/MakerDAO/about/rules).

*I am a bot, and this action was performed automatically. Please [contact the moderators of this subreddit](/message/compose/?to=/r/MakerDAO) if you have any questions or concerns.*",2021-05-05 10:02:11
gweisoserious,"ETC is an irrelevant fork of Ethereum many years ago due the infamous [DAO hack](https://www.gemini.com/cryptopedia/the-dao-hack-makerdao), created by a handful of butthurt people that didn't like the solution to exile the attackers funds. It has no real development, ecosystem, or community and is basically a zombie. 

It is also insecure and has been attacked several times (ie the chain rolled back by malicious miners so they can steal your money). The fact it still has any market anywhere is seen as blasphemous.",2021-05-05 11:32:17
massnomis,"No one else reports prices, especially with that quality. Compound has an open oracle and makerdao has there thing but end of the day other places reffer to chainlink pricing",2021-05-05 11:32:40
drogean3,https://app.defisaver.com/makerdao/manage,2021-05-05 17:43:37
player_zero_,"Defi.

Maker (MKR) is the governance token of the MakerDAO and Maker Protocol — respectively a decentralised platform and a software platform, both based on the Ethereum blockchain — that allows users to issue and manage the DAI stablecoin.",2021-05-05 20:09:58
AutoModerator,"Hello /u/p_h_i_! I regret to inform you that your comment has been automatically removed because your account is too new. This is to help us prevent spam from proliferating this subreddit. But don't fret! Our threshold for commenting is very low. Try commenting again here in a couple of days.

In the meantime, please familiarize yourself with the [reddiquette](https://www.reddit.com/wiki/reddiquette), as well as /r/MakerDAO's rules, located in the sidebar [or by following this link](https://www.reddit.com/r/MakerDAO/about/rules).

*I am a bot, and this action was performed automatically. Please [contact the moderators of this subreddit](/message/compose/?to=/r/MakerDAO) if you have any questions or concerns.*",2021-05-05 23:02:11
Destreich,"Collateralize my ETH in MakerDAO, withdraw Dai with a very conservative collateralization ratio, then yield farm with the Dai for passive income while maintaining ETH exposure and avoiding triggering a taxable event on the ETH.",2021-05-05 23:44:59
Innoculos,MakerDAO took some rental properties as collateral for DAI recently. Kind of similar to what you mentioned with Voyager.,2021-05-05 23:52:07
kwadrax,"MakerDAO has teams/functions, independent from the foundation,  that get payed by the DAO.",2021-05-06 01:10:08
st333p,"I have my doubts on that, at least not my interests. Bitcoin not having a very expressive scripting language is a feature, not a bug. And if that sidechain gets hacked and bad decisions are taken (see makerdao hack) the main chain fill suffer from it. I really don't see why we need to bring that garbage js-based language on top of btc.",2021-05-06 02:14:57
Bustedtire,"So ETC and ETH were a separated blockchain pre DAO is what your saying.

No.  ETH was forked to restore the funds.  So the chain was modified.  It's the whole point of why ETH forked from ETC.

Here's an article to help you. 

https://www.gemini.com/cryptopedia/the-dao-hack-makerdao

I'm done playing the ELI5 for your mental gymnastics.  Sorry I couldn't better explain the difference between the technology vs the blockchain for you",2021-05-06 03:55:03
r-2-eth-2,"****

&gt; Because rETH is ETH, but it's an ETH derivative that outpaces ETH supply growth, by capturing ETH staking rewards. Deposit rETH into MakerDAO. If Rocket Pool has built its code correctly, then rETH should be an extremely favorable collateral type in every DeFi application that also accepts ETH. If you allow ETH collateral, wouldn't you also be interested in a staked ETH derivative asset? Controlling for contract risk, then rETH should actually have favorable risk parameters versus ETH, because of how it's designed to naturally outpace ETH. We should expect some sort of tokenized staked ETH asset like rETH to be added as a collateral to MakerDAO, which means we can borrow DAI against our staked ETH! Collateral = ETH. Your collateral is ETH. Not just ETH, but a derivative of ETH that captures ETH staking issuance and ETH MEV fees.


**Market Conditions**

    ETH:	$3,466.64
    BTC:	$56,841.08
    Ratio:	0.061
    Date:	May 05 2021",2021-05-06 04:49:17
CardiologistNaive888,Any plans and teaming up with Makerdao?,2021-05-06 06:03:29
LongForWisdom,"I have no idea if a certificate would be a useful thing for you to invest time in. I will say that no one in Maker is looking primarily at people's credentials at this stage. The advantage of a DAO is that it's an open system. Want a job? Come do useful things somewhere people can see you.

In all seriousness, if you want to work for MakerDAO, just start hanging around in the chat and the forums and contributing where you can. If you're consistently able to provide value, at some point someone will try to hire you for something.

The great thing about the forum is you can get paid for participation through an initiative called [SourceCred](https://forum.makerdao.com/t/what-is-sourcecred-and-how-do-i-opt-in/3913). So even in the meantime you can be earning DAI to compensate you for your time.",2021-05-06 08:47:34
azdre,"The ""average person"" would most likely never even know they're engaging with a blockchain application.

In the hypothetical ""ETH blockchain Uber app kills Uber the company"" future, the entire experience would feel no different from what it is now (or at least not worse). The whole process would play out essentially the same way, the key difference being Uber the company isn't taking a cut of your payment to the driver for their ""services"" - ideally the driver gets the full payment and any ""fees"" would be simply the cost of the transaction on the network (which in this hypothetical future would be minimal).

The level of exposure to the underlying tech of the application stack would be entirely up to the developers and market conditions. 

Vitalik's point is that blockchain \[Ethereum\] allows for all the custodial efforts Uber adds to the equation to be automated via smart-contracting on the blockchain effectively rendering them useless in the grand scheme of things. Aside from being able to call Uber and talk to an employee, there isn't really anything about their product that can't be ported over to a blockchain solution.

Why pay Uber for this service when you can use the ""ETH Uber"" alternative that offers cheaper rides or the guarantee 100% of your payment goes to the driver and not some private company?

The ""how"" will be left up to the free market. A blockchain ""Uber"" alternative could very easily be developed by a private company and monetized, but it could also be developed by the Ethereum community and offered for ""free."" The point of the quote is that it's **possible** and that's what's so exciting about Ethereum and blockchain in general - it's opening up potential alternatives in nearly every existing industry and we're already seeing new industry emerge from the crypto space itself.

I remember back when MakerDAO first popped onto the scene and the ""potential"" it had to disrupt traditional finance. People were saying the same things...""*HOW?...WHY?...It's too confusing!*""

Now we have things like defisaver - something I could only dream of when I opened my first CDP. A blockchain Uber alternative hitting the market at some point would be far from a shock to me lol",2021-05-06 10:20:20
ethacct,"Alchemix keeps your MakerDAO collateral safe while slowly paying back the alUSD loan you took out.  the idea is to pay back your Maker loan with your Alchemix collateral, once it's down paying itself back.

The problem is if the price of ETH crashes before your alUSD loan is paid back, then your rETH from step 2 is going to get liquidated, meaning all you have is whatever is left of the alUSD/USDC you cashed out from alchemix, and your alchemix DAI which won't unlock for another ~3 years.

it's not a bad play if you have other liquid assets ready for a crash, but if you yolo'd your whole stack into this you could fuck yourself easily.",2021-05-06 14:59:36
squarov,"On this day...

In 2020:

- The Ethereum Foundation [doubles](https://blog.ethereum.org/2020/05/06/eth2-quick-update-no-11) all rewards in the Phase 0 Pre-Launch Bounty Program.
- Melon [explains](https://medium.com/melonprotocol/building-a-melonbot-1cdea583fb88) how to create a trading bot using MelonJS.
- IPFS [releases](https://blog.ipfs.io/2020-05-06-launching-testground/) Testground v0.5, a platform for testing, benchmarking, and simulating distributed and p2p systems at scale.
- ETH reaches troglodytes at $204, between ₿0.02297 and ₿0.02202.


In 2019:

- Microsoft [releases](https://buildazure.com/2019/05/06/azure-blockchain-development-kit-ethereum-released) the first preview of the new Azure Blockchain Development Kit for Ethereum, an extension to Visual Studio Code.
- The U.S. Commodity Futures Trading Commission [is ready](https://www.coindesk.com/cftc-would-approve-ether-futures-if-asked-insider-says) to approve Ethereum Futures, according to Coindesk.
- Audit company Zeppelin [finds ](https://medium.com/@ZeppelinOrg/makerdao-critical-vulnerability-notice-d581b30c9b39) a critical vulnerability in MakerDAO's Governance Voting Contract, users are advised to move out their MKR tokens.
- Consensys [ integrates](https://content.consensys.net/wp-content/uploads/2019050_-ConsenSys-investment-press-release.pdf) its Tachyon accelerator, venture production activities and VC arm, while co-founder Kavita Gupta leaves the company.
- Founding partner Kavita Gupta [steps down](https://www.theblockcrypto.com/2019/05/06/founding-partner-kavita-gupta-is-stepping-down-from-consensys-ventures) from Consensys Ventures.
- ETH eats a tenner from $163 to $173, arriving at ₿0.03.


In 2018:

- Ethereum is now [transacting](https://www.trustnodes.com/2018/05/06/ethereum-transacting-166-million-per-hour-53-smart-contract-dapps) $4 Billion per day, 53% by smart contracts.
- ETH reaches $830, a high in over two months, and for many months to come. ETHBTC at 0.08247.


In 2017:

- ETH recharges from $95 to $98, standing by at ₿0.062.


In 2016:

- Stephan Tual [blogs](https://blog.slock.it/the-inexorable-rise-of-the-dao-2b6e739b2615) about ""The inexorable rise of The DAO"", while 3% of all Ether gets locked up in the smart contract.
- ETH takes a hit  from $9.8 to $9.3 and lets it slide from ₿0.0219 to ₿0.02027.

-------------
^(compiled via pwr.news - )[^(more info)](https://pwr.news/blog/on-this-day-in-ethereum-workflow/)",2021-05-06 17:21:53
silent_johnn,"Crime does not discredit crypto any more than it discredits anything else.

Government headwinds? Simple FUD from people in the industry who stand to lose. You can't ban crypto any more than you can ban rock and roll. All you need to do is fire up a terminal and connect with the apps.

Volatility? Many assets are volatile. More FUD. Volatility does not equal more risky.

Basecoin. Lol what? No mention of DAI, which is the building block of DeFi. Research MakerDao.

We're downvoting you because you're hilariously, and sadly, misinformed.",2021-05-06 19:19:33
TimbukNine,"Thanks for getting back to me so quickly. Your thoughts on how crypto can improve the current situation are pretty much on point. Let's take it a little further and explore the DeFi approach:

What if an ETH whale wanted to buy that house. It seems to me there are several choices here:

**1) Sell their crypto, pay the capital gains and buy the house outright**

This approach would be good if they wanted to diversify away from crypto into property but does mean that they'd miss out on all those sweet gainz. No bank involved because there's no loan so not really relevant to our discussion.

**2) Our bullish whale could mint some DAI using MakerDAO**

This approach would mean locking up a lot of ETH to create the DAI and pay taxes/fees. For a $1m house this would be $1.5m worth of ETH as collateral. I'm not sure what the tax position would be on this ""loan"" (any thoughts?). The DAI is sold for USD with some slippage and the USD transferred to a bank account. This is then used to pay for the house outright.

Over time ETH rises and falls and our whale earns more ETH which in turn goes to buy DAI and pay off the loan, thus returning their original ETH.

**3) Our whale could shortcut the DAI and use Alchemix**

This approach would have our whale putting their ETH into Alchemix using $2m for a higher level of collateral. Alchemix then uses Yearn to create an interest bearing investment using the ETH and provides the DAI immediately for spending as in option 2. Over time the interest earned through Yearn pays down the original collateral until all is unlocked.

That's my understanding of the current crypto solutions to this problem. What do you think?",2021-05-06 21:35:00
calcrypto4,"The ATH is 5.22. If you have confidence in MakerDAO, it's reasonable to think we should see similar highs again. At the very least, you can see that despite the increase in USD value, MKR is still stuck in a 1-2 ETH bottom channel, so it's ripe for a real breakout.",2021-05-06 22:36:06
galapag0,En MakerDAO (la organización que hizo DAI) ya están con un proyecto así.,2021-05-06 22:41:46
AutoModerator,"Hello /u/DeFi_Doge_Moonshot! I regret to inform you that your submission has been automatically removed because your account is too new. This is to help us prevent spam from proliferating on this subreddit. But do not fear! A message has been sent to the moderators, and if this submission is a genuine contribution, then it will be manually approved by the moderators. 

In the meantime, please familiarize yourself with the [reddiquette](https://www.reddit.com/wiki/reddiquette), as well as /r/MakerDAO's rules, located in the sidebar [or by following this link](https://www.reddit.com/r/MakerDAO/about/rules).

*I am a bot, and this action was performed automatically. Please [contact the moderators of this subreddit](/message/compose/?to=/r/MakerDAO) if you have any questions or concerns.*",2021-05-06 23:35:16
bsc_gateway,"1) DeFi is already the source of lots of trading funds for hedge funds. The funds can hold btc or eth and borrow money to make trades in non-crypto markets.   


2) DeFi -&gt; financing a business has just happened last month. MakerDAO is pioneering a way for business owners to collateralize and finance business properties. The property is placed into a legal trust which will follow instructions from the blockchain. If a property falls into default, the protocol can issue a liquidation order. Most real estate loans are overcollateralized anyway.  Since the first one happened last month, there's only upside on this market.   


[https://twitter.com/SebVentures/status/1384947049012006913](https://twitter.com/SebVentures/status/1384947049012006913)",2021-05-07 00:47:24
Connortbh,"You can get a loan from MakerDAO with wBTC as collateral. I've never wrapped bitcoin before but an article I read said you can use:  Dharma, Kyber, Set Protocol, GOPAX, AirSwap, Prycto, Ren, and ETHfinex in order to do it.",2021-05-07 00:57:48
McBeaster,"The whole field of digitizing real-world assets is super interesting to me. Raven and MakerDAO are two that are bullish on this industry, as is Origin Protocol.",2021-05-07 02:02:55
moonbro9000,"Zilliqa has tons of features and partnerships. Sharded blockchain, Peer-reviewed smart contract language designed with security in mind(listed at OOPSLA), multiple dapps in their ecosystem such as Mintable(invested by Mark Cuban), Unstoppable Domains(invested by Tim Draper), HG Exchange (Securities exchange tokenizing other assets), DeFi through Zilswap and other dapps which can be seen here: [https://docs.zilliqa.com/ecosystem-growth-report-2020.pdf](https://docs.zilliqa.com/ecosystem-growth-report-2020.pdf)

And more info about Zilswap and other growth to their ecosystem in their latest growth report here: [https://docs.zilliqa.com/ecosystem-growth-report-2021-Q1.pdf](https://docs.zilliqa.com/ecosystem-growth-report-2021-Q1.pdf)

Zilliqa has an incubation program called ZILHive([https://zilhive.org/](https://zilhive.org/)), providing grants to have more dapps built on Zilliqa. 

Soon, Zilliqa will have another dapp released called Pillar Protocol([https://pillarprotocol.com/](https://pillarprotocol.com/)), similar to MakerDao on Ethereum.

Another exciting item is Zilliqa will have a bridge between Zilliqa and other blockchains in sometime Q2 so other tokens such as ETH will be available to be wrapped and used on the Zilliqa chain.

Also, they’ve had a recent partnership with Polaris sports which works with some high-profile sports stars like James Rodriguez and Cristiano Ronaldo.

Another significant partnership is Xfers which is considered the PayPal of Southeast Asia, and Xfers is partnered with PayPal, Gemini and Coinbase. Zilliqa created a stable coin used on the Zilliqa chain for Xfers. Also, Zilliqa and Xfers performed a pilot test to demonstrate how the XSGD stablecoin can enable the transfer of event risks via Zilliqa blockchain-based smart contracts. Related press release: [https://www.xfers.com/sg-blog/xfers-pilots-risk-transfer-applications-with-zilliqa-and-cerchia](https://www.xfers.com/sg-blog/xfers-pilots-risk-transfer-applications-with-zilliqa-and-cerchia)

In the past, Zilliqa has had a partnership with Mindshare and did some test pilots with PepsiCo for some campaigns. Relevant info here: [https://www.mindshareworld.com/news/mindshare-to-launch-first-phase-of-blockchain-pilot-on-the-zilliqa-platform/](https://www.mindshareworld.com/news/mindshare-to-launch-first-phase-of-blockchain-pilot-on-the-zilliqa-platform/)

[https://www.thedrum.com/news/2019/05/06/pepsico-and-mindshare-programmatic-blockchain-test-drives-28-efficiency-lift](https://www.thedrum.com/news/2019/05/06/pepsico-and-mindshare-programmatic-blockchain-test-drives-28-efficiency-lift)

Also, in the past, Zilliqa has worked with MAS Singapore government to integrate the use of Zilliqa mentioned here: [https://www.mas.gov.sg/-/media/MAS/ProjectUbin/Project-Ubin-DvP-on-Distributed-Ledger-Technologies.pdf?la=en&amp;hash=2ADD9093B64A819FCC78D94E68FA008A6CD724FF](https://www.mas.gov.sg/-/media/MAS/ProjectUbin/Project-Ubin-DvP-on-Distributed-Ledger-Technologies.pdf?la=en&amp;hash=2ADD9093B64A819FCC78D94E68FA008A6CD724FF)

Lastly, Zilliqa Capital investment hub for Zilliqa has some pretty impressive members: [https://twitter.com/zilliqacapital/status/1369887464161165314?s=20](https://twitter.com/zilliqacapital/status/1369887464161165314?s=20)

Some members have a lot of Venture Capitalist experience and one of the members is an ex-VP of Goldman Sachs, an investment bank company. 

Hopefully this was helpful and gave you a brief summary into Zilliqa and its potential.",2021-05-07 04:24:35
greencycles,"Side note, what's your opinion on DAI from MakerDAO?",2021-05-07 04:53:30
