author,body,created
Chapo_Rouge,Not really for now. The Dapps I want are not on L2. Maybe I don't know the Dapps I should want on L2 but I need MakerDAO at least.,2021-10-01 02:19:19
aqqlebottom,"When it comes to its trading structures, Uniswap relies on global liquidity pools and an automated liquidity protocol to facilitate the creation of distinct markets for each different asset combination. UniSwap is sometimes referred to as a decentralized exchange that enables automatic trading and the use of decentralized financial currencies, among other things. Hayden Adams, a software developer, developed it and released it on the Ethereum Network as an ERC-20 token in November 2018. It is now available for purchase on the Ethereum Marketplace.

Cons: 

•	Because Uniswap is non-custodial, it is just as secure as the Ethereum blockchain itself because the protocol does not hold any financial information. Several audits of the Uniswap smart contracts have been conducted, including audits by the same teams who verified the MakerDAO smart contracts.

•	To create liquidity for the new pool, ERC20 tokens and ETH need to be paired together. This means that you will get new tickets for trading far more quickly than you would with any other method now available.

•	The Uniswap exchange rate is dependent on arbitrage trading to keep it constant means that there will always be a need for other forms of exchange to keep it balanced.

•	Because of the greater risk associated with ERC20 to ERC20 token trades, higher gas prices are required. As Ethereum increases in scale (ETH2.0 sharding/Casper implementation is currently underway), gas prices will eventually become insignificant.

•	Unified Swap is still in the early stages of development; even their documentation has not been finalized. As the exchange's popularity increases, the true benefits, and disadvantages of using it will become more apparent.

•	The UNI decentralized exchange (DEX) token was created to be completely independent of other cryptocurrencies as a whole. Unfortunately, this has not always been the case.

•	The UNI token has no associated fees. Thus there are no charges connected with utilizing the protocol.

•	A consequence of the open-source nature of Uniswap similar DEXs (such as SushiSwap and PancakeSwap) is that they are vulnerable to imitation and duplication, which leads to a reduction in their market share.

•	The risk of momentary loss when traders supply liquidity to Uniswap may deter some traders from utilizing the platform.

•	Cross-chain decentralized exchanges (DEXs) such as Thorchain and Gravity DEX (Cosmos) may attract more traders in the future who are looking to trade across blockchains than Uniswap, which only trades in Ethereum ERC-20 tokens.

•	In contrast to trading on centralized exchanges, when you trade on Uniswap, you retain ownership over your private keys. While you are the custodian of your tokens, liquidity pools will trade directly with you while you are not. Due to the sole usage of smart contracts by Uniswap, the Ethereum network has incurred very high expenses. A smart contract is added on top of the transaction, which means that it does not occur directly between two users from a technical perspective. Consequently, users will be forced to pay fees twice when submitting tokens to the contract and again when sending tokens to the second recipient. When the market is volatile, both the number of transactions in the network and the cost of transactions in the network both rise as a result. If you sell your assets after they've started to decline in the liquidity pool, you'll incur much larger losses than if you keep them.

•	It is used by many fraudulent projects to promote their worthless tokens under tickers that seem to be legitimate currencies to trick consumers into buying their trash.

•	It seems doubtful that Uniswap will be legalized in the near future because it does not operate with fiat currency. The consequence is that those involved in projects and individuals functioning legally should take care while using any associated technology.

•	If Uniswap supports more chains, there is no indication in the project's strategy that this will be the case. At the same time, according to blocktivity.info, Ethereum transactions account for just 2.7 percent of all blockchain transactions in the United States.",2021-10-01 04:51:42
skythe4,"
French bank Société Générale through their subsidiary Forge wants to propose to MakerDao community to make eligible their bond issued last year on Ethereum (pilot experience) in order to borrow some DAI:


https://forum.makerdao.com/t/security-tokens-refinancing-mip6-application-for-ofh-tokens/10605/3",2021-10-01 06:34:38
zk_snacks,"This is pretty amazing and I really hope it gets implemented successfully. 

The big hangup here is that Maker would need to designate a person or legal entity as a representative in the legal system to take control of the bond tokens. 

If they do it well it could become a blueprint for a legal framework to get other off-chain assets represented in DeFi. If they don’t do it well, it could end up jeopardizing the decentralized nature of the MakerDAO. 

It’ll be fascinating to watch what happens with this.",2021-10-01 06:59:43
durkasdelight,good points.. it's great that some really smart cats work on MakerDAO lol,2021-10-01 07:51:50
daddymatty09,"I’ll leave this (very timely news) here: 

https://www.coindesk.com/business/2021/09/30/societe-generale-applies-for-20m-makerdao-loan-using-bond-token-collateral/",2021-10-01 11:10:51
Papazio,"https://www.coindesk.com/business/2021/09/30/societe-generale-applies-for-20m-makerdao-loan-using-bond-token-collateral/

Pretty damn cool. Proposing to governance for their bonds to be accepted as collateral for DAI loans.",2021-10-01 12:56:22
Chapo_Rouge,"More news : Société Générale (French Investment Bank) issued a 20M$ loan on MakerDAO : [https://www.coindesk.com/business/2021/09/30/societe-generale-applies-for-20m-makerdao-loan-using-bond-token-collateral/](https://www.coindesk.com/business/2021/09/30/societe-generale-applies-for-20m-makerdao-loan-using-bond-token-collateral/)

If that's not adoption of Ethereum (the network) versus ""internal"" EVM forks, I don't know what is.",2021-10-01 16:59:05
nikola_j,"Not quite the same, but if you'd want to use lending protocols for this, you can check out some of the protocols we have supported at DeFi Saver, just select the leveraged option:

* [https://app.defisaver.com/makerdao/create-cdp](https://app.defisaver.com/makerdao/create-cdp)
* [https://app.defisaver.com/compound/create](https://app.defisaver.com/compound/create)
* [https://app.defisaver.com/liquity/create](https://app.defisaver.com/liquity/create)

The app will do all the deposit + borrow + swap borrow for collateral + deposit steps in one transaction. You can use the simulation mode to try out anything available in DFS, by the way.

And, yes, I know all three of those UIs are different, yet do the same thing, just using a different protocol - we're currently in the process of standardizing this.😅",2021-10-01 20:55:00
robis87,"Oh it's happening alright:

*MakerDAO is close to making financial history. Societe Generale-Forge (SG-Forge), a subsidiary of French investment bank Société Générale, submitted a proposal to the MakerDAO community Thursday, outlining plans for refinancing covered bonds through MakerDAO’s vaults. If accepted, the deal would be the first of its kind between a DeFi protocol and a traditional investment firm.*",2021-10-01 21:08:40
nikola_j,"If you go with MakerDAO's ETH-B vault type which has a minimum collateralization ratio of 130% you can do over 3x.

Not saying I recommend doing this, though, since your liquidation price with such a position would be above \~$2800.

Still, with Maker, you always know the next price in the protocol a full hour in advance, so plenty of room to keep it safe. You can also use DFS [automation options](https://help.defisaver.com/makerdao/how-does-cdp-automation-work) or set up notifications with [HAL](https://9000.hal.xyz/recipes/maker-c-ratio-monitor).",2021-10-02 00:37:51
nikola_j,"The liquidation price depends on the minimum collateralization ratio (or the liquidation ratio, if you will) for any specific vault type in Maker.

At 2x, you can do:

* ETH-A (145% min c-ratio) with a liq. price of \~2370
* ETH-B (130% min c-ratio) with a liq. price of \~2150
* ETH-C (170% min c-ratio) with a liq. price of \~2775

The UI at [https://app.defisaver.com/makerdao/create-cdp](https://app.defisaver.com/makerdao/create-cdp) will show all of that as soon as you tick the *Leveraged* box and input any details.",2021-10-02 01:10:44
Old_World9768,"And Société Generale, a big french bank also going into ethereum

https://www.coindesk.com/business/2021/09/30/societe-generale-applies-for-20m-makerdao-loan-using-bond-token-collateral/",2021-10-02 02:44:25
thePhileazy,"TraderJoe and Penguin Finance - Blue chips of Avalanche network. Trader Joe is an all in one Dex, AMM and yield Farm where lending and borrowing is supposed to come soon too. Penguin Finance is a great yield farming platform where you can stake LP tokens of multiple dex’ and AMM’ to gain additional rewards. They are also very active and are developing further products and an NFT series with utility.

Teddy.Cash and Everest Options - my favorite small caps, even-though teddy has had a pretty big pump already but is dipping a bit at the moment, so might be a good time to get in. Teddy and it’s stablecoin TSD is like the MakerDAO and Dai of Avalanche and it’s first native stablecoin. Everest is a options trading platform for tokens on Avalanche which launched about a week ago, so it’s still pretty early

Lastly, I usually Farm on ElkDex. It’s a smaller Dex, AMM and yield farming platform, but has a pretty nifty Impermanent Loss protection feature. It’s native token also has utility as a cross-chain token which allows you to easily transfer Elk between the Avalanche, BSC, Huobi Eco, Fantom and Polygon blockchain, with more being added over time.

As always, DYOR and NFA",2021-10-02 04:54:23
108record,"Reused from my previous entry:

[https://www.reddit.com/r/CryptoCurrency/comments/og2jo1/rcryptocurrency\_cointest\_top\_10\_category\_usd\_coin/he5fnbm/?context=3](https://www.reddit.com/r/CryptoCurrency/comments/og2jo1/rcryptocurrency_cointest_top_10_category_usd_coin/he5fnbm/?context=3) 

# USDC - the better Tether

USDC, or USD Coin, is a stablecoin that is pegged to the price of the US dollar - so 1 USDC = $1. [It operates like this:](https://www.wikiwand.com/en/USD_Coin)

1. A user sends US dollars to the coin issuer's bank account.
2. The issuer uses a USD Coin smart contract to create the equivalent amount of USD Coin.
3. The newly minted USD Coins are sent to the user and the substituted US dollars are held in a reserve.

It was launched on September 26, 2018, in collaboration between Circle and Coinbase, and is an alternative to other USD backed cryptocurrencies like Tether (USDT) or TrueUSD (TUSD). [Bringing US dollars on the blockchain allows moving them anywhere in the world within minutes, and brings much-needed stability to cryptocurrencies. Additionally, it opens up new opportunities for trading, lending, risk-hedging and more.](https://cryptonews.com/coins/usd-coin/)

Being the second largest stablecoin, it undoubtedly has some inherent advantages - especially against its main competitor, Tether (USDC). These include:

&amp;#x200B;

# Very reliable leadership team &amp; founders

* USD Coin is [developed by the Centre Consortium](https://www.centre.io/usdc), a partnership between Circle and Coinbase. The technology and governing framework are developed by Centre, while Circle and Coinbase were the first commercial issuers of USDC.
   * Circle is an [official Money Transmitter](https://www.circle.com/en/legal/us-licenses), which makes the company an open financial book, connoting that all USDC tokens are regulated, transparent and verifiable.
   * Additionally, Circle is one of the only crypto companies [backed by Goldman Sachs](https://www.marketwatch.com/story/goldman-sachs-backed-circle-goes-live-with-currency-linked-stablecoin-and-anyone-can-issue-it-2018-09-26), a renowned investment bank.
   * Coinbase, the other 'half' of the Consortium, is the world's second biggest crypto exchange with billions of dollars in daily volume, so it is highly unlikely that they will perpetrate a stablecoin scam.
   * Moreover, Coinbase stock is already on the market while [Circle plans to go public via a SPAC](https://techcrunch.com/2021/07/08/cryptocurrency-company-circle-to-go-public-in-spac-deal/) \- which incentivizes them to keep running the USDC project lest their stock prices plummet.
* Meanwhile, Tether, the company behind the largest stablecoin in the world, has only 13 employees and is the [most valuable company on a per-employee basis in the entire world](https://cryptowhale.medium.com/the-tether-scandal-the-biggest-threat-to-the-crypto-ecosystem-23a169003205).
   * This is similar to the Madoff Ponzi scheme of the early 2000s, in which he robbed $65 billion of investors' money.
* Thus, USDC is the largest trustworthy stablecoin in the world.

&amp;#x200B;

# Reserves are safe and are audited every month

* A top 5 accounting firm, Grant Thornton, releases audits of Circle's reserves every month. Its [August report](https://www.centre.io/hubfs/pdfs/attestation/2021%20Circle%20Examination%20Report%20August%202021%20Final.pdf?hsLang=en) revealed that:
   * There were no discrepancies in the market cap of USDC and the value of Circle's reserves.
   * The reserves themselves consisted of 92% cash &amp; cash equivalents, 1% corporate bonds, 5% USD denominated Certificates of Deposits, and 2% commercial paper.
* [In a crisis, there’s a strong chance that Circle would be able to meet significant USDC redemptions, if not instantly, then within a short timeframe. Putting it another way, if regulators bring in rules about the quality of assets that need to back stablecoins, it’s likely that USDC assets would easily comply.](https://www.ledgerinsights.com/circle-publishes-details-of-usdc-stablecoin-asset-backing/) And that can’t be said for Tether by a wide margin.
* The degree of transparency and quality of Circle's assets is significantly superior compared to USDT, where the asset backing raised concerns at the [Boston Federal Reserve](https://www.bostonfed.org/news-and-events/speeches/2021/official-monetary-and-financial-institutions-forum-fed-week-financial-stability-session.aspx) and [Fitch](https://www.ledgerinsights.com/fitch-flags-stablecoin-risks-to-short-term-credit-markets/).

&amp;#x200B;

# Plenty of native uses as opposed to USDT

* Coinbase offers [no fees when spending USDC](https://help.coinbase.com/en/coinbase/trading-and-funding/pricing-and-fees/) using the well-known Coinbase Card.
   * This incentivizes Coinbase users to utilise USDC to spend, rather than other cryptocurrencies.
* [VISA recently became the first major payments to allow the settlement of transactions in USDC.](https://usa.visa.com/about-visa/newsroom/press-releases.releaseId.17821.html)
   * While this doesn't benefit consumers as of now, it allows crypto-holding companies such as [Crypto.com](https://Crypto.com) and Tesla to natively transact USDC on VISA, eliminating the need to convert their crypto to fiat.
* Compare this to Tether, whose only 'partner company', Bitfinex, is actually the entity that controls USDT itself.

&amp;#x200B;

# Available on a variety of blockchains

* [USDC is powered by an ERC-20 smart contract in the Ethereum blockchain and is also supported on other blockchains (Algorand, Solana, Tron, Stellar).](https://swissborg.com/blog/usdc-vs-usdt) It is an open-source project, which makes it a transparent and verifiable stablecoin on the blockchain.
* In addition, in the next few months [Circle is planning to add USDC to 9 more blockchains](https://www.coindesk.com/business/2021/06/29/usdc-stablecoin-could-soon-expand-to-10-more-blockchains/), including Avalanche, Celo, Flow, Hedera, Kava, Nervos, Polkadot, Stacks, and Tezos.
   * This will put it significantly ahead of USDT, which only supports 7 blockchains as of now.
* Each network has its own perks and flaws, all of which comprehensively make USDC more useful than it ever was.

&amp;#x200B;

# Can be staked for yields

* [By staking USDC, you can earn](https://www.blockfer.com/earn-interest/stablecoin-interest-calculator/):
   * 8.6% APY on BlockFi
   * 8% APY on [Crypto.com](https://Crypto.com)
   * 11.55% on Celsius Network
   * Native earnings if you hold it on Coinbase
   * ... and many more options
* On another note, you can also utilise USDC to mitigate liquidity risk by using it as collateral for DAI in MakerDAO.
* However, nearly all stablecoins can be staked for yields, some more than others.

&amp;#x200B;

In conclusion, USDC is undoubtedly a better stablecoin than Tether, and its multitude of uses justifies its $30 billion marketcap.",2021-10-02 04:57:50
thePhileazy,"Copy and pasted this from a similar post I tried to answer:

TraderJoe and Penguin Finance - Blue chips of Avalanche network. Trader Joe is an all in one Dex, AMM and yield Farm where lending and borrowing is supposed to come soon too. Penguin Finance is a great yield farming platform where you can stake LP tokens of multiple dex’ and AMM’ to gain additional rewards. They are also very active and are developing further products and an NFT series with utility.

Teddy.Cash and Everest Options - my favorite small caps, even-though teddy has had a pretty big pump already but is dipping a bit at the moment, so might be a good time to get in. Teddy and it’s stablecoin TSD is like the MakerDAO and Dai of Avalanche and it’s first native stablecoin. Everest is a options trading platform for tokens on Avalanche which launched about a week ago, so it’s still pretty early

Lastly, I usually Farm on ElkDex. It’s a smaller Dex, AMM and yield farming platform, but has a pretty nifty Impermanent Loss protection feature. It’s native token also has utility as a cross-chain token which allows you to easily transfer Elk between the Avalanche, BSC, Huobi Eco, Fantom and Polygon blockchain, with more being added over time.

As always, DYOR and NFA",2021-10-02 04:58:48
luquoo,"This is quite interesting.  I think the only issue is with how good the bonds are.  I imagine a scenario where the bonds tank to quickly and the makerdao system is not able to liquidate the vault fast enough to avoid losing money overall.

Maybe accept them with a high collateral ratio that reflects the inherent risk, and in a pessimistic way. Otherwise this could be a way to sell your junk bonds to the makerdao system for more than they are actually worth.",2021-10-02 06:00:12
