author,body,created
squarov,"On this day...

In 2020:

- Matter Labs [unveils](https://medium.com/matter-labs/curve-zksync-l2-ethereums-first-user-defined-zk-rollup-smart-contract-5a72c496b350)  Zinc Alef, a zkSync L2 smart contracts testnet with Curve Finance as the first resident dapp.
- The Ethereum Foundation [launches](https://eth2bounty.ethereum.org) an Eth2 bug bounty program.
- ETH misses connecting flights from $351 to $366, getting delayed by ₿0.032 to ₿0.033.


In 2019:

- At Devcon5, MakerDAO [announces](https://blog.makerdao.com/breaking-launch-date-of-multi-collateral-dai-announced-at-devcon-5) Multi-Collateral Dai will be launched on Nov. 18.
- Fatburger [tokenizes](https://www.forbes.com/sites/benjaminpirus/2019/10/09/fatburger-and-others-feed-30-million-into-ethereum-for-new-bond-offering) a $30 Million bond offering on Ethereum, with the help of digital securitization platform Cadence.
- ETH wakes up the wrong walrus at $182 to $194, or ₿0.02257.


In 2018:

- SXSW [announces](https://www.sxsw.com/news/2018/keynote-joseph-lubin-featured-speakers-maria-shriver-wyclef-jean-howard-schultz-and-more/) Joseph Lubin as the keynote speaker in 2019.
- SpankChain [gets spanked](https://medium.com/spankchain/we-got-spanked-what-we-know-so-far-d5ed3a0f38fe): an unknown attacker drains 165.38 ETH (~$38,000) from SpankChain's payment channel smart contract.
- Forbes [joins](http://blog.joincivil.com/forbes-x-civil-a-major-milestone-for-blockchain-based-journalism-73bed5b2f144)  the Civil network to permanently archive its content to a decentralized environment that ensures no third party can remove or alter it.
- POA Network [launches](https://medium.com/poa-network/poa-network-launches-the-first-full-featured-open-source-ethereum-explorer-blockscout-2612f065716f) the open-source Ethereum block explorer BlockScout.
- Geth gets ready for the Ropsten hard fork with [v1.8.17 ""Shoutingstone""](https://github.com/ethereum/go-ethereum/releases/tag/v1.8.17).
- ETH sells the news at $228, or ₿0.03437.


In 2017:

- Parity v1.7.3 beta [enables](https://github.com/paritytech/parity/releases/tag/v1.7.3) the Byzantium fork on the Ethereum mainnet.
- ETH chases rainbows from $309 to $297, or ₿0.06706 to ₿0.06189.


In 2016:

- ETH drops the beat at $12.1, or ₿0.01955.

-------------
[^(compiled with love)](https://pwr.news/blog/on-this-day-in-ethereum-workflow/)",2021-10-09 13:02:01
coinfeeds-bot,"tldr; Société Générale’s digital asset group, called FORGE, has submitted a proposal to the MakerDAO governance forum for a DeFi experiment. The proposal involves tokenizing a covered bond, which is securitized debts issued by a bank. The bank is essentially asking the community if they would accept loans on real French homes as healthy collateral.

*This summary is auto generated by a bot and not meant to replace reading the original article. As always, DYOR.*",2021-10-09 18:30:52
juunhoad,"SPELL protocol is gaining a lot of traction in price AND protocol usage. This is going to compete hard with MakerDAO. 

Don't sleep on it.",2021-10-09 21:16:45
coinfeeds-bot,"tldr; Société Générale’s digital asset group, called FORGE, has submitted a proposal to the MakerDAO governance forum for a DeFi experiment. The proposal involves tokenizing a covered bond, which is securitized debts issued by a bank. The bank is essentially asking the community if they would accept loans on real French homes as healthy collateral.

*This summary is auto generated by a bot and not meant to replace reading the original article. As always, DYOR.*",2021-10-09 22:02:05
MrBluoe,"""...

On top of a rapidly expanding nonfungible token community, the Fantom network can now add a multi-billion-dollar DeFi protocol to its list of accomplishments thanks to the successful launch and liquidity build of Geist, a decentralized non-custodial liquidity market protocol where users can lend or borrow crypto assets on the Fantom protocol.

Since the launch of the Geist protocol on October 5, the platform has rapidly ascended in the total value locked (TVL) ranking and has accumulated more than $11.1 billion worth of locked value as of October 8, according to the Geist Dashboard. The rapid rise in TVL on Geist confirms an active and involved community and solid backing from well-funded sources.

Assets locked on Geist include $2.44 billion worth of Tether (USDT, $604 million in Fantom (FTM), $1.3 billion in DAI, $2.32 billion in USD Coin (USDC), $2.81 billion worth of Ethereum (ETH), and $1.62 billion worth of Wrapped Bitcoin (WBTC).

According to data from DeFi Llama, a TVL of $11.1 billion makes Geist the sixth-largest protocol by TVL of all DeFi platforms, placing it in the league as some of the largest and most well-established protocols on the Ethereum network such as MakerDAO and Compound.

...""",2021-10-10 01:09:00
isthatrhetorical,"Their platform is a cross chain MakerDAO (issuer of DAI), except their stablecoin (MIM) isn't backed by USDT or USDC.

The devs seem to never sleep, and MIM is catching on as a trading pair on more and more trading platforms.

You can also stake your SPELL for a 2% APY, while also using your sSPELL for a loan if you so choose.",2021-10-10 02:14:09
isthatrhetorical,"Hi y'all it's your favorite SPELL shill here.

Just a smol update:

* $0.017 and bouncing around $1b MCap  
* An OG MakerDAO (MKR) holder not only [recently aped $1m USD worth of ETH into SPELL](https://twitter.com/DefiSniper/status/1446926450267934728?s=20), but [immediately staked it](https://etherscan.io/tx/0x6b779060a93100c77377e0d38046a4c3c3a482fe820d4a502be5783e683cc646) as well.",2021-10-10 09:37:19
Okay_Crazy,r/MakerDAO,2021-10-10 10:56:38
Chapo_Rouge,"Did you tried to learn to solo stake on testnets ? It's funny I *do* have the technical knowledge (I am in IT) but I am still afraid to put *so much* capital (it's house money by now but still) in staking.

Otherwise your best bet is yield on-chain via DeFi to retain custody of your coins. Alchemix, MakerDAO is you feel bullish long-term, [88mph.app](https://88mph.app) for fixed yield + rewards. But you have smart contract risk which is (arguably) often higher than protocol-level risk.",2021-10-10 17:10:14
GumBeat007,"A MakerDAO CDP on DefiSaver is anotherway to put that ETH to use. My collaterization is over 300% and I wouldn't get liquidated until \~1400$. Even then liquidation isn't as much of a risk both because the penelty is only 13% and automation on DefiSaver can be turned on if the market is getting volatile near your liquidation ratio.

It's not risk free, but even if only goes to 5K in the next two years I'll be up \~10% in ETH after I pay back my CDP. And the best part, it's tax free in the United States because it's considered a loan.

Make sure you have enough ETH to make it worth while after gas fees though. I won't lie, I payed a little over 400$ in gas when all was said and done setting up my CDP. Depending on the portfolio this can still be worth it and in my case I'll be coming out ahead long term.

[https://help.defisaver.com/makerdao](https://help.defisaver.com/makerdao)",2021-10-10 17:34:50
The_Cybermonkey,"This was the maker news.
It was Frances 3rd largest bank wanting to work with them.

https://www.cryptodaily.co.uk/2021/10/societe-generale-applies-for-20m-makerdao-loan?_escaped_fragment_=&amp;_escaped_fragment_=#!",2021-10-10 19:08:18
when_is_now,"Real question, why do you think it's an obvious trade? I have a couple of MakerDAO vaults and I am open to moving them to something else if it's better. 

The pros I see about MakerDAO are:

1. battle tested - it has a long history and lots of value locked so a new break is unlikely
2. very stable - DAI has survived big ups and downs
3. 3rd party tooling - DefiSaver is amazing and helps me sleep at night
4. accepted everywhere - you can sell DAI on just about any CEX or DEX

What are the advantages of abracadabra that make it more than just another new stable and would make me trust it with my investment?",2021-10-10 20:29:31
when_is_now,"With MakerDAO I keep my price exposure to ETH. You are saying with Abracadabra I can keep my price exposure and interest exposure to interest-bearing ETH.

This makes sense and I also see why it would be a better option.",2021-10-10 22:07:36
isthatrhetorical,"If you think it can compete with MakerDAO, it's got a bit to run yet.",2021-10-10 23:49:35
heavyweight0,Is makerdao on layer 2 yet?,2021-10-11 00:02:10
aula21un,"Maybe it's because that MakerDao is only restricted to the $ and the crypto world needing stables for more than just the $. Seeing a lot of hype for Onomy these days, it will have crypto collateralised denoms (stables) for more than just the $. You can mint one for any fiat as long as you have the collateral.",2021-10-11 01:54:54
isthatrhetorical,"Cross chain MakerDAO. Backed by interest bearing tokens, their stablecoin is MIM. Their dev is doing a lot of good shit over on Fantom right now.",2021-10-11 06:06:28
the_rolling_jones,"No sir. UST is an algorithmic stable coin that generates value as a DAO. It’s more analogous to the DAI stablecoin, which derived its value from user-provided collateral locked in the MakerDAO, than to USDT (Tether), a centralized cryptocurrency owned by a private company that has to constantly verify their dollar backing from their own “backings” (which in most cases is actually debt)

UST is only as valuable as those in the market for LUNA, or those willing to collateralize their Ethereum via Lido, an ETH 2.0 validator, which offers bETH (bonded Ethereum), which is essentially a Terra compatible version of their stETH (staked Ether) token provided to those who wish to delegate a portion of their ETH until the ETH 2.0 launch, but need a solution like Lido provides to aggregate their ETH, and others ETH, to reach the 32 ETH minimum validator node staking requirements. 

Initially UST was only collateralized by $LUNA, Terra’s native “collateral token”, but those who staked their $ANC governance in the Anchor DAO voted to approve bETH to also collateralize UST, allowing bETH providers to borrow against their bonded Ether.",2021-10-11 07:49:36
nanazzie,"&gt;DeFinis yet penetrate real world economic usecases but will happen soon

I know this is already happening in the world now, as there has been a proposal submitted to MakerDao for a loan of 20M DAI by Société Générale.

The development of NFT focused lending protocols, further shows that DeFi is dynamic and can adjust to other forms of movement.",2021-10-11 11:09:32
roelioo,Also checkout so-called multicall contracts that enable you to do multiple queries in one RPC request https://github.com/makerdao/multicall,2021-10-11 18:44:32
aminok,"While this is all good news, I am far more encouraged by the blockchain-native projects building on Ethereum, like Monolith, GraphQL, MakerDAO, zkSync, Polygon, Arbitrum, CryptoPunks, StarkWare, OpenSea, etc.",2021-10-11 22:08:38
AutoModerator,"Hello /u/Fun-Reputation-4684! I regret to inform you that your comment has been automatically removed because your account is too new. This is to help us prevent spam from proliferating this subreddit. But don't fret! Our threshold for commenting is very low. Try commenting again here in a couple of days.

In the meantime, please familiarize yourself with the [reddiquette](https://www.reddit.com/wiki/reddiquette), as well as /r/MakerDAO's rules, located in the sidebar [or by following this link](https://www.reddit.com/r/MakerDAO/about/rules).

*I am a bot, and this action was performed automatically. Please [contact the moderators of this subreddit](/message/compose/?to=/r/MakerDAO) if you have any questions or concerns.*",2021-10-11 23:56:05
AutoModerator,"Hello /u/Leading_Voice4449! I regret to inform you that your comment has been automatically removed because your account is too new. This is to help us prevent spam from proliferating this subreddit. But don't fret! Our threshold for commenting is very low. Try commenting again here in a couple of days.

In the meantime, please familiarize yourself with the [reddiquette](https://www.reddit.com/wiki/reddiquette), as well as /r/MakerDAO's rules, located in the sidebar [or by following this link](https://www.reddit.com/r/MakerDAO/about/rules).

*I am a bot, and this action was performed automatically. Please [contact the moderators of this subreddit](/message/compose/?to=/r/MakerDAO) if you have any questions or concerns.*",2021-10-12 01:30:09
jamesj,"Is it a goal to move away from a dollar peg and instead have something even more stable than the dollar backed by a diverse basket of assets? I know DAI is already backed by diverse assets but it seems to be like it'd be a strength to unpeg from the dollar.

What advice would you give to someone interested in starting a DAO? What have been the best solutions you've come up with that have helped MakerDAO?",2021-10-12 01:32:57
ubiest,"Ethereum really is the future of france LOL.  
Snippets from the recent Bankless newsletter  
https://newsletter.banklesshq.com/p/banks-are-coming-to-defi  
The third largest bank in France just posted on the MakerDAO governance forums to get their collateral approved for loans. This is the first example of a major bank submitting an application for a financial relationship with a DeFi protocol.  
Think about what’s going on here:   
\- An institution is integrating a DeFi protocol into its financial products   
\- A bank is coordinating with a DAO. No backchanneling, just forum proposals.   
\- Regulated initiatives 🤝 Open-source initiatives",2021-10-12 01:46:02
LogrisTheBard,"Live AMA with Rune of Maker if anyone has questions for him.

https://www.reddit.com/r/MakerDAO/comments/q60iif/im_rune_christensen_cofounder_of_makerdao_and/",2021-10-12 02:05:43
swap_catz,"What's MakerDAO coded with? I'm really surprised the Ethereum ecosystem still uses native solidity, and I'm just trying to gauge why more teams aren't building around Vyper, or even some other language. Any insight on some of the technical choices during the original creation of MakerDAO?",2021-10-12 02:07:35
lastfreeeuropean,"I have read your “The case for Clean Money” on the Makerdao forum, I really appreciate the work that you have put in and I’m a huge supporter for everything you have mentioned, especially I’m excited for the Sagittarius Engine! Theoretically we could have infinite MKR now, but with the SE we would raised MKR to total 3 Million with yield farming! More users would have also be part to the Governance, would love to see that leads to more decentralisation! It would also strengthen the Protocol and it would benefit with more “intelligence”! Some core unit members and facilitators raised scepticism and downplayed the effect of the SE, do you feel that their view is not neutral on the SE because they think it would weaken their position? (Also other reasons)",2021-10-12 02:35:34
ApoIIoCreed,"There seems to be a lot of discourse on this MakerDAO subreddit regarding the burnrate of MKR – the age-old “use cashflow for dividends” vs. “use cashflow re-investment” debate. The reddit Maker community seems divided on the best path forward and it seems that nearly every thread has the two camps slinging mud at each other.

In contrast, the users on the official MakerDAO governance forum acknowledge that Maker is in a high-growth tech sector and that the best way to grow faster than the competition is through direct investment. They generally seem far more informed about how MakerDAO is using funds to invest, and far happier with the state of the project and tokenomics.

Personally, I think the difference in sentiment is due to an information imbalance between the DAO forums and the subreddit – those with less information on the status of the DAO’s projects and spending are the angriest about anything that interferes with the MKR supply reduction.

******

How do you think that MakerDAO could best address the information divide between official governance forum regulars and members of this subreddit?

Or maybe, you see some other reason as the primary driver of this mismatch in project sentiment? If so, how should we address it?",2021-10-12 02:51:06
BrasilM,"1. Why doesn't MakerDAO issue other tokens that would be pegged to other currencies like EUR? It would help to introduce RWA in countries with currencies other than USD.
2. How Maker wants to work with RWA providers after the foundation is dissolved. Who will represent Maker?",2021-10-12 03:31:20
AutoModerator,"Hello /u/BrasilM! I regret to inform you that your comment has been automatically removed because your account is too new. This is to help us prevent spam from proliferating this subreddit. But don't fret! Our threshold for commenting is very low. Try commenting again here in a couple of days.

In the meantime, please familiarize yourself with the [reddiquette](https://www.reddit.com/wiki/reddiquette), as well as /r/MakerDAO's rules, located in the sidebar [or by following this link](https://www.reddit.com/r/MakerDAO/about/rules).

*I am a bot, and this action was performed automatically. Please [contact the moderators of this subreddit](/message/compose/?to=/r/MakerDAO) if you have any questions or concerns.*",2021-10-12 03:31:20
upscaleHipster,"What you’re doing is burden of proof. Here’s this article explaining the situation at that time:
https://medium.com/@whiterabbit_hq/black-thursday-for-makerdao-8-32-million-was-liquidated-for-0-dai-36b83cac56b6",2021-10-12 04:20:14
letmeshowyou212,"Good on you to bring focus back to your Clean Money post :) I am still reading it. It is thought provoking.

Your response is helpful and appreciated but does not really address my main concern.

I do not think you are a lawyer so if you cannot answer I accept. Do you think benefits outweight potential costs later? You are not worried about that what the Foundation did may have been illegal in China? I have no idea what enforcement would look like but surely it would come back to MakerDAO and not the Foundation since it is gone.  So if I do decide to allocate to MKR I think I am taking that risk.

Was Paradigm not helpful for China? I never understood how California VCs will help expand Asia. Is Paradigm also Asian VCs? Maybe I am too mistrusting but that announcement stayed with me to see MKR differently.",2021-10-12 04:31:24
vvpan,"Good question. I am not number one expert.

Well, most other tokens are pegged coins. OHM has base collateralization but is not pegged. Although there is an assumption of future stability. This increases decentralization. I think those properties are in line with general trend in Defi of decoupling from USD.

They have been able to buy up their liquidity tokens. We used to talk about TVL. But TVL is not sticky. Olympus has excelled in the newer and, imho, more interesting metric POL (protocol owned liquidity).

And now there is Olympus Pro, which makes liquidity buy-back through bonds a service. A bunch of projects already jumped onto the bandwagon (Abra, shapeshift...). Usage of those bonds support Olympus treasury and is pumped back into growing OHM. There are also incentives coming for use of OHM in treasuries.

Olympus DAO the organization has shown itself to be very apt and innovative with OHM and then the bonds and Olympus Pro and community building. Actually I think they are the some of the most successful builders I have seen in DAO land. Compare, say, with MakerDAO.

Then there are memetics and a ideological alignment.

Oh and Messari analysts love the hell out of it, haha. So far that has been a great flag of success from what I have seen. I know it might sound stupid but... shrug.",2021-10-12 04:41:32
isthatrhetorical,"The tl;dr is they're a competitor to MakerDAO, using interest bearing tokens as collateral so your deposited collateral is always going up over time.

Being cross chain is neat. Their dev being a work horse is even neater.",2021-10-12 07:47:20
Overfitted92,"Does the protocol produce profits from bond sales? Could that be where the interest is coming from? That argument was made in the proposal for Olympus to be considered as collateral in MakerDAO

https://forum.makerdao.com/t/ohm-olympus-dao-collateral-onboarding-application-mip6/10709/25",2021-10-12 09:04:33
Kike328,What's the difference between aave and MakerDao?,2021-10-12 17:53:41
TrySoundingItOut,"Makerdao is meant for the minting of the stable coin dai, and aave is a lending protocol similar to compound where you can deposit your crypto for varying yields and then borrow assets against the ones you deposited.",2021-10-12 18:23:53
defewit,Extremely complicated subject. Check out the MakerDAO forums for discussions on this since they are at the forefront of this kind of stuff. For example this post: https://forum.makerdao.com/t/discussion-the-dao-needs-a-serious-discussion-about-legal-structure/10764,2021-10-12 18:26:06
twitterInfo_bot,"The vote to onboard Lido's stETH as a new Vault Type on @MakerDAO is live. 

A successful integration would allow you to use your stETH as collateral on Maker.

Vote here: 

***

posted by [@LidoFinance](https://twitter.com/LidoFinance)

 [Photo 1](http://pbs.twimg.com/media/FBgFQHiXEAAsYTm.jpg) 

[Link in Tweet](https://vote.makerdao.com/polling/QmXXHpYi?network=mainnet#poll-detail)


^[(Github)](https://github.com/username) ^| ^[(What's new)](https://github.com/username)",2021-10-12 21:19:39
