author,body,created
thebestboner,"Thank you! It was definitely a difficult time, but I'm just grateful for the hard work of the MakerDAO team and for all the encouragement I got from everyone here. 

Here's a twitter thread posted by someone from the team, explaining how they did it. It's amazing what they were able to accomplish: https://twitter.com/hexonaut/status/1449059591443165185?s=20",2021-10-17 00:44:23
PhiMarHal,"For all the talk about Defi 2.0, and I love many of these protocols... If we include appreciating collaterals in that umbrella, MakerDAO introduced self-repaying loans a while back, once they added support for univ2 positions as collateral.

I have a MakerDAO ETH/DAI vault that went from 220% collateralization to 370% on its own. Granted, this is partly due to the eth price increase. But if we go back down to sub $2k, I'll still sit prettier than before thanks to compounding LP fees.

For an even less speculative self-repaying loan, there's USDC/DAI LPs.

MakerDAO comes up with really great tech, but misses the boat on marketing.",2021-10-17 01:36:02
lookingglass91,"completely agree, 3rd gen cryptos still have a while to prove themselves as truly decentralized. even ETH who is more established now, [had a centralized hard fork on the chain](https://www.gemini.com/cryptopedia/the-dao-hack-makerdao#section-the-dao-hack) The hard fork effectively rolled back the Ethereum network’s history to before The DAO attack and reallocated The DAO’s ether to a different smart contract",2021-10-17 01:51:54
samskiter,Agreed totally. Makerdao are closest to sorting this as they recently put real mortgages into their books,2021-10-17 02:19:09
no-nonsense-crypto,"&gt;The Olympus treasury is now the second largest.  
  
&gt;  
&gt;And it’s quickly growing full of stables and non-native tokens. The bonding program is becoming a new standard in sustainability.  
  
&gt;  
&gt;If you don’t understand the implications of this, I suggest you continue to do more research.  
  
&gt;  
&gt;Or keep thinking it’s a ponzi. I don’t need to convince you — the market will do that for me.  
https://i.imgur.com/6H6KPrg.jpg

You're literally just spreading straight up misinformation. The graph you posted maybe can get away with not being technically a lie, because it just says, ""Total"" for the Y axis, and you could claim ""total"" means anything since that's a vague term that nobody uses.

Rest assured however, if you're thinking that means ""Total Value Locked"", you'd be wrong: UniSwap's TVL is just under $5 billion. The graph says they have a little over $10 billion.

Your claim, that this means ""treasury"", is wrong: see MakerDAO over on the left of the graph? Their treasury contains over 3 billion in stable coins alone--orders of magnitude more than any claim about Olympus, and that doesn't include non-stable coins.

Maybe you think it's market capitalization: that's the first possibility where any of the numbers on the graph were maybe correct at some point, but if that's the case, then the graph is leaving out a ton of major projects which are larger than Olympus.

In short, I have no idea where you got this graph, or where the graph got its numbers, or even what the numbers are supposed to represent, but Olympus isn't close to being the second largest project on any metric I can see.",2021-10-17 04:28:14
TREYisRAD,"TVL is mostly meaningless, and it's definitely not the metric I'm showing here. I'm certainly not confusing market cap. What is being show here is what matters: \*Protocol Controlled Value\*

Who cares if Uniswap or Maker have multi-billions in mercenary capital locked in their system? That capital can move elsewhere in an instant. 

PCV is what the Protocol Owns, and as token holders / DAO members, the number that you should care about.

[Maker has $56 million of DAI in their treasury](https://openorgs.info/organization/makerdao). Not $3b. Stop spreading misinformation if you do not understand the difference between value locked in a protocol and value \_owned\_ by a protocol.

[Olympus has the highest](https://i.imgur.com/33OautZ.jpg) % ownership of non-native vs. native protocol tokens ownership in their treasury. Here's [more charts](https://dune.xyz/shadow/Olympus-(OHM)) to digest.

\*What does this mean?\*

It means if UNI were to go to $0, UNI token holders would be entitled to nothing. The protocol treasury owns nothing except now-worthless UNI tokens. If OHM were to go to $0, token holders would still be entitled to a half-billion dollar treasury of non-native tokens. 

And that treasury is growing very quickly. The Olympus Pro Bonds-as-a-Service program has been wildly successful in just its first couple weeks, generating tens of millions. And there are dozens of additional protocols waiting to be onboarded to the service.

Naturally, the market would decide that OHM \_won't\_ ever go to $0, because of that PCV backing the value of OHM.

If Olympus' revenue stays at the current rate, then the PCV grows by $100m per month.

That means the \*baseline market cap of OHM is growing by over $1b/year\*

And remember: \*99% of protocols have a baseline market cap of $0\*. They are \_purely speculative\_.

And Olympus' revenue is only accelerating. $1b/year is extremely conservative.

What will happen when APY is reduced to single-digits, and `1 OHM == PCV / Supply`? 

Well, as revenue continues to be added to the PCV, the value of OHM will simply go Up Only... for as long as the protocol is revenue generating. As a token holder / DAO member, you are entitled to your share of that treasury. You are effectively investing into a bank vault that is growing every second.

Again, I implore you to do more research. You seem to not grok PCV and it's implications for a DeFi protocol. 

[https://openorgs.info](https://openorgs.info)",2021-10-17 05:17:10
Njoiyt,100% liquity is extremely underrated and deserves more spotlight than DAI/MakerDAO.,2021-10-17 07:30:57
GumBeat007,How battle tested is Liquity? There are platforms but the reason I went with MakerDAO is because it's been around for so long.,2021-10-17 11:53:54
Revanchist1,"Alchemix - Deposit ETH -&gt; get alETH

Swap alETH -&gt; ETH

MakerDAO CDP - Deposit ETH -&gt; take out Dai

Curve - Deposit Dai into 3crv pool

Abracadabra - take 3crv token -&gt; deposit into Abracadabra -&gt; use MIM to 5x+ leverage back into 3crv pool.


Interest from 3crv pool should be enough to pay monthly mortgage/insurance. 


There are a lot of worst cases. Smart contract risks, usdt losing peg causing ramifications throughout DeFi and Curve.


Worst Case is your CDP loan gets liquidated and you lose your ETH collateral in the CDP but you still get to keep earning your leveraged 3crv earnings. The alETH loan will eventually pay itself off so you never ""really lose your ETH""... (however long that will take).


Your CDP debt could be reduced by deleveraging from your 3crv pool and paying back some of the debt in case of an ETH price drop. 


But the earnings from farming the 3crv pool  with leverage will be more than enough to either pay the mortgage or heavily supplement your normal income. Rates are subject to change but you could probably find safe good paying farms in the curve ecosystem.",2021-10-17 14:51:12
CosmicCollusion,"It's quickly become my favourite lending platform. I think the main issues it faces is its UI and the complexity of understanding it well enough. Everyday I see u/PhiMarHal answering the same few questions in their discord. I've never used Tarot, so I'm not sure why they're so much more successful currently. 

As a side-note, Impermax among a couple others has made me start reconsidering my DPI holdings. I used to hold and use (basically) all the platforms in there, but nowadays it's: Yield on purely lending? Impermax, not Compound or Aave. Using an exchange? CowSwap, not Uniswap or Sushi. Minting liquidity off my existing capital? Alchemix or Reflexer, not MakerDAO.",2021-10-17 19:22:04
swap_catz,"MakerDAO is somewhat OG. It just doesn't have massive price moves so it's quite boring compared to the wild west of everything else. People gravitate to the areas with highest potential return, so MKR just doesn't move fast. It's nice as a blue chip though and it seems people in general take profits into things like MKR.",2021-10-17 19:39:06
heavyweight0,"How does the ""multiply your eth"" option on makerdao work?   Do I get eth back, like when I mint dai?",2021-10-17 22:19:30
ArtigoQ,"Because retail investors can't do anything with it.  I can mint 2MM DAI and it has no affect on MKR. Can't put MKR in Yearn.  Can't use MKR for collateral. I have been using Oasis and MakerDAO for a while, but haven't figure out why MKR even needs to exist.",2021-10-18 02:49:14
Mindless_-_Data,I'm not too sure. This just came up on my twitter feed a bit ago and I've seen a lot of people post about it in here so I wanted to pass the info along. Though from what I read it does seem like MakerDAO might've been the first to do real due diligence on this project.,2021-10-18 04:00:37
CantBelieveIGotThis,"While replacing MKR with ETH could technically work, it is not a good idea. We have to allow different stable coins to compete to be the best. Integrating ETH with MakerDao would be an endorsement of MakerDao, it would be like making it part of Ethereum platform rather than letting it be a smart contract on Ethereum. ETH should remain neutral. And anyway, just using ETH in MakerDao is a kind of vote ~ the more it’s done, the more the ecosystem approves of how it works.",2021-10-18 05:28:04
CantBelieveIGotThis,"I see, but it would mean that that ETH would be the governance token, if we were to use it to vote on decisions and changes. Is that a good thing? A key aspect to the success of MakerDao is having a governance token whose value is dependant directly, and only, on the success of the dao, Holders of MKR are highly incentivised to make good decisions.",2021-10-18 05:58:13
goldayce,Agreed. MakerDAO has some of the most knowledgeable contributors in DeFi,2021-10-18 08:25:27
chillinewman,"People Beware before getting into this. Right now is the buy high sell low model.

See the analysis from makerdao:

https://forum.makerdao.com/t/ohm-olympus-dao-collateral-onboarding-application-mip6/10709/55",2021-10-18 09:49:31
falkerr,"I would say that all of Defi would fit that bill. We are talking about the decentralization and automation of the financial industry. This allows the billions of unbanked people in the world access to financial products with nothing other than a smart phone. Stable currency can be sent on a layer 2 settlement platform for cents making it significantly easier and cheaper for immigrants sending remittances. This might not seem valuable to you(it still is though) but it is valuable to billions of people. 

Some projects would be Aave, Compound, MakerDao, Layer 2s like Loopring, Arbitrum and Polygon. 

Next crypto gaming could be revolutionary for the gaming industry. Really interesting how that will play out. Illuvium, axies, are interesting crypto projects that will continue to progress the industry( making games is a long process) 

Cool projects like Klima Dao that aim to help our environment by buying up carbon credits and making them more expensive. 

A big argument to examples like I just showed is that the government, big tech, banks, or gaming companies would never let any of this become successful. However, the truth is that this is disruptive tech and disruptive tech will always eventually win out in the long run whether the old players like it or not. 

I really advise anyone who doesn’t know how tech in this space is really developing to take a hard look at crypto projects and the break fast speed in which progress is being made.",2021-10-18 10:35:08
InvertedDick,"The decentralized talking point is not as good as people think. For proof of work, eventually it’ll only be the wealthy that can afford specialized mining hardware, which then gives them a lot of control because now they can control the processing of transactions. Proof of stake is harder to game but still possible since all it takes is to purchase a large amount of coins, although yeah weighted randomization does help out. 

Both cases mean that there still is centralization happening, except this time it’s free from regulation and now the rich are truly able to do a lot of money laundering if they wish. Not to mention the environmental harm it does despite it processing in many orders of magnitude less than the current financial system. ETH’s proof of stake is shit in that regard, while still being better than a lot of proof of work. Proof of work is just flat out terrible. 

Another issue with this decentralization gimmick is that it is possible for transactions that were already processed to be reverted if they deem fit. Why does immutability matter when they can wipe out records that don’t benefit them? I mean, this flaw is fair game supposedly. https://www.gemini.com/cryptopedia/the-dao-hack-makerdao


So I don’t buy it, and I don’t care if people get rich off of it. I refuse to participate because I don’t see the promises of cryptocurrency holding up at all.",2021-10-18 12:37:36
10247---,"No, that's what Dai by MakerDAO is though. They're not pegged to anything (other than possibly themselves i guess). 
Here's a [article](https://stefan-ionescu.medium.com/rai-is-a-stablecoin-17eea21e9d1c) about RAI by Reflexer",2021-10-18 13:47:53
FewYogurt,"again, in terms of a frequency distribution, it is too heavily focused on the negatives (for example, Tether has still kept its value, but has lost market share to more clearly backed Dai, USDC and other algostables or fractionally backed algostables like Frax, Fei, Rai and LUSD).

For example, there are autonomous protocols that can manage collateralized debt to create a synthetic stable asset and conduct transactions/ provide yield (Liquity, MakerDAO, Alchemix), all running on a provably secure, decentralized and turing complete ledger. This fact is far more important than some vague indictment of *""hurr da shadowy super coders are using their 1s and 0s to run 'ponzis' because I don't understand the difference between ponzi's and fractional reserve banking.""*

Again, I urge people to look into what innovation solving the byzantine generals problem enables via digital assets on turing complete, immutable ledgers.",2021-10-18 13:56:16
jumnhy,"MakerDAO has always been risk-aware and risk-averse. The Risk Investigation Group is reasoned, cautious, and technically skilled.

By contrast, OlympusDAO seems full of memeticists. By which i mean their marketing is on point.",2021-10-18 22:08:59
MrQot,"Because if you had 1 ETH before the merge, you'll have 1 ETH on the PoS chain and 1 ETH on the PoW chain. Which is the ""real"" ETH? Which one will you be able to bridge to other chains like Polygon, using the existing bridge smart contracts? It'll be whichever one is deemed [legitimate](https://vitalik.ca/general/2021/03/23/legitimacy.html) by the community and market at large.

But it's not just eth, it's *all* the value locked in DeFi on Ethereum. If you had 1000 USDC before the merge, now you have it on both chains. But it's not like you magically made $1000 out of thin air, only one of those will be legitimate and redeemable. Same for NFTs, same for all the tokens out there. 

If you have 1000 DAI on both chains well, MakerDao ultimately sets the price and the price depends on what the oracles say the price of ETH say. So if MakerDao decides the PoS-ETH chain is legit, then the PoW-ETH oracle will be shut down or feed a value of $0 per ETH which would most likely fuck shit up on PoW-MakerDao and liquidate everyone's collateral. It's not impossible for part of the community to fork MakerDao as well and recreate DAI but it would be a lot of effort.

The DAO hard fork was in Ethereum's infancy when DeFi was barely a thing. The price of 1 ETC diverged for 1 ETH according to the market and that was it, but now the whole game is different.",2021-10-18 22:30:26
frank__costello,"&gt; it will be perfectly functional

DeFi will be completely broken on any fork

First of all, any fiat-backed stablecoin (USDC, USDT, etc) and even WBTC will be completely worthless. That means that the millions of dollars of liquidity in DEXs will allow buying ""forked ETH"" for $0, meaning the price of forked ETH will crash in price, bringing down many protocols that rely on ETH as collateral.

Plus, oracles will not be updated on the new chain, meaning any oracle-dependent application (MakerDAO, Aave, Compound, Synthetix) will completely break.

With the entire DeFi ecosystem collapsing and the price of forked-ETH plummeting, it's hard to imagine there will be any value left on chain. If people want a cheap EVM compatible chain, there's already many better alteratives.",2021-10-18 22:39:50
samsimon123,"Flare direct competitor to Ethereum (ETH) smart contracts, NFTs. Songbird is open systems and people will build things with them that we haven't thought of yet. But being able to have smart contracts for layer 1's that don't have them, the state connector, the decentralized built-in oracle, an EVM that works much faster than on Ethereum, being able to trade various L1s on a DEX, decentralized governance, all open up a lot of potential. It's super cheap fees (transactions), secure, fast, uses almost no energy. This is the best network for smart contracts. Use cases: Paying transaction fees, FTSO vote delegation, Minting F-assets. Use in apps being built on the network like Flare Finance and Trustline. The simple fact that a SGB/Flare wallet will be able to hold anything bep 20, erc 20, xrpl is game changer and you'll be rewarded for bringing on those assets.

The real power in WSGB is that it utilizes a detachable voting function for the FTSO and governance functions of the network. This also means that users can deploy the WSGB token in DeFi protocols or elsewhere while simultaneously voting in governance and earning inflationary rewards in SGB on a weekly basis through FTSO delegations to signal providers.

Matt Rosendin of Trustline recently announced that they will be launching their decentralized stablecoin protocol, Probity, on the Songbird Network sometime in October. Probity has a similar design to MakerDAO in that it takes collateral from suppliers and borrowers to mint and issue stablecoins. On Songbird Network, it would be expected that WSGB will be the collateral of choice. Once live on Flare Network, Probity will feature FLR and FXRP as premium collateral. Additionally, Aurei (AUR), stablecoin of Probity, can be issued on the XRP Ledger with the Flare and Songbird Networks as the decentralized counterparty.",2021-10-18 22:43:44
samsimon123,"Flare direct competitor to Ethereum (ETH) smart contracts, NFTs. Songbird is open systems and people will build things with them that we haven't thought of yet. But being able to have smart contracts for layer 1's that don't have them, the state connector, the decentralized built-in oracle, an EVM that works much faster than on Ethereum, being able to trade various L1s on a DEX, decentralized governance, all open up a lot of potential. It's super cheap fees (transactions), secure, fast, uses almost no energy. This is the best network for smart contracts. Use cases: Paying transaction fees, FTSO vote delegation, Minting F-assets. Use in apps being built on the network like Flare Finance and Trustline. The simple fact that a SGB/Flare wallet will be able to hold anything bep 20, erc 20, xrpl is game changer and you'll be rewarded for bringing on those assets.

The real power in WSGB is that it utilizes a detachable voting function for the FTSO and governance functions of the network. This also means that users can deploy the WSGB token in DeFi protocols or elsewhere while simultaneously voting in governance and earning inflationary rewards in SGB on a weekly basis through FTSO delegations to signal providers.

Matt Rosendin of Trustline recently announced that they will be launching their decentralized stablecoin protocol, Probity, on the Songbird Network sometime in October. Probity has a similar design to MakerDAO in that it takes collateral from suppliers and borrowers to mint and issue stablecoins. On Songbird Network, it would be expected that WSGB will be the collateral of choice. Once live on Flare Network, Probity will feature FLR and FXRP as premium collateral. Additionally, Aurei (AUR), stablecoin of Probity, can be issued on the XRP Ledger with the Flare and Songbird Networks as the decentralized counterparty.",2021-10-18 22:43:48
samsimon123,"Flare direct competitor to Ethereum (ETH) smart contracts, NFTs. Songbird is open systems and people will build things with them that we haven't thought of yet. But being able to have smart contracts for layer 1's that don't have them, the state connector, the decentralized built-in oracle, an EVM that works much faster than on Ethereum, being able to trade various L1s on a DEX, decentralized governance, all open up a lot of potential. It's super cheap fees (transactions), secure, fast, uses almost no energy. This is the best network for smart contracts. Use cases: Paying transaction fees, FTSO vote delegation, Minting F-assets. Use in apps being built on the network like Flare Finance and Trustline. The simple fact that a SGB/Flare wallet will be able to hold anything bep 20, erc 20, xrpl is game changer and you'll be rewarded for bringing on those assets.

The real power in WSGB is that it utilizes a detachable voting function for the FTSO and governance functions of the network. This also means that users can deploy the WSGB token in DeFi protocols or elsewhere while simultaneously voting in governance and earning inflationary rewards in SGB on a weekly basis through FTSO delegations to signal providers.

Matt Rosendin of Trustline recently announced that they will be launching their decentralized stablecoin protocol, Probity, on the Songbird Network sometime in October. Probity has a similar design to MakerDAO in that it takes collateral from suppliers and borrowers to mint and issue stablecoins. On Songbird Network, it would be expected that WSGB will be the collateral of choice. Once live on Flare Network, Probity will feature FLR and FXRP as premium collateral. Additionally, Aurei (AUR), stablecoin of Probity, can be issued on the XRP Ledger with the Flare and Songbird Networks as the decentralized counterparty.",2021-10-18 22:43:50
samsimon123,"Flare direct competitor to Ethereum (ETH) smart contracts, NFTs. Songbird is open systems and people will build things with them that we haven't thought of yet. But being able to have smart contracts for layer 1's that don't have them, the state connector, the decentralized built-in oracle, an EVM that works much faster than on Ethereum, being able to trade various L1s on a DEX, decentralized governance, all open up a lot of potential. It's super cheap fees (transactions), secure, fast, uses almost no energy. This is the best network for smart contracts. Use cases: Paying transaction fees, FTSO vote delegation, Minting F-assets. Use in apps being built on the network like Flare Finance and Trustline. The simple fact that a SGB/Flare wallet will be able to hold anything bep 20, erc 20, xrpl is game changer and you'll be rewarded for bringing on those assets.

The real power in WSGB is that it utilizes a detachable voting function for the FTSO and governance functions of the network. This also means that users can deploy the WSGB token in DeFi protocols or elsewhere while simultaneously voting in governance and earning inflationary rewards in SGB on a weekly basis through FTSO delegations to signal providers.

Matt Rosendin of Trustline recently announced that they will be launching their decentralized stablecoin protocol, Probity, on the Songbird Network sometime in October. Probity has a similar design to MakerDAO in that it takes collateral from suppliers and borrowers to mint and issue stablecoins. On Songbird Network, it would be expected that WSGB will be the collateral of choice. Once live on Flare Network, Probity will feature FLR and FXRP as premium collateral. Additionally, Aurei (AUR), stablecoin of Probity, can be issued on the XRP Ledger with the Flare and Songbird Networks as the decentralized counterparty.",2021-10-18 22:43:53
