author,body,created
augustofretes,"My experience with rollups is that they solve one problem (low tx/s) and replace with a bunch:

* No more composability. The system is entirely broken into independent silos, with essentially independent funds. If you're on Loopring, you can't interact with MakerDao, try new lending protocolos like Liquity, or even buy all that many tokens (you can't even send funds to an L1 address without withdrawing them first). Interacting with any other L1 contact requires you to whitdraw from Loopring to L1, then if the contract you want to interact with exists on a different L2, you need to deposit to that L2. L2 bridges will make this easier from a a user's perspective, but the underlying issue is still there.

* L2s are not censorship resistant, and the L2 owner can refuse to do what you want. This is true even in advanced zk-rollups like Loopring's. L2 solutions are just not really decentralized, best-in-class rollups ensure that your funds can't be stolen, but that's about it. 

* Future Ethereum solutions like sharding won't run the EVM, so they don't scale the capacity to run smart contracts as much as looking at the raw number of tx/s suggests. 

* Side chains (really independent chains), don't rely on Ethereum for security, and are really independent beasts with their own pros and cons. You can't recreate the entire history on chain using Polygon, so if the Polygon was compromised in some way, or shut off, there's no way for you to move your funds back to the Ethereum network. In essence, you need to trust Polygon, not Ethereum to use it.",2021-05-01 02:19:20
Neophyte-,"thanks thats a great answer

&gt; There is actually not a real problem with the UTXO model, in fact, it is better in many ways and enables critical solutions to some of the issues the blockchain industry faces today. 

my thought about the utxo model potentially breaking down in hard cap blockchains was constant dividing of utxo into smaller and smaller chunks leading to tx bloat. is that not the case? if so why not?

&gt; Because of the parallelism we get from UTXO processing, which isn't available on an account based system, we have solved the miner extracted value issues in DeFi as well as front running, since all currency conversions in a single block are processed simultaneously with all others, resulting in all participants in that block getting the same conversion rates in all directions with no spread.

can you expand on what that means? i thought defi had nothing to do with miners, just people mostly loaning/ borrowing money where loans are collateralised in smart contracts. there are other cases like makerdao and liqudiity mining LP tokens.

&gt; will allow anyone to create their own connected blockchains, launch currencies with kickstarter-like fund-or-refund blockchain participation that have their own bandwidth, their own ability to issue IDs, their own independence, in-spite of interoperability with the rest of the Verus network (and others including ETH), and can be automatically discovered, connected to and merge-mined by anyone on the network

this sounds a lot like polkadot or cosmos, would that be accurate? if so how does it differ?",2021-05-01 04:29:19
Gladfire,"&gt; DARPA funded the research 

DARPA is the most well known reasearch agency of the USDoD.  


&gt; It was really the university network that drove adoption. 

When developing non-sensitive technologies the DoD historically always works closely with the universities then allows usage of the tech.  


&gt; I *am* sure that the military never used public networks for their communication in those early days. 

The military funded it's development for their own eventual usage, ARPANET wasn't used by the military to my knowledge, it was the proof of concept.  


&gt; I assume you mean $1.5 MM or something? 

Yeah, typo. Fixed.

&amp;#x200B;

&gt; So no, it doesn't put control back in the hands of the banks--exactly the opposite. 

If there's a high cost for entry, banks and financial institutions can leverage their vastly higher resources to gain controlling stakes effectively, no?  


&gt; Enough demand might incentivize new entrants into the GPU market, which would be a huge boon to everybody. 

And in the mean time the average consumer will be priced out of the market completely.  


&gt;You threw an environmental argument in there, too. But you can use that argument against basically *anything*. In fact...if we have limited resources to create GPUs, would they be better spent creating a new, public, distributed financial system available to everyone in the world, or helping first-world gamers get from 90 FPS to 110 FPS in their video games?

You're implying that this is a case of either or, if regular consumers didn't buy these, they wouldn't be made, you're implying that the alternative is a new financial system which doesn't currently exist. You're also making green = no happiness argument, we're talking minimization with minimal impact on QoL, not utter minimisation, no one's suggesting to send humanity back to the stone age.  


&gt;  But it's not *entirely under the control* of government. 

You're implying that any direct influence by companies is beneficial, it isn't. Companies want what is best for companies, governments want, or at least pretend to want what they, at least pretend, is best for their people.  


&gt; You're half-right. It is pinned to the USD, but it's not controlled by a company. 

In terms of financial markets, companies, banks, and other financial institutions controls significantly more capital than regular investors. DAI is voted through MakerDAO, and the amount of DAI you put into you vote controls the weight of your vote, no? Now, either the groups with more capital can take over and do what they collectively want and so you're controlled by the company, or they can't do this and the currency is at the whims of a company, namely whoever are the executives of MakerDAO.  


&gt; You think Microsoft is going to...*buy* Bitcoin or something? 

If cryptos become recognised, global currencies, then companies are indeed going to work together to buy them and gain control where ever they can.  


&gt;Historically that hasn't worked; the best they could do was fork it (BCH &amp; BTG). And with the market cap growing quickly, it's becoming less feasible by the day. 

Historically, these attempts have been done by relatively small groups with little capital compared to multi-trillion dollar companies, or countries.",2021-05-01 04:52:09
jaydubya14,"Are the fundamentals there though? Or are the concepts there and they will get to the actual products when they get to it? I don’t remember where but I thought I saw that the adaptive state sharding isn’t even active yet. Their tps record was without edst and smart contracts. Everything they talked about today regarding the exchange were all just a combination of elements from every part of the defi ecosystem currently, nothing new to the space at all. They seem to think they can just fork everything, give it some fancy blue polish and add the word Maiar and boom, innovation. Seriously look at UNI, Curve, MakerDAO, Pancake, etc...every idea they talked about today has already been implemented elsewhere",2021-05-01 07:21:58
anor_wondo,"Damn, just in a few weeks we got first real asset loan using makerdao, EU bond and cbdc, EIP1559, merge ETAs",2021-05-01 10:20:59
stablecoin,"Kyber Network, MakerDao, Bancor, Chainlink, Synthetix, Idex, ether delta, godz unchained, Enjin, decentraland, token sets...there were quite a few dapps that were being used. Then Uniswap launched in the lowest depths of the bear, and really brought things together. 

It was all there if you knew what you were looking for. An entire self sustaining economy budding from the ground floor.",2021-05-01 12:01:18
AutoModerator,"Hello /u/Iive_support! I regret to inform you that your comment has been automatically removed because your account is too new. This is to help us prevent spam from proliferating this subreddit. But don't fret! Our threshold for commenting is very low. Try commenting again here in a couple of days.

In the meantime, please familiarize yourself with the [reddiquette](https://www.reddit.com/wiki/reddiquette), as well as /r/MakerDAO's rules, located in the sidebar [or by following this link](https://www.reddit.com/r/MakerDAO/about/rules).

*I am a bot, and this action was performed automatically. Please [contact the moderators of this subreddit](/message/compose/?to=/r/MakerDAO) if you have any questions or concerns.*",2021-05-01 13:18:29
squarov,"On this day...

In 2020:

- OpenBazaar [adds](https://twitter.com/brianchoffman/status/1256337841132470273) support for Ether.
- The Compound community [accepts](https://etherscan.io/tx/0x48aeb1532c1cc92103df7d2c00a73c219ca7e143fd41b0e4a57cbf31f89d9348) supporting $USDT, the first decentralized goverance proposal.
- ETH silently ticks along from $208 to $214, at ₿0.02417.


In 2019:

- Rick Dudley [discusses](https://ethhub.substack.com/p/discussing-the-ethereum-roadmap-with) the Ethereum roadmap on Into the Ether.
- dYdX [v2](https://medium.com/dydxderivatives/dydx-is-live-48df862105c0) goes live on the Ethereum mainnet.
- Status release [v0.12](https://our.status.im/0-12-0-mobile-release-introducing-discover), introducing Discover, a soon to be decentralized app to find other dapps.
- MakerDAO [demos](https://www.coindesk.com/makerdao-demos-tech-to-back-stablecoin-dai-with-any-crypto-asset) the technology for Multi-Collateral DAI.
- ETH looks sideways at $161 and double-takes ₿0.02979.


In 2018:

- SEC [examines](https://www.wsj.com/articles/worlds-second-most-valuable-cryptocurrency-under-regulatory-scrutiny-1525167000) whether ether and other cryptocurrencies should be regulated as securities.
- ETH, from ashes to satoshis, over $673, to ₿0.07406.


In 2017:

- Blockchain VCs [back](http://www.coindesk.com/blockchain-vcs-back-0x-protocol-lets-trade-ethereum-tokens-free) 0x, a decentralized trading protocol for ethereum tokens.
- ETH enjoys the views around $80, loses its sunglasses ₿0.05897 to ₿0.05367.


In 2016:

- The Ethereum network [registers](https://twitter.com/slockitproject/status/726770068261064704) the highest number of transactions so far: over 40k/day.
- The DAO approaches top 10 crowdfundings of all time in the first ~30 hours, while [critics](https://www.reddit.com/r/ethtrader/comments/4h80xm/the_dao_riskfree_short_term_investment_highrisk/) [grow](https://www.reddit.com/r/ethtrader/comments/4h8cly/the_dao_why_i_am_not_investing/)
- ETH takes a rest around $8.8 and knocks ₿0.01949 around the park.

-------------
^(compiled via pwr.news - )[^(more info)](https://pwr.news/blog/on-this-day-in-ethereum-workflow/)",2021-05-01 14:17:01
Neophyte-,"&gt; 1) UTXOs are constantly merged, so if two, three, or four UTXOs are needed to send an amount, there will typically be one output for change.

thanks i didnt realise this, hence the blockchain bloat isnt really a problem.

on point 2) ive read that the UTXO model makes writing smart contracts more difficult since you need to pick out the UTXO you need to fulfil the transaction e.g. sending some money. in the account model its easier since you just deduct the balance. Do you think thats a valid criticism? or can the contract framework hide those lower level details from the user, much like how bitcoin wallet software works? 

Wehn you talk about integrated defi, what does that mean exactly? defi is usually just a dapp built within a chain e.g. makerdao on eth. can you give me an example?

As for IDs how does this work within Verus? i would have thought any DID/SSI wouldnt be part of the base protocol layer. 

do you have a wiki on the verus project? something less heavy weight then a whitepaper.",2021-05-01 15:21:45
Morais91,"Small networks: this is to dumb to require an answer

Centrelized development: that is usually required for projects that aim to do more than transfer one token from one wallet to another. They all end up as DAOs where the community can vote on changes (MakerDAO, ETH, Uni, algo, VET, basically every token or relevant blockchain). The fact you can vote on improvements makes it a million times more decentralised than a fixed never changing system like bitcoin

Premining: this is only a problem if the only value of your token is its fabricated rarity. I can see how a bitcoin maxi would think this is a problem 😂

Low security and attack angles: bitcoin is one of the most centrelized systems, having 53% of its mining power in a single Chinese controlled pool. The fact that the mining of bitcoin will only get more complex and require more money investment will only further centrelize it to the few who can mine it",2021-05-01 17:49:58
RemindMeBot,"I will be messaging you in 5 hours on [**2021-05-01 15:19:10 UTC**](http://www.wolframalpha.com/input/?i=2021-05-01%2015:19:10%20UTC%20To%20Local%20Time) to remind you of [**this link**](https://www.reddit.com/r/MakerDAO/comments/n2bxl2/using_uni_lp_tokens_as_collateral_makes_you/gwizbdt/?context=3)

[**CLICK THIS LINK**](https://www.reddit.com/message/compose/?to=RemindMeBot&amp;subject=Reminder&amp;message=%5Bhttps%3A%2F%2Fwww.reddit.com%2Fr%2FMakerDAO%2Fcomments%2Fn2bxl2%2Fusing_uni_lp_tokens_as_collateral_makes_you%2Fgwizbdt%2F%5D%0A%0ARemindMe%21%202021-05-01%2015%3A19%3A10%20UTC) to send a PM to also be reminded and to reduce spam.

^(Parent commenter can ) [^(delete this message to hide from others.)](https://www.reddit.com/message/compose/?to=RemindMeBot&amp;subject=Delete%20Comment&amp;message=Delete%21%20n2bxl2)

*****

|[^(Info)](https://www.reddit.com/r/RemindMeBot/comments/e1bko7/remindmebot_info_v21/)|[^(Custom)](https://www.reddit.com/message/compose/?to=RemindMeBot&amp;subject=Reminder&amp;message=%5BLink%20or%20message%20inside%20square%20brackets%5D%0A%0ARemindMe%21%20Time%20period%20here)|[^(Your Reminders)](https://www.reddit.com/message/compose/?to=RemindMeBot&amp;subject=List%20Of%20Reminders&amp;message=MyReminders%21)|[^(Feedback)](https://www.reddit.com/message/compose/?to=Watchful1&amp;subject=RemindMeBot%20Feedback)|
|-|-|-|-|",2021-05-01 18:19:36
BrownBear521,"MakerDao has been pretty solid for me. You can barrow via oasis.app. Although their interest rates have gone up. If you can offer a min of 150% collateral, they have an option for 5.5% interest. If you can offer a min of 175% collateral, they have an option for 3.5%. 

If you go this route, please put in MORE collateral then the min, if you don't and you get liquidated, you will pay a large penalty.

Also this is a fully decentralized route so please DYOR.",2021-05-01 20:00:36
Destreich,"I just want to take a moment to express my undying appreciation for MakerDAO, Dai, and MKR's sweet PA.",2021-05-01 23:44:30
Pickinanameainteasy,"So polygon is a layer 2 chain? So in theory i could connect my wallet to polygon (incurring a fee to get off chain) and then make transactions (including smart contacts?) for much lower fees?

If i was to move funds to polygon chain and then say take a loan on makerdao wouldnt i still pay the same amount of gas as i would if i sent ETH from the mainnet? I would only reduce miner fees or gas too?

Sorry if this is dumb but I've never used L2 on ethereum and am basing all this on my experience with lightning network in BTC",2021-05-02 02:22:30
Dwaas_Bjaas,"MakerDAO is the most genius crypto after ETH.

Prove me wrong",2021-05-02 02:39:07
increMENTALmate,"You don't have to pay the same amount of gas, but you do pay an initial bridging fee for moving your ETH onto the Polygon Network. You can do all that in the matic wallet in your browser, and see the fees before you commit. Once your ETH is wrapped and over on the Polygon network, the fees for everything will be tiny. But you can only do DeFi on shit that's actually using Polygon network. I don't know a lot of those projects. I just use QuickSwap for liquidity pools. I have no idea if MakerDAO functions on that chain.",2021-05-02 03:09:59
avaxpodcast,"It's my understanding that you could transfer DAI from ethereum to the polygon network, but the MakerDAO protocol isn't live on polygon, so your creation of a vault would still need to occur on the ethereum network.",2021-05-02 07:33:46
Cryptoliciousness,"&gt;Deposit it on AAVE [1 step removed], take out a USDC loan maintaining a health factor of 4 [2 steps removed], put that in the Curve 3pool [3 steps removed], deposit half of your 3CRV in Freeliquid (MakerDAO fork) [4 steps removed], pull out a 90% loan of USDFL [5 steps removed], trade that for ETH on Uniswap [6 steps removed], trade that ETH for YAXIS on Uniswap [7 steps removed], stake the YAXIS on their website and place the remaining 3CRV in the metavault on yAxis's website [8 steps removed]. Easy gains.

Am I the only one that sees 8 taxable events here?",2021-05-02 07:57:40
squaredk2,"Let me introduce you to the world of decentralized finance. Where we can use mathematical computations to remain far more stable than a highly inflated currency such as USD.  

Check out [MakerDAO](https://decrypt.co/resources/makerdao-guide-learn-explained-decrypt-3-minutes?amp=1) to start. Then, if you have even the slightest interest in the future of global economies, look into Layer 2 solutions that will be enabled through Ethereums smart contracts.  

You guys really think the whole world is just pulling this ""crypto currency"" shit right out of our asses, don't you.",2021-05-02 13:01:58
MenteEsoterica,"Exactly what I was thinking, I won’t just split away but I will with cation at the right time. But the education was useful about Ampl, I come from MakerDao so I thought it was a bit similar but the difference are quite noticeable now.",2021-05-02 16:22:25
continentaller,"I advice you to follow portfoilio of ANDREESSEN HOROWITZ

They invest in:

\- Compound #COMP 

\- MakerDAO #MKR

\- KEEP Network #KEEP

\- Dfinity #ICP

\- Dapper Labs #FLOW Blockchain

\- NEAR Protocol #NEAR

\- Avalanche #AVAX

\- Filecoin #FIL

\- Uniswap #UNI

\- Oasis Network #ROSE

\- Fei Protocol #TRIBE 

\- Chia #XCH

More info about crypto investments in my telegram channel: [https://t.me/keller\_crypto](https://t.me/keller_crypto)",2021-05-02 18:55:25
1C9R0R4,"[https://blog.makerdao.com/the-market-collapse-of-march-12-2020-how-it-impacted-makerdao/](https://blog.makerdao.com/the-market-collapse-of-march-12-2020-how-it-impacted-makerdao/)

It happened about a year ago. The objective is to get the stablecoin to a place where most crypto volatility will be an afterthought in the grand scheme of stablecoins and your desires to park your assets there.",2021-05-03 00:34:10
ichthyoidoc,"DAI is pretty great.

Like others have said, we've already had black swan events, including the huge crash that happened last year, March 12. That event revealed some holes in MakerDAO and DAI system that have subsequently been patched up (they were more to do with the Ethereum ecosystem rather than simply DAI). 

In my opinion, DAI may be a model for future stablecoins, though only time will tell if the rest of the market adopts.",2021-05-03 03:20:40
Pasttuesday,"I had almost all BTC until I started using ethereum. The first time i deposited eth into makerdao, and then borrowed USD (DAI)...

it felt like crazy black magic. I haven't turned bak.",2021-05-03 06:39:36
randolphmd,"Makerdao, synthetix, and sushi are pretty top tier",2021-05-03 08:20:54
AutoModerator,"Hello /u/ValueInTheVoid! I regret to inform you that your submission has been automatically removed because your account is too new. This is to help us prevent spam from proliferating on this subreddit. But do not fear! A message has been sent to the moderators, and if this submission is a genuine contribution, then it will be manually approved by the moderators. 

In the meantime, please familiarize yourself with the [reddiquette](https://www.reddit.com/wiki/reddiquette), as well as /r/MakerDAO's rules, located in the sidebar [or by following this link](https://www.reddit.com/r/MakerDAO/about/rules).

*I am a bot, and this action was performed automatically. Please [contact the moderators of this subreddit](/message/compose/?to=/r/MakerDAO) if you have any questions or concerns.*",2021-05-03 11:15:32
moonbro9000,"Zilliqa has tons of features and partnerships. Sharded blockchain, Peer reviewed smart contract language designed with security in mind(listed at OOPSLA), multiple dapps in there ecosystem such as Mintable(invested by Mark Cuban), Unstoppable Domains(invested by Tim Draper), HG Exchange (Securities exchange tokenizing other assets), DeFi through Zilswap and other dapps which can be seen here: https://docs.zilliqa.com/ecosystem-growth-report-2020.pdf

And more info about Zilswap and other growth to their ecosystem in their latest growth report here: https://docs.zilliqa.com/ecosystem-growth-report-2021-Q1.pdf

Zilliqa will have another dapp released soon called Pillar Protocol which is similar to MakerDao on Ethereum.

Another exciting item is Zilliqa will have a bridge between Zilliqa and other blockchains in Q2 sometime so other tokens such as ETH will be available to be wrapped and used on Zilliqa chain.

Also, they’ve had a recent partnership with Polaris sports which works with some high profile sports stars like James Rodriguez and Cristiano Ronaldo.

Another major partnership is Xfers which is considered the PayPal of Southeast Asia and is they’re partnered with PayPal, Gemini and Coinbase. Zilliqa created a stable coin used on the Zilliqa chain for Xfers.

Zilliqa has a partnership with Mindshare and did some test pilots with PepsiCo for some campaigns. Relevant info here: https://www.mindshareworld.com/news/mindshare-to-launch-first-phase-of-blockchain-pilot-on-the-zilliqa-platform/

https://www.thedrum.com/news/2019/05/06/pepsico-and-mindshare-programmatic-blockchain-test-drives-28-efficiency-lift

Zilliqa has worked with MAS Singapore government to integrate use of Zilliqa mentioned here: https://www.mas.gov.sg/-/media/MAS/ProjectUbin/Project-Ubin-DvP-on-Distributed-Ledger-Technologies.pdf?la=en&amp;hash=2ADD9093B64A819FCC78D94E68FA008A6CD724FF

Lastly, Zilliqa Capital investment hub for Zilliqa has some pretty impressive members: 
https://twitter.com/zilliqacapital/status/1369887464161165314?s=20",2021-05-03 11:25:28
midgethemage,"I'm gonna just pop in and chime in on this topic. Another commenter touched on this, but the MakerDAO system has the ability to lend and borrow. So when gemini is offering interest, they're likely taking our DAI and actually lending it themselves. It's not the hardest to do, but can be costly to get going due to gas costs. 

Another part of it -- and I don't fully understand the tech side of this -- has to do with how Maker and DAI work together. The interest incentives people to hold their DAI to maintain liquidity. Sometimes there's too much DAI in the pot and the interest rate will go down.",2021-05-03 12:44:51
ethereumflow,"Smaller networks = application specific blockchains 

Security can be subjective. For example: Cryptokitties or Axie Infinity don’t require the same security as AAVE or MakerDAO but they pay for the same level of security. 

Enter Cosmos. Sovereign, application specific blockchains with their own security and their own validator set that can communicate and interoperate through a standard protocol. 

Bridges to other networks are a more sustainable long term solution than L2, which is still subject to congestion and ETH fees when bridging anyway. Optimistic L2 withdrawals will apparently take up to a week to finalize. Sure it’s secure but it’s not at all convenient. 

Blockchain is a different space in 2021. Especially in the Cosmos ecosytem.",2021-05-03 13:06:51
augustofretes,[Liquity](https://www.liquity.org/)! It's a better MakerDao if you want liquidity without losing exposure to ether.,2021-05-03 14:12:56
ginger_beer_m,"MakerDao and DAI have been around since before 2017/18, and it certainly stood the test of time, going through at least one bear market.",2021-05-03 16:47:32
lohitcp87,"https://www.reddit.com/r/zilliqa/comments/lon52k/the_pillar_protocol_an_indepth_guide/?utm_medium=android_app&amp;utm_source=share

https://pillarprotocol.com/

It's similar to MakerDao of Ethereum ecosystem.",2021-05-03 19:14:24
mveeq,"MakerDao forums, it’s the top discussion.",2021-05-03 22:11:56
MooseOrgy,There are dividend like investments with staking rewards on POS protocols.  You can get crypto backed loans with MakerDAO and you can lend stablecoins on the Ethereum blockchain for 10% APY.  Not every crypto project is just fixed supply digital gold where the only income generation is based on appreciation. Plenty of projects allow you to utilize your holdings to generate income.  If I’m staking my ETH I’m earning same way I would earn a quarterly dividend.,2021-05-03 23:40:07
nikola_j,"Makerdao.com/redeem is the only official page for upgrading MKR tokens

Source: https://medium.com/@MakerDAO/mkr-token-upgrade-and-oasis-redeployment-2445482437d6",2021-05-03 23:47:29
buckbuckkkk,"Literally google “MakerDAO”, click the first link that pops up, and natvigate the site to the white paper",2021-05-03 23:50:23
halfdayallday123,"The buffer is quickly getting refilled. So we’re not that far away from another maker burn moment. As the surplus buffer gets filled quicker and quicker the system will probably vote to increase the buffer. Case in point it was just doubled from 30M to 60M. Nonetheless, more rapid growth of the MakerDao will cause more surplus and hence more burning and a higher coin value for Maker. The only headwind I see for Maker is any unforeseen government regulations that could appear at any moment and affect business for MakerDao",2021-05-03 23:56:36
