author,body,created
hubadl,"In my opionen, the whole crypto space was about dezentralization and power to the people. (Tether,XRP, BNB all centralized, also Binance and Tether are closely related and a little bit shady xD)

Doge is a meme,i have nothing against it but that people invest in it that much is crazy.

ADA seems like a nice project yes, but lets be honest, its so much speculation.
It is marketed as the ethereum killer, but there are not even smart contracts yet. There is no real functionality except staking. I know its coming, but it is not there and people pump it like crazy. (Please correct me if im wrong)

ETH has many years of development and a big ecosystem. (NFTs, Uniswap, Chainlink, Aave, DAOs (MakerDAO - dezentralized bank super nice :D), etc.). The Ökosystem is crazy cool and you should test some of the defi services that are available. Super cool i think :) (I was really really impressed when i tried everything out)

I dont know that much about DOT, i think one of their goals is they want to make blockchains interoperable?! I dont have any DOT, i know to less about it.

BCH is for me a very idealistic project. In my believe its true to the early ideal of electronic cash for the world. Also i really like that there are multiple dev teams which work together for the common ideal of peer to peer cash (which could end very badly also).
I know people maybe dont want to hear that here, but i think BCH is a very high risk investement. You need to overcome states and the whole finance sector if you want to be p2p cash for the world.
Also i think bch has to overcome BTC which, lets be hones, is a big brand nowadays.

ICP is just another blockchain with a massive marketing hype machinery.
Their marketing is full of buzzwords....
But i am honest i am not that into ICP, so maybe someone can tell me what smart contracts are running on ICP and what can i do with it. Why is it better than ethereum for example? (Im always sceptical of chains that suddenly pop into top 10 marketcap, with a marketing machinery like they have)

But yeah im honest a have idealistic views on the topic.
If you want to make money maybe XRP (bank coin), BNB are not so bad choices.",2021-05-20 21:56:25
AllBlackCrypto,"Depende del motivo ulterior. Los q compraron por especulación esta bien, los q holdean eth por q quieren manejarse bankless / quieren estar fuera del sistema deberian buscar otra alternativa, por ejemplo mintear dai en makerdao y comprar mas eth con esos dai.",2021-05-20 21:56:52
ChrolloBaby,"The Ethereum foundation website has a great guide to Ethereum development, and the solidity docs is what you would typically use to learn solidity -&gt; https://docs.soliditylang.org/en/v0.8.4/

There are other tutorials aimed at introducing people to solidity Dev like crypto zombies. I think coding is fun and encourage anyone who’s interested to learn. I will say that it’s better to learn some fundamentals of programming before jumping into solidity - not that you won’t understand it, but you’re more likely to have a deeper understanding of it which would prevent misconceptions when learning solidity. If you’d like to ensure that you don’t get tricked by projects, but you don’t want to go through the effort of learning, then it might be good to stick with projects that have a reputable background with these considerations in mind. See what the project is doing and what it supposed to be for. If it’s a get rich quick scheme then it probably is a scam. If it sounds too good to be true, then it’s probably a scam. If the people talking about sound like they’re trying to sell you something like the brokers in wolf of Wall Street, then it’s probably a scam. On the flip, projects like MakerDAO are an example of something that provides (and not just promises, but actually provides) real utility and value that can be described in simple terms ex. MakerDAO allows users to take loans against assets like ETH. You might want to buy the Maker token so that you can vote for decisions that control MakerDAO like the interest on loans, or the savings rate when lending, or to participate in auctions that allow you to sell it for DAI (a stable coin pegged to USD) when there’s a surplus.

Same thing with others like ChainLink, a company that provides oracle services to smart contracts. 

Whether or not you decide to learn contract dev, being able to articulate the good or service a token is providing, as well as having conversations with people in the community behind it who’s goals aren’t just to get more people to buy it, is a good way to see if a project is likely a scam or not.",2021-05-20 22:47:33
halfdayallday123,"It’s an up front condition of doing business. If you want to take a loan in Dai, you’ve got to make sure your collateral is at or above 150% otherwise it will get liquidated and you’ll pay the penalty. Borrowers know this up front and have a chance to add collateral when their original collateral tanks in price and goes under 150%. If they can’t pony up the additional funds to get back to 150% then it gets liquidated. There’s no conflict of interest. MakerDao is in the business of lending and that is a profitable business. The lending rates are very low but the collateral requirements are very high. I consider this a secure, honest system that nobody is forced to participate in. I’m not trying to take loans out in the MakerDao system I’m trying to get rich holding Maker coins. I want to retire early.",2021-05-20 23:20:34
Breeder-One,Woah can you please share what do you mean MakerDao is it decentralized exchange? I find the strat of putting my assets in margin to temporarily increase buying power in dips is smart but binance fee is killing me.,2021-05-20 23:46:17
spookygunz,You don’t necessarily  lose all your coins.  For instance if you had 20 ETH at $3000 and got liquidated for $15000 and ETH was $1000.   You would owe $15000+$1950 (13% fee).  That would mean you were left 3.05 ETH.  The fee is for all trouble MakerDao has to do with auction.,2021-05-21 09:08:29
AutoModerator,"Hello /u/hxhehehe! I regret to inform you that your submission has been automatically removed because your account is too new. This is to help us prevent spam from proliferating on this subreddit. But do not fear! A message has been sent to the moderators, and if this submission is a genuine contribution, then it will be manually approved by the moderators. 

In the meantime, please familiarize yourself with the [reddiquette](https://www.reddit.com/wiki/reddiquette), as well as /r/MakerDAO's rules, located in the sidebar [or by following this link](https://www.reddit.com/r/MakerDAO/about/rules).

*I am a bot, and this action was performed automatically. Please [contact the moderators of this subreddit](/message/compose/?to=/r/MakerDAO) if you have any questions or concerns.*",2021-05-21 13:21:39
SkillDuel,"If a compromise had ever happened on Kovan (which it hasn't), it would be very easy to immediately identify the nefarious actors.

Kovan blocks are mined every 4 seconds. If the timestamps were ever to indicate that a compromise had occurred, that would immediately be publicized, and the reputation of Kovan (and of the Kovan Authorities) would be destroyed.

Since that has not happened in the entire 4 years that Kovan has run without a hitch, I would have much more confidence in Kovan, then some of the other technologies that are promoted on this subreddit.

The Kovan Authorities include MakerDAO and Etherscan. I don't think those entities would jeopardize their reputation by attempting to hack a simple Roulette game that is on Github.

I am not suggesting that you buy a billion dollars of MILLI. I am suggesting that you buy $100 worth, and use it instead of an ETH Mainnet token for your dApps, since the ETH Mainnet charges exorbitant transaction fees. The Uniswap v3 fee is currently $35.",2021-05-22 02:46:23
AusIV,"There are several concerns here though.

While the Kovan authorities are reputable, they signed up to manage a testnet, not a secure system. Who knows how they're securing the keys to their Kovan validators? I seriously doubt it's at the same level they would if they had intended to be securing serious value. If there were an attack on MILLIs, they'd probably claim their keys were compromised, and they might even be telling the truth.

And even if they've done a great job securing their keys and have the best of intentions for not abusing anyone, they're still subject to the laws of their jurisdictions, and it's not like their identities aren't knowable to regulators. What happens if  some government regulator knocks on the MakerDAO foundation's door and says ""Hey, by signing Kovan blocks with Milli Roulette transactions in it, you've been running an illegal gambling operation. We need you to do X to avoid criminal charges.""

None of these have been major concerns for a testnet with no appreciable value on it, so the fact that it hasn't happened in the past doesn't mean it couldn't happen if people start transacting on Kovan with real value.",2021-05-22 05:38:28
Datasurfer11,"A little story in patience...

Crypto has taught me a lot about blockchain, tech, finance, and myself. I followed the price of BTC since around 2014ish and was curious about it but never had the $ to invest, so when the time came to invest, I knew exactly what I wanted. Per mere coincidence I came across an article about ETH in 2016 with a little interactive tool that let you build smart contracts. I thought “woah that’s cool, surely BTC can do that (or they are working on it),” only to find BTC could not. Then I became obsessed with learning about Ethereum, started with the white papers, some Vitalik interviews, and ended with MakerDao, Augur and a Eth2.0 roadmap. 

Something clicked. This is what blockchain is about, decentralization and bringing some power/visibility back to the people. 

I went all in on ETH in 2017 at the top of the bull market, wasn’t a lot, but relative to me it was almost everything. Shortly after the price dropped and I was down a lot. I decided price was low and I should open a CDP (Vault) in MakerDao since I though the price would go up. Made the mistake of putting almost all my Eth into the CDP and paid the price. I was aggressively taking loans out to myself to buy more Eth and then adding back into the CDP (thought I was a genius). One day in late 2018  Eth just starts dropping to $ amounts I never though possible( or planned for). Being over leveraged and not having cash on hand to back up my CDP I was liquidated and my heart was broken. 

Being liquidated was the best thing to happen to me. Sure it sucked at the time and I may have been slightly depressed for a day or two, but it taught be valuable lessons: 

 1. Don’t trade more then you can afford to loss
2.	if you do trade on a margin make sure you have the liquidity to back it up in full
3.	don’t be emotionally connected to your investment 

Since then I’ve still been DCA’ing and look at Eth differently. It’s a tool, it has an awesome and diverse utility, use it to invest, collect NFT, yieldfarm, stake, and to help yourself and others. As another Defi summer approaches practice caution and be smart with your money. As they used to say
 “came to get rich, stayed for the Tech!” 

Lastly this community has been great. I have spent a lot of time on here reading and observing but felt I needed to share my story and start contributing more. Cant tell you guys how many times coming to this thread has helped me.

Thank you to the moderators and everyone in this community, can’t wait to see us at the top! 

**TL;DL**

Thought BTC was cool, found out Eth was cooler. Got liquidated, learned valuable life lessons. Came to get rich, stayed for the Tech. Thank you to everyone in this community!",2021-05-22 07:35:22
AusIV,"I don't believe any of the validators you named are still active validators.

Parity tech quit validating Kovan before they quit supporting their parity client.

Neither MakerDAO nor Etherscan have signed blocks in the past two years.

The recent miners are Lab10Collective, Shivam_Agrawal, and poa.network.",2021-05-22 09:34:51
squarov,"On this day...

In 2020:

- Reddit [launches](https://www.reddit.com/r/CryptoCurrency/comments/gonjm3/tldr_moons_and_bricks_go_brrr/) Reddit Cash, a Burner Wallet for Community Points using Fuel’s optimistic rollups.
- ETH sticks together at $199 to $207, or ₿0.022 to ₿0.02256.


In 2019:

- Bosch [confirms](https://decrypt.co/7135/why-bosch-ethereum-blockchain-iot) to Decrypt that it is running prototypes using Ethereum.
- Vitalik Buterin [proposes](https://hackmd.io/@HWeNw8hNRimMm2m2GH56Cw/rJj9hEJTN?type=view) an on-chain smart contract-based Ether mixer.
- Smart contract based bug insurance Nexus Mutual [goes live](https://medium.com/nexus-mutual/nexus-mutual-launch-how-our-digital-cooperative-will-work-711822c2931d) on Ethereum's mainnet..
- MakerDAO [deploys](https://blog.makerdao.com/update-the-road-to-multi-collateral-dai-kovan-release-v0-2-6) Multi-Collateral Dai v0.26 on the Kovan testnet, featuring a CDP portal, a governance dashboard, testchain DSS deployment scripts and new developer guides.
- ETH [is tethered](https://www.reddit.com/r/ethtrader/comments/brvdth/vitalik_intensifies/) to Kabosu and ₿0.03193 today, from $255 to $245.


In 2018:

- ETH loses value from $700 to $648, and some patience from ₿0.08331 to ₿0.08085.


In 2017:

- The Enterprise Ethereum Alliance [announces](https://entethalliance.org/enterprise-ethereum-alliance-release-05-19-2017.pdf) 86 new members, including Broadridge, DTCC, Deloitte, Infosys, ​Merck KGaA​, MUFG, National Bank of Canada, Rabobank, Samsung SDS, StateStreet, Toyota and many innovative startups in the Ethereum Ecosystem.
- ETH is in for a daytrip from 158, to 200, an back to $169, holding onto ₿0.07756 to ₿0.08126.


In 2016:

- ETH eats pizza at $14.3, with added toppings like ₿0.03168 or ₿0.03252.

-------------
^(compiled via pwr.news - )[^(more info)](https://pwr.news/blog/on-this-day-in-ethereum-workflow/)",2021-05-22 14:17:01
Laafheid,"Add option to skip connecting wallets for if people just want to look at colateral (I could see it, via the link provided above in the comment thread, but got held when trying to go there via MakerDAO website)

Is ofcourse minimal, but might be a slight barrier to entry if you're just looking around.",2021-05-22 17:39:32
tatooine,"I mean this is in the absolutely least shilling kind of way, I don’t hold any and have no skin in the gam, but MakerDAO seems to have an interesting plan with Dai as a stable coin in that they’re attempting to back it with real collateral. Minimally speaking, it’s a plan for a stable coin that isn’t being minted randomly by a dude in a bunker. Who knows how it will all play out, but at least it’s a start.",2021-05-22 23:53:27
ethereumflow,"Has anyone here tried ONTO wallet? I just sold my ONG and remembered how awesome their wallet is, it’s better since the update too. 

Ontology are partnered with Binance and have added support for BSC and Pancakeswap to go along with the Ethereum dapp support they already offered. 

Using ONTO wallet you can have access to Ontology DeFi WING , Binance Smart Chain dapps and Ethereum dapps such as Uniswap, 1inch, SushiSwap, AAVE, MakerDAO and more all from the convenience of your mobile device. They also support Polkadot and NEO. 

Worth a look if you want to explore cool new options rather than dwell on red charts. You do not need ONT or ONG to use ONTO wallet",2021-05-23 00:09:18
mashtun25,"That’s fine, but it’s being used by someone for something in the real world.  When someone lends or borrows on Aave, for instance, they use smart contracts.   Now you might say that Aave is taking advantage of stupid people.  But the fact that the demand for Aave’s services keeps steadily growing, I don’t think it’s just nobodies, it’s real world demand.  The borrowers and lenders must be finding something useful to do there.  I think to dismiss it out of hand as speculation on tokens is intellectually lazy.  MakerDao is another example.   Last I heard they were branching out into loans for real estate, which is another real world example.",2021-05-23 00:52:57
tatooine,"I hear you on that, and we basically just witnessed exactly what you described- in the latest crypto-crash saga. Surprisingly, MOONCUM or whatever the latest shitcoin is to hit the market turns out to not be worth anything. Shocking. That said, I think the intent of MakerDAO is to do exactly what you say, get real things, not funbux™, as collateral. There's still a ways to go, like, who's going to put up 150% of a real asset as collateral? Yeah a long way, but I could see it being possible, if things go well.",2021-05-23 02:45:41
Gregarious_Larch,"For invention, protocol, and theory, you would probably want to start with the [bitcoin whitepaper](https://bitcoin.org/en/bitcoin-paper) or the more current [ethereum yellowpaper](https://ethereum.github.io/yellowpaper/paper.pdf). Most projects have a document like this you can look at. Also most healthy projects are under active development so you can check their github or whatever for more details.

As far as investor backing is concerned, I'd say generally it happens one of three ways:

* Projects are useful, gain support, and then later tokenize for various reasons (the graph)
* The project starts with a token for some reason or another (makerdao) and the value is in the function of the project
* The currency appeals to people enough (usually because of a specific behavior) that they start buying and using it (bitcoin, monero)

These aren't mutually exclusive. For example, ether might appeal to people as a currency while ethereum appeals to them as a distributed computing project.

Also some coins are [basic templates with no engineering, theory, or invention involved that get backing (as in fiat investment) via meme fads and tiktok influencers](https://goto.etherscan.com/address/0x95ad61b0a150d79219dcf64e1e6cc01f0b64c4ce#code) but assumedly that's not what you're talking about.",2021-05-23 09:05:05
thepaypay,"ETH is bigger than Vitalik. Ethereum has thousands of devs working together across the planet. People  off all different walks of life. Different political views, nationalities, races, and religions. Ethereum's golden child dapp right now **defi,** was made and sustained totally independent of Vitalik. He has no roles or responsibilities in MakerDao, Uniswap, Yearn, Compound, Aave. Him and others devolved the framework for others to build on. But now its much bigger than one single person.",2021-05-23 09:38:38
DegreeBroad2250,Makerdao.... good for long term I guess,2021-05-23 11:35:04
theviktorious1,"Perhaps fiat was not the best example. My main confusion was about the &gt;100% collateral. I came across a Q&amp;A where BlockFi team brought up an example with 120% fiat collateral (below). And my understanding is that MakerDAO is at 150% collateral (but not sure if fiat can be used as collateral to borrow DAI). 

https://coincentral.com/blockfi-review/

What happens if suddenly everyone defaults on their cryptocurrency loans?:  “When we lend crypto assets to generate yield, we have an extremely thorough risk management and credit analysis process. We only primarily lend to large, well-capitalized, institutional borrowers, or to counter-parties willing to post collateral and provide the ability to margin call them on a 24/7 basis.”  

“What that means is, if we are lending $1M worth of BTC to Firm XYZ, Firm XYZ collateralizes the loan (typically ~120%) by giving us ~$1.2M USD. If the loan were to then enter margin call and the borrower was unable to provide additional collateral (default), we would use their USD collateral to buy crypto.”",2021-05-23 11:58:16
AutoModerator,"Hello /u/Little_Beautiful_587! I regret to inform you that your comment has been automatically removed because your account is too new. This is to help us prevent spam from proliferating this subreddit. But don't fret! Our threshold for commenting is very low. Try commenting again here in a couple of days.

In the meantime, please familiarize yourself with the [reddiquette](https://www.reddit.com/wiki/reddiquette), as well as /r/MakerDAO's rules, located in the sidebar [or by following this link](https://www.reddit.com/r/MakerDAO/about/rules).

*I am a bot, and this action was performed automatically. Please [contact the moderators of this subreddit](/message/compose/?to=/r/MakerDAO) if you have any questions or concerns.*",2021-05-23 14:15:21
AutoModerator,"Hello /u/Little_Beautiful_587! I regret to inform you that your comment has been automatically removed because your account is too new. This is to help us prevent spam from proliferating this subreddit. But don't fret! Our threshold for commenting is very low. Try commenting again here in a couple of days.

In the meantime, please familiarize yourself with the [reddiquette](https://www.reddit.com/wiki/reddiquette), as well as /r/MakerDAO's rules, located in the sidebar [or by following this link](https://www.reddit.com/r/MakerDAO/about/rules).

*I am a bot, and this action was performed automatically. Please [contact the moderators of this subreddit](/message/compose/?to=/r/MakerDAO) if you have any questions or concerns.*",2021-05-23 14:16:30
dEEtoooo,"rETH can be used like any other ERC20 token and can sit in any ETH wallet.  I plan to hold mine in my Ledger wallet.  It can be used in defi (decentralized finance) for lending, liquidity pools, or collateral purposes, etc.  Something like Uniswap or MakerDAO.  You can make profits like this to fund your LLC if you can somehow tie your rETH assets to an LLC under its control of the wallet keys, yeah that makes sense.  But a traditional bank would not hold the rETH for you - at least I've never heard of that.

I personally would not send it to a centralized exchange or wallet like coinbase or binance unless they officially support rETH, then maybe send it there if you need to exchange it into fiat.",2021-05-23 22:28:12
sHoRtThEvIx1337,"BlockFi just had that major fiasco where they overpaid everyone in BTC and are now trying to get it back, but otherwise I think they're probably ok.

Do your due diligence on each provider - saw some folks here have major problems repay their debts on MakerDAO for instance. I invested in Compound because they're backed by major VC firms here in the USA, I was able to go through their smart contract papers and make sense of them, and their market analytics / explanation of how interest rates are computed are very transparent. Made me feel confident that they weren't a fly-by-night operation.

I think your strategy is good btw bud.",2021-05-23 23:49:53
richardsaganIII,"one of the appeals of mkr is that it counterbalances dai - there is a burn system in place so as the system generates revenues from open valuts and liquidation penalties - it buys back maker from the market and burns it from circulation - it also has a low supply cap of around 1 million tokens.

The maker community encourages people to use the token strictly for voting or delegating (if thats a thing in the mkr community, not sure of this). I am pretty sure they dont want to encourage too much defi use cases other then market making because they typically want to prevent a governance attack (think if an address borrowed a huge supply of MKR from AAVE then used that to vote on certain proposals) - anyways, alot of people like MKR for these reasons and I do too. I tend to watch the ratio for MKR/ETH - to me its the same idea of following the ratio between BTC/ETH. MKR also acts as a guard against the dai peg

Other than voting - i just keep the token in my wallet - but the way it counterbalances multicollateral dai is pretty cool.

[https://makerburn.com/](https://makerburn.com/)

[https://www.tokenterminal.com/terminal/projects/makerdao](https://www.tokenterminal.com/terminal/projects/makerdao)",2021-05-24 01:47:26
SlugThugtorious,"Taken from a comment on that article that says it better than I could:

“Here’s a summary of this article:
Interpret the word “contract” only in the classical legal sense and ignore dApps and decentralized protocols. Note that decentralized smart contracts are less flexible than legal contracts that have humans interpreting/enforcing them. Pretend this is a drawback of contracts in layer 1.
Assert that people will enter into contracts on Lightning Network in the future instead of using the existing legal system (but don’t explain WHY they’d ever do that). Point out that lightning network settles on the blockchain only in the case of dispute. Pretend this solves the inflexibility issue mentioned earlier (but again don’t explain how in any way). Don’t mention that Ethereum also has Raiden &amp; payment channels that can do the same thing.
&lt;/end summary&gt;
Bitcoin could never implement protocols like Compound &amp; MakerDAO without introducing trust assumptions that defeat the whole purpose of decentralization.”",2021-05-24 04:02:30
