author,body,created
squarov,"On this day...

In 2020:

- ErisX [launches](https://erisxinsights.medium.com/erisx-pioneers-first-u-s-based-ether-futures-contract-9d9e0830212f) Ether futures.
- Utah County [signs](http://www.utahcounty.gov/Dept/ClerkAud/DigitalCertCopy.html) marriage licenses on Ethereum.
- Gnosis [leads](https://blog.gnosis.pm/whats-ahead-for-the-openethereum-client-43da126921c2) the initiative to continue Parity as OpenEthereum and releases v3 of the client.
- Justin Drake [proposes](https://ethresear.ch/t/enshrined-eth2-price-feeds/7391) enshrined Eth2 price feeds for fully decentralised oracles.
- Brave [releases](https://brave.com/mjolnir-tooling-for-bat-apollo) Mjolnir, a tool for easily deploying and benchmarking permissioned Ethereum chains.
- There's a smell of fresh ETH at $186, or ₿0.02161.


In 2019:

- ETH only being over $200 for 2 minutes doesn't stop [Chapelle memes](https://www.reddit.com/r/ethtrader/comments/bnhnt2/we_did_it/) from popping up. Also, 1 ETH = ₿0.02689.


In 2018:

- Ethereum futures [go live](https://www.coindesk.com/ethereum-futures-go-live-uk-trading-platform) on UK trading platform Crypto Facilities.
- Request Network is back with another [update](https://blog.request.network/request-network-project-update-may-11th-2018-bitcoin-and-erc20-release-pwc-france-visits-cfa5e1859a63): ERC20 &amp; BTC are now supported on mainnet, and partnerships with PwC France, Blockfolio Signal and MakerDAO.
- ETH so red from $724 to $680, at ₿0.08071.


In 2017:

- ""Bitcoin and Ethereum could become of systemic relevance"", [says](http://www.trustnodes.com/2017/05/11/blockchain-technology-like-bitcoin-ethereum-become-systemic-relevance-says-german-member-european-parliament) a German member of the European Parliament.
- Etherchain [releases](https://github.com/gobitfly/erc20-explorer) a new open source ERC20 token explorer.
- Social blockchain startup Alice starts to use Ethereum to [increase transparency](https://btcmanager.com/blockchain-startup-alice-ethereum-to-help-londons-homeless) on donations towards London’s homeless.
- Jimmy Wales, founder of Wikipedia, [takes](https://twitter.com/jimmy_wales/status/862702017130758146) ETH donations to employ blockchains-centric journalists for their new fact-check news platform, [Wikitribune](https://medium.com/@wikitribune/milestone-update-we-just-hit-10-000-supporters-3abdc5519e70).
- ETH treads water at $90, taking a little water on board from ₿0.05097 to ₿0.04909.


In 2016:

- Ethereum's Viktor Tron [releases](http://swarm-gateways.net/bzz:/swarm) Swarm PoC2: SWORM.
- ETH digs double digits from $9.4 to $10, digs the ratio from ₿0.02081 to ₿0.02208.

-------------
^(compiled via pwr.news - )[^(more info)](https://pwr.news/blog/on-this-day-in-ethereum-workflow/)",2021-05-11 23:12:17
PhiMarHal,"I could use an eli5 myself, but from what I know:

DAI are minted when someone locks crypto assets in a vault. Vaults are overcollateralized compared to the amount of minted DAI, and if the dollar value of that collateral falls too low, that collateral can be liquidated.

The peg is maintained by the MakerDAO governance, adjusting parameters like debt ceiling, interest rate and others to keep Dai as close to the dollar as possible. 

MKR holders get a cut of the fees (vault fees are paid in MKR, and that MKR is burned), but in exchange they're lenders of last resort, through dilution. For example, the protocol minted 20k MKR in March 2020 after a flash crash combined with extreme gas prices triggering liquidations exploited by bots winning collateral auctions for free. AFAIK this was a one time event, and the introduction of more collateral types should lessen the risk of this happening again.",2021-05-12 00:05:13
iamiamwhoami,"There are non volatile cryptos. But I'm skeptical there will ever be a decentralized crypto that controls inflation as well as the Fed. So far the one that comes closest is MakerDAO, but that relies on similar market mechanisms as the Fed does to control USD. The difference is those market mechanisms are enforced via smart contracts as opposed to a central decision making body. They heavily rely on the assumption that the incentives of the people that participate in that market are in line with the dynamics that control inflation/volatility. This works more often than not, but there are market failures and are open to malicious attacks, which there most definitely will be if doing so means massively hurting the US economy.",2021-05-12 02:24:09
Sedierta2,"...so there's democratic control of the protocol (more so on ones like MakerDAO).  That is significantly less political than ""The Fed decided to print 7 trillion dollars to prop up the economy""

The primary core of the cryptocurrency won't change. Bitcoin is capped at 21 million. They can mess with fees, or some devs can fork it and make another coin that has a higher cap, but Bitcoin itself will stay capped.

If a majority of the community votes to increase the cap then it can be done, but that comes back to democratic control without a single political entity making unilateral decisions.",2021-05-12 02:31:15
AutoModerator,"Hello /u/Impressive_Car5617! I regret to inform you that your submission has been automatically removed because your account is too new. This is to help us prevent spam from proliferating on this subreddit. But do not fear! A message has been sent to the moderators, and if this submission is a genuine contribution, then it will be manually approved by the moderators. 

In the meantime, please familiarize yourself with the [reddiquette](https://www.reddit.com/wiki/reddiquette), as well as /r/MakerDAO's rules, located in the sidebar [or by following this link](https://www.reddit.com/r/MakerDAO/about/rules).

*I am a bot, and this action was performed automatically. Please [contact the moderators of this subreddit](/message/compose/?to=/r/MakerDAO) if you have any questions or concerns.*",2021-05-12 02:43:05
RudySanchez-G,Dai smart contracts are indeed open source : [https://github.com/makerdao/dss](https://github.com/makerdao/dss),2021-05-12 03:50:23
stripedbluewallpaper,"so you put up say, 2x ETH in collateral to someplace like MakerDAO, get x ETH worth of DAI, trade it for RPL, and that protects you from any RPL:ETH ratio change because you still have the ETH in the CDP?",2021-05-12 04:57:41
wes_is_ok,"This user is a bot rehashing old posts. You can do a google search on the post or check the user's post history. This is only one of many I've seen on MakerDAO sub recently, pretty annoying.",2021-05-12 05:51:45
tehmidcap,"Were you one of the lucky few that interacted with Uni and got the 400 Uni for free? I'm fascinated by all of the DEX/AMM projects, especially MakerDao and Uni. 

Have you seen OpenDao? I found out about it because Elrond partnered with them -- they're trying to bridge real world assets into the DeFi markets.

The implications of this stuff is astounding once we get through all the growing pains.",2021-05-12 07:23:18
AutoModerator,"Hello /u/realSatoshiSteve! I regret to inform you that your comment has been automatically removed because your account is too new. This is to help us prevent spam from proliferating this subreddit. But don't fret! Our threshold for commenting is very low. Try commenting again here in a couple of days.

In the meantime, please familiarize yourself with the [reddiquette](https://www.reddit.com/wiki/reddiquette), as well as /r/MakerDAO's rules, located in the sidebar [or by following this link](https://www.reddit.com/r/MakerDAO/about/rules).

*I am a bot, and this action was performed automatically. Please [contact the moderators of this subreddit](/message/compose/?to=/r/MakerDAO) if you have any questions or concerns.*",2021-05-12 08:40:16
AutoModerator,"Hello /u/realSatoshiSteve! I regret to inform you that your comment has been automatically removed because your account is too new. This is to help us prevent spam from proliferating this subreddit. But don't fret! Our threshold for commenting is very low. Try commenting again here in a couple of days.

In the meantime, please familiarize yourself with the [reddiquette](https://www.reddit.com/wiki/reddiquette), as well as /r/MakerDAO's rules, located in the sidebar [or by following this link](https://www.reddit.com/r/MakerDAO/about/rules).

*I am a bot, and this action was performed automatically. Please [contact the moderators of this subreddit](/message/compose/?to=/r/MakerDAO) if you have any questions or concerns.*",2021-05-12 08:40:46
rektpq,"Github gw sepi sih cuma dipake kerja doang hahaha. How deep you are currently in the crypto rabbit hole?

Udah jelajahi aplikasinya ethereum kayak uniswap, aave, makerdao? atau lagi hyped untuk layer 2 nya ethereum? :D",2021-05-12 15:44:02
Yeehaooww,"Do you know why MakerDao is using TRB if its useless?

Back in times ETH was cheap and half of their core team did Leave and created ETC instead.

Why do Binance and MakerDao invest and trust in TRB if its useless?

Why are TRB listed on all major and big exchanges if its useless?

Why havent TRB flopped yet BUT instead grew more and more even before the bullmarket if its useless?

I can agree that the team need to work to fix issues Which all coins have, i Also would like the team to fix their website and do better marketing tho.

On all crypto communities there is someone talking bad about the crypto since launch but they all have developed and grew so much.

Posts like this doesnt contribute that much to the community, only negativity, but pls answer my questions.",2021-05-12 18:14:28
AutoModerator,"Hello /u/irongeek_420! I regret to inform you that your submission has been automatically removed because your account is too new. This is to help us prevent spam from proliferating on this subreddit. But do not fear! A message has been sent to the moderators, and if this submission is a genuine contribution, then it will be manually approved by the moderators. 

In the meantime, please familiarize yourself with the [reddiquette](https://www.reddit.com/wiki/reddiquette), as well as /r/MakerDAO's rules, located in the sidebar [or by following this link](https://www.reddit.com/r/MakerDAO/about/rules).

*I am a bot, and this action was performed automatically. Please [contact the moderators of this subreddit](/message/compose/?to=/r/MakerDAO) if you have any questions or concerns.*",2021-05-12 22:57:56
AndreMiras,"- DeFi (Decentralized Finance)
- compound.finance
- MakerDAO
- Aave
- and so much more

But anyways at some point you have to sell (hopefully high) to pay back to loan. Or you pay from your own income, but yeah then having crypto just for the sake of it 🤷

Anyway passive income from crypto is still nice and may not be taxed as high as capital gain tax anyways

Edit: formatting",2021-05-13 00:27:14
cryptOwOcurrency,"&gt; Then, Cardano blockchain will support Solidity so that the same smart contracts can be ported to manage those new tokens.

Cardano will support Solidity only on the KEVM sidechain according to the current roadmap. How would a smart contract system, like for example MakerDAO or Compound, be able to work with its smart contract logic split between Ethereum and Cardano's KEVM sidechain?

&gt; The smart contracts on Etherium will continue to exist but won’t manage the new tokens, so liquidity can move over and then behave in the same manner as before.

Sorry if I am reading your comment wrong, but are you talking about a token that is centrally managed/minted/burned by two separate canonical contracts, one on Ethereum and one on Cardano's KEVM sidechain? Otherwise there will always be one contract that mints, backs, and burns tokens, and that contract will have to live in one place - Ethereum, Cardano KEVM or Cardano proper - and only its tokens will be portable across chains  due to the bridge, but not its token logic.

Thank you for answering these questions, I feel like there is not a lot of documentation for how the ERC-20 converter works, so I like to ask people who are knowledgeable about it.",2021-05-13 02:05:45
karinaQSP,"\-DeFi growth continues to skyrocket  
\-Audits for Cover Protocol, Compound, Idle and MakerDAO  
\-Flashloan attacks + defense at Ethereum Taipei",2021-05-13 03:07:52
halfdayallday123,"Specifically, does the MakerDao always lose money when a loan is liquidated ??? Is it possible for the system to ever profit on this event ? (Aside from the 13% penalty)",2021-05-13 09:03:13
Isabela_Grace,"Well I told him to get in on this class-action case instead whether or not he took action I'm uncertain but I was told by the MakerDAO community what is already happening was ""impossible"" as ""there's no one to sue"" yet the MakerDAO Foundation is settling. So it was verifiably false.

He would still be able to go after them after this as would anyone else affected. Things like this are WHY I didn't invest in Maker, an otherwise strong project.

They should've made this right without any of this and that is why I haven't considered Maker. I get it. You're invested. But these concerns are valid and should be discussed. You should also be concerned about these things if the project is solid it would be of zero importance in the long-run.",2021-05-13 10:05:01
13blues13moons,"The whole point of blockchain is that it's trustless. 

The easiest way to make a trustless community wallet is to use a DAO like MakerDAO does. 

Do any of these coins do that? Nope. 

That says enough for me.",2021-05-13 11:37:24
r-2-eth-2,"****

&gt; Because rETH is ETH, but it's an ETH derivative that outpaces ETH supply growth, by capturing ETH staking rewards. Deposit rETH into MakerDAO. If Rocket Pool has built its code correctly, then rETH should be an extremely favorable collateral type in every DeFi application that also accepts ETH. If you allow ETH collateral, wouldn't you also be interested in a staked ETH derivative asset? Controlling for contract risk, then rETH should actually have favorable risk parameters versus ETH, because of how it's designed to naturally outpace ETH. We should expect some sort of tokenized staked ETH asset like rETH to be added as a collateral to MakerDAO, which means we can borrow DAI against our staked ETH! Collateral = ETH. Your collateral is ETH. Not just ETH, but a derivative of ETH that captures ETH staking issuance and ETH MEV fees.


**Market Conditions**

    ETH:	$3,823.2
    BTC:	$50,239.36
    Ratio:	0.0761
    Date:	May 13 2021",2021-05-13 20:34:05
Funkrocker,ETH collateralized loan thru Makerdao. Convert the dai to whatever stablecoin you want. Throw it in an auto-compounding Yearn vault.,2021-05-13 20:48:09
McBeaster,"Anyone else fascinated trying to understand how all this stuff works? Some of these projects are just so out there it gives me a migrane yet learning about them is addicting. Polkadot, ThorChain, Terra/Mirror Protocol, MakerDAO...they are just insane 😆",2021-05-13 22:24:28
LongForWisdom,Depends a little bit what you mean by workaround. It's not currently possible to vote without paying gas fees. This [reddit thread](https://www.reddit.com/r/MakerDAO/comments/mvt82t/how_anyoneanywhere_can_make_a_difference/) talks about some of the ways to influence decision-making without voting.,2021-05-13 22:39:05
thelonelyboner2,"I think you're actually referring to RPL which was greenlit to be added into MakerDAO early May. rETH isn't available yet, but will be in the next couple months.",2021-05-14 01:08:11
frank__costello,"You should read about decentralized finance (DeFi). Basically building financial primitives on top of blockchains, that don't require people or companies to operate. Most of them are built on top of Ethereum.

Examples:

* Decentralized exchanges, such as Uniswap
* Decentralized borrowing &amp; lending, such as Aave or Compound
* Decentralized stablecoins such as MakerDAO/Dai
* Synthetic assets (synthetic versions of TSLA, gold, etc) such as Synthetix
* Decentralized insurance, such as Nexus Mutual
* Decentralized options, such as Opyn
* Decentralized asset managers, such as Yearn

Most of these projects have tokens, however these tokens are much more similar to ""stocks"" than Bitcoin, which is more similar to gold. These protocols are basically businesses that earn money, but they don't have employees so there's low overhead.",2021-05-14 06:48:48
frank__costello,"&gt; are there examples of this actually happening

Me personally, I used MakerDAO (a decentralized protocol) to take out a loan against my ETH. Used the loan to buy a motorcycle without selling my crypto 🙂",2021-05-14 07:15:17
AdelBliss,"So there's a KeeperDAO? I thought it 
was only MakerDAO",2021-05-14 10:36:05
Shakespeare-Bot,"So thither's a keeperdao? i bethought t 
wast only makerdao

***



^(I am a bot and I swapp'd some of thy words with Shakespeare words.)

Commands: `!ShakespeareInsult`, `!fordo`, `!optout`",2021-05-14 10:36:23
anor_wondo,MakerDAO?,2021-05-14 13:29:16
professorswamp,"I could see dai becoming universal currency for transacting, Its what Telsa should be accepting as payment not bitcoin or dogecoin. There are already dai debit cards available in some places. Seems like it’s mostly used now for interacting with DApps and speculative, leveraged crypto currency 'investments'.   
Risks I see are   
\-Eth 2 changes – if successful these should be hugely beneficial to dai and makerdao but they still carry risk – by changing aspects of the Ethereum blockchain   
\-being overthrown by a competitor decentralised stablecoin (this reducing as adoption increases)   
\-regulators   
\-market crash  
\-I'm also looking to understand more how the interest rates are set and varied, it’s by a voting system for MKR token holders, you would think they would find a way to do it algorithmically.  
  
  
Another concern I have is vault owners, minting dai that don't particularly understand what they are signing up, will lose their collateral and effect the reputation of makerdao and dai, increase the risks of regulations (responsible lending laws and all this type of thing).   
  
Essentially minting Dai is a pawnshop for ether and other crypto, at a variable interest rate with no repayment terms where the interest rolls over into the loan amount and they liquidate your collateral assets if the value drop below threshold, keep 113% and give you back any change.",2021-05-14 19:08:31
nikola_j,"Cheers, Dizzy, super glad to hear that CDP was rescued!

And just to be clear on that import you did - what it means is that your CDP was sitting directly on your wallet account (EOA) for some reason and all you did was move it to a standard MakerDAO dsproxy, a proxy wallet owned and managed by your account.

Tha dsproxy is standard MakerDAO architecture, so it means you can actually manage that CDP wherever you want, for example you can freely switch between using Maker's own Oasis app and DeFi Saver whenever wanted.",2021-05-14 20:06:15
Chocolate_teapot_15,Makerdao has great documentation breaking down the protocol itself but also the solidity code,2021-05-14 22:05:30
ivvf,"Most comments are about LPs but you can always plug into alchemix, makerdao, yearn, curve, harvest and much more",2021-05-15 01:50:15
99Thebigdady,Never heard of Compound/AAVE/makerdao?,2021-05-15 03:27:35
moonbro9000,"Zilliqa isn’t based on the Eth protocol. It was built from the ground up as well and including its Scilla smart contract language.

Here’s a write up I’ve posted before which might give you more information on Zilliqa

Zilliqa has tons of features and partnerships. Sharded blockchain, Peer-reviewed smart contract language designed with security in mind(listed at OOPSLA), multiple dapps in their ecosystem such as Mintable(invested by Mark Cuban), Unstoppable Domains(invested by Tim Draper), HG Exchange (Securities exchange tokenizing other assets), DeFi through Zilswap and other dapps which can be seen here: https://docs.zilliqa.com/ecosystem-growth-report-2020.pdf

And more info about Zilswap and other growth to their ecosystem in their latest growth report here: https://docs.zilliqa.com/ecosystem-growth-report-2021-Q1.pdf

Zilliqa has an incubation program called ZILHive(https://zilhive.org/), providing grants to have more dapps built on Zilliqa.

Soon, Zilliqa will have another dapp released called Pillar Protocol(https://pillarprotocol.com/), similar to MakerDao on Ethereum.

Another exciting item is Zilliqa will have a bridge between Zilliqa and other blockchains in sometime Q2 so other tokens such as ETH will be available to be wrapped and used on the Zilliqa chain.

Also, they’ve had a recent partnership with Polaris sports which works with some high-profile sports stars like James Rodriguez and Cristiano Ronaldo.

Another significant partnership is Xfers which is considered the PayPal of Southeast Asia, and Xfers is partnered with PayPal, Gemini and Coinbase. Zilliqa created a stable coin used on the Zilliqa chain for Xfers. Also, Zilliqa and Xfers performed a pilot test to demonstrate how the XSGD stablecoin can enable the transfer of event risks via Zilliqa blockchain-based smart contracts. Related press release: https://www.xfers.com/sg-blog/xfers-pilots-risk-transfer-applications-with-zilliqa-and-cerchia

In the past, Zilliqa has had a partnership with Mindshare and did some test pilots with PepsiCo for some campaigns. Relevant info here: https://www.mindshareworld.com/news/mindshare-to-launch-first-phase-of-blockchain-pilot-on-the-zilliqa-platform/

https://www.thedrum.com/news/2019/05/06/pepsico-and-mindshare-programmatic-blockchain-test-drives-28-efficiency-lift

Also, in the past, Zilliqa has worked with MAS Singapore government to integrate the use of Zilliqa mentioned here: https://www.mas.gov.sg/-/media/MAS/ProjectUbin/Project-Ubin-DvP-on-Distributed-Ledger-Technologies.pdf?la=en&amp;hash=2ADD9093B64A819FCC78D94E68FA008A6CD724FF

Lastly, Zilliqa Capital investment hub for Zilliqa has some pretty impressive members: https://twitter.com/zilliqacapital/status/1369887464161165314?s=20

Some members have a lot of Venture Capitalist experience and one of the members is an ex-VP of Goldman Sachs, an investment bank company.",2021-05-15 08:17:35
PhiMarHal,"The emission schedule for ALCX can be found here: https://alchemix-finance.gitbook.io/alchemix-finance/token-distribution/alcx-monetary-policy

The token itself will be used as governance. ALCX holders might get a % of protocol revenue, while being lenders of last resort (minting ALCX and diluting holders) in case of a protocol bug/hack. Fairly similar to MKR for MakerDAO.",2021-05-15 12:43:52
wanderingcryptowolf,"I'm reposting here for exposure, please do join the thread if you've an interest or something to share. 

u/logristhebard , if I might pick your brain for a moment, in regards to Alchemix. 

I am trying to evaluate the prospective value of the coin. Conventional approaches such as determining a P/E ratio at present are incredibly difficult as they are in beta, and any sort of prospective earnings I might imagine are at the mercy of a multitude of moving parts. 

Secondly, there is an inaccuracy displayed on CMC regarding total and circulating supply; and in their white paper, I cannot see mention of tokenomics. 

Thirdly, I am unsure how trusted gate.io is as an exchange in the event I purchase some. 

Hopefully you see this! 

Abrazos.

EDIT: compliments of u/PhiMarHel

The emission schedule for ALCX can be found here: https://alchemix-finance.gitbook.io/alchemix-finance/token-distribution/alcx-monetary-policy

The token itself will be used as governance. ALCX holders might get a % of protocol revenue, while being lenders of last resort (minting ALCX and diluting holders) in case of a protocol bug/hack. Fairly similar to MKR for MakerDAO.",2021-05-15 13:07:13
MorganZero,"The most macro-meta-bullish thing I see about DeFi, is that the smart contracts still function during a bear market. The code is already written, it’s there.

Sure, nobody is going to be happy if 90% of their portfolio is wiped out on the way down to Goblin Town, but my point is, shit like Alchemix still works. If you wanna take 20k and throw it into ALCX, you’re still getting that 10k loan at zero risk of liquidation. You can still use the money legos. Some of the yield won’t be as attractive during a bear, but the tools are still there to use. The actual spot price of ETH is irrelevant when it comes to using the DeFi tools.

Edit: I’ve heard MakerDAO might be in bad shape during a bear, but it was just chatter. I haven’t done the DD on that. Can anyone more knowledgeable than me explain why a bear market could seriously hurt DAI?",2021-05-15 16:14:32
